tweet_id,user,text,num_comments,num_retweets,num_views,timestamp
1421551677526749188,@Spiro_Ghost,The Ones That Want You To Take The mRNA Shots What To Connect You To The (IoB) The Internet of Bodies Part of the 4th Industrial Revolution... Coincidence?,"1,220","9,910",0,2021-07-31T19:21:45.000Z
1643978221015429122,@Spiro_Ghost,Looks Like Everything Is Going According To Plan... CBDC's Are on Standby... Problem - Reaction - Solution…,23,304,17.8K,2023-04-06T14:05:26.000Z
1643841488034615296,@Spiro_Ghost,The Church Committee Exposed The CIA's 'Operation Mockingbird' Back In The 70's How The CIA Infiltrated Domestic News Organizations & Illegally Used Weaponized Propaganda Against US Citizens... The Operation Seems To Be Alive & Well Today Likely Under A New Code Name...,8,135,"8,073",2023-04-06T05:02:06.000Z
1643829136513957890,@Spiro_Ghost,Most Americans Have No Idea Their Country & Their Life Is About To Change Dramatically... The Entire Global Financial & Economic System Is About To Change... By Design... CBDC's Are on Standby...,23,216,22.8K,2023-04-06T04:13:01.000Z
1636572453249093632,@Spiro_Ghost,Banksters Are Just As Evil As Big Pharma... Both Collaborate With Governments Against The People...,37,188,11.5K,2023-03-17T03:37:33.000Z
1636549225403269124,@Spiro_Ghost,The Fastest Way To End The Global Mass Vaccination Campaign Is... Eliminate Big Pharma's Liability Exemption! They Would Pull Their Shots ASAP!,37,310,13.6K,2023-03-17T02:05:15.000Z
1636516991493357568,@Spiro_Ghost,Covid-1984 Greatly Accelerated The Climate Change Agenda The Social Engineers Rebranded Eugenics / Population Control As Climate Change This Is A Global Technocratic Coup Designed To Enslave Humanity Disguised As A Plan To Save The Planet Full Video: https://corbettreport.com/why-big-oil-conquered-the-world-video/…,17,169,17.6K,2023-03-16T23:57:10.000Z
1636222938100928512,@Spiro_Ghost,"America Is The Weakest It's Ever Been Right Now... You Cannot Mess Thing Up This Bad on Accident, This Is By Design... The Goal Is To 'Restructure The Global Order' Into A New World Order... #BuckleUp #Resist",67,340,35.7K,2023-03-16T04:28:42.000Z
1635157555210240001,@Spiro_Ghost,Once You Realize The Ones Behind Covid... Are The Same Ones Behind The Looming Financial Crisis... Things Begin To Make Sense...,17,273,18.5K,2023-03-13T05:55:15.000Z
1635137924609245184,@Spiro_Ghost,Notice How Nobody Is Talking About Pfizer? Or The 'Vaccine' Now? Or How The US Funded The Creation of Covid...? Or Countless Other Examples...? All Eyes On The Financial System... This Is The Next Phase of Manufactured Crisis To Facilitate The Transition Into The Great Reset,78,823,56.7K,2023-03-13T04:37:15.000Z
1634391919488045056,@Spiro_Ghost,This Looming Financial Crisis Will Make 2008 Look Like Childs Play IMO... We Are on The Precipice of A Paradigm Shift... The Window To Prepare Is Closing...,32,191,50.9K,2023-03-11T03:12:53.000Z
1634252544825511936,@Spiro_Ghost,Controlled Demolition… Looting The Current System of Control As They Burn It To The Ground… New System of Control Is on Standby…,6,85,10.8K,2023-03-10T17:59:04.000Z
1634228897058549762,@Spiro_Ghost,Watch: ICBM Nuclear Warhead Convoy Moving Through Great Falls Montana... Source: https://youtube.com/watch?v=KRB4ocyZSE8&t=2s…,10,56,"8,570",2023-03-10T16:25:06.000Z
1634025998760161282,@Spiro_Ghost,The Undisputed King of Mis & Disinformation...,20,113,12.3K,2023-03-10T02:58:51.000Z
1633692197584527360,@Spiro_Ghost,Roseanne Barr Weighs In on The Covid Shots...,29,254,36.7K,2023-03-09T04:52:27.000Z
1633670713386364928,@Spiro_Ghost,Dr. Fauci Said During Sworn Testimony “I Don’t Recall” or “I Do Not Recall” 174 Times... Tell Me You Are Guilty Without Saying You Are Guilty...,4,44,"7,189",2023-03-09T03:27:04.000Z
1633526149560299520,@Spiro_Ghost,Pima GOP Chairman Dave Smith Blasts Pima County Board of Supervisors… Calls Out ‘Dr Mengele’ aka @mattheinzmd For Calling Unvaccinated People Murderers & More… Matt Heinz Still Attends Remotely…,12,66,"6,548",2023-03-08T17:52:38.000Z
1632971640643502080,@Spiro_Ghost,This Isn't Just Random 'Domestic Terrorism' Caught on Video.. This Looks Like A Destabilization Operation.. Similar Tactics Are Used By Intel Agencies To Destabilize Nations Before They Overthrow Them.. There Is An Insurgency In America Right Now... America Is Under Attack!,36,195,22.5K,2023-03-07T05:09:12.000Z
1626965604006600707,@Spiro_Ghost,I'm Old Enough To Remember That Time... The US Blew Up The Nordstream Pipeline Which Provided Natural Gas To Europe For People To Heat Their Homes... In The Middle of Winter... Talk About Crimes Against Humanity...,62,312,37.7K,2023-02-18T15:23:22.000Z
1626921538590228484,@Spiro_Ghost,This Is What A Digital ID Looks Like…,37,330,28.3K,2023-02-18T12:28:16.000Z
1626704097629057029,@Spiro_Ghost,Many People Fail To Understand... They Are Trying To Change What It Means To Be Human... There Is No Coming Back From This... You Cannot Be 'Un-Modified',59,373,52.6K,2023-02-17T22:04:14.000Z
1626647702854565888,@Spiro_Ghost,The EPA And The Government Lied To Us About The Air Quality In NYC After 9/11... People Today Are Still Dying From That Exposure... Why Should We Believe Them Now About Ohio? https://corbettreport.com/911-suspects-christine-todd-whitman/…,27,175,20.1K,2023-02-17T18:20:08.000Z
1626635238494584832,@Spiro_Ghost,You Really Think They Care About Climate Change?,80,601,33.7K,2023-02-17T17:30:36.000Z
1626422359921152001,@Spiro_Ghost,They Wanted Us All Looking In The Sky For UFO's... While This Was Happening Right Under Our Nose...,16,181,18.1K,2023-02-17T03:24:42.000Z
1626300536093048832,@Spiro_Ghost,The Same Ones That Wanted To Ban Your Gas Stove To Save The Planet... Are Silent About The Ohio Disaster & The Nordstream Pipeline Sabotage Because It's Not About Saving The Planet & It's Not About Climate... It's About Enslaving Humanity!,74,"1,143",51.9K,2023-02-16T19:20:37.000Z
1626279444880166913,@Spiro_Ghost,. @elonmusk At The World Government Summit 2023... Explaining His Purchase of Twitter Is Meant To Accelerate 'X' The Everything App... A Key Objective Is To Verify As Many People As Possible... An Identity Layer of The Internet... Like A Digital ID...,116,647,162.5K,2023-02-16T17:56:49.000Z
1625947762285223938,@Spiro_Ghost,WOW: Man Calls @GarretLewis Show Saying His Pregnant Wife Was Pressured To Get The Covid Shot By Her Doctors... Claims The Shot Caused His Wife To Lose Their Twins! Meanwhile Gov Official @mattheinzmd Wants Doctors To Be Reported If They Don't Push The Shot on Pregnant Women!,12,95,11.2K,2023-02-15T19:58:49.000Z
1625927064368054274,@Spiro_Ghost,People Want Medical Health Freedom NOT Medical Martial Law... Arizona State Rep. Rachel Jones @RJ4arizona Shares How The Mandates Ruined The Lives of Many People... Many Were Injured & Some Did Not Survive After Being Mandated To Roll Up Their Sleeve...,8,107,13.3K,2023-02-15T18:36:35.000Z
1623803497157378048,@Spiro_Ghost,Anytime I Hear 'Sustainable' I Think UN Agenda 21... Elon Claims To Be Anti WEF... But He Sure Promotes The Same Agendas...,34,39,"9,460",2023-02-09T21:58:17.000Z
1623802063321985024,@Spiro_Ghost,Nothing To See Here...,6,49,"6,469",2023-02-09T21:52:35.000Z
1623786473786060800,@Spiro_Ghost,"Congressman @RepMattGaetz At Today's Weaponization of The FBI Hearing... Gaetz Talks @Project_Veritas , Pfizer, Google, Soros & More...",6,66,"7,205",2023-02-09T20:50:38.000Z
1623755422598574080,@Spiro_Ghost,When I See Digital ID Trending It Tells Me 2 Things... 1. Their End Game Is Rapidly Approaching... 2. People Are Waking Up! We Need To Resist Like Our Freedom Depends On It! Because It Does...,45,548,33K,2023-02-09T18:47:15.000Z
1623566694051618816,@Spiro_Ghost,DARPA Has Been Funding Pfizer For 'Groundbreaking Vaccine Research' For A Long Time... This Is A Military Operation... Kinda Explains Why Pfizer Enjoys A Liability Exemption... https://money.yahoo.com/2013-12-05-darpa-hires-pfizer-to-perform-groundbreaking-vacci.html…,113,"2,122",128.6K,2023-02-09T06:17:18.000Z
1623526130644054016,@Spiro_Ghost,"If @Project_Veritas Removes @JamesOKeefeIII It Would Devastate Project Veritas... I Bet Pfizer, Google & Everyone Else They've Exposed Would Like That Very Much... I'm Sure It's Just A Coincidence... I Stand With James O'Keefe...",25,130,18.3K,2023-02-09T03:36:07.000Z
1623556371173232641,@Spiro_Ghost,I Also Greatly Appreciate & Respect All of The Work @Project_Veritas Has Done...,4,17,"3,829",2023-02-09T05:36:17.000Z
analytics,user,text,0,0,0,0
1623514004114264064,@Spiro_Ghost,With Everything That Has Been Revealed Recently I'm Sure They Are Desperate For A Distraction... The Time Is Ripe For A False Flag IMO...,42,140,33.9K,2023-02-09T02:47:56.000Z
1622821766711353344,@Spiro_Ghost,While The Grammy's Worship Satan... Brought To You By Pfizer... The Covid-1984 Best Music Video Award Goes To...,17,185,21.3K,2023-02-07T04:57:14.000Z
1622736180759474180,@Spiro_Ghost,Did The CEO of Moderna Say? He Knew There Was Going To Be A Pandemic?,180,"2,283",243.1K,2023-02-06T23:17:09.000Z
1622441166091472896,@Spiro_Ghost,You Cant Make This Up! Que The Pfizer Ad Right After The Satan Performance...,51,407,55.4K,2023-02-06T03:44:52.000Z
1622055525654614016,@Spiro_Ghost,In My Opinion All of The Politicians That Attended WEF Davos Should Not Be Trusted... I Consider Them All Traitors... Prove Me Wrong...,96,592,36.2K,2023-02-05T02:12:28.000Z
1620652676160843776,@Spiro_Ghost,"Russia Claims To Have Recovered 20k+ Documents of US Funded 'BioLabs' In Ukraine... Conducting Experiments on Ukrainian Military Members, Prisoners, Drug Addicts & Others... Western Pharma Companies Also Said To Be Involved In The 'Research' https://rt.com/russia/570714-russia-ukraine-pentagon-biolabs/…",46,222,23.8K,2023-02-01T05:18:02.000Z
1620446743757488130,@Spiro_Ghost,Never Forget: They Tried To Bribe Us… They Threatened Us… They Tried To Force Us… They Lied To Us!,17,112,"9,169",2023-01-31T15:39:44.000Z
1620285152617459712,@Spiro_Ghost,"WATCH: Palantir, One of The Most Powerful Software Companies Globally Seed $ From In-Q-Tel, First Clients Were CIA, FBI & DoD CEO Said At Davos That Palantir & The Intel Agencies Are The Reason The Left Is In Power They Are Using This Against All of Us! https://weforum.org/events/world-economic-forum-annual-meeting-2023/sessions/a-conversation-with-alex-karp-ceo-of-palantir-19171a3c7f?gclid=Cj0KCQiAz9ieBhCIARIsACB0oGJPQ9ELQ8OiI67Gn4MqOC8Y6T_3FZjDoOLaS5PJRtUAVo9tb-rtQb8aAghhEALw_wcB…",70,598,79.1K,2023-01-31T04:57:38.000Z
1620075072508817410,@Spiro_Ghost,Renowned MIT Professor and Drug Safety Analytics Specialist Calls for Immediate Suspension of ALL mRNA COVID Shots…,2,61,"4,089",2023-01-30T15:02:51.000Z
1619930489707700225,@Spiro_Ghost,Klaus Schwab Is More Powerful Than Presidents of Countries... Because He Has Presidents of Countries In His Pocket...,63,201,16.6K,2023-01-30T05:28:20.000Z
1619577843901693953,@Spiro_Ghost,Never Forget... They Literally Changed The Definition of Herd Immunity... Completely Removing Natural Immunity... The Thing Is... Their 'Vaccines' Do Not Provide Immunity...,42,496,26.6K,2023-01-29T06:07:02.000Z
1619579633355341825,@Spiro_Ghost,The Only Guaranteed Immunity Is Reserved For The Vaccine Manufacturers & Those Who Administer Them... This Needs To Change!,5,48,"4,722",2023-01-29T06:14:09.000Z
1619560634278084611,@Spiro_Ghost,When Reality Is Stranger Than Fiction...,16,135,16K,2023-01-29T04:58:39.000Z
1619547145560018944,@Spiro_Ghost,How To Stop The Experiment Over Night... End The Emergency Use Authorization & Big Pharma Will Pull The Clot Shot Immediately... The Only Emergency Is The Experimental Crap They Are Pumping Into Us...,27,188,31.4K,2023-01-29T04:05:03.000Z
1619458202487377920,@Spiro_Ghost,I'm Not A Doctor or Scientist But... To Me The Benefit Does NOT Outweigh The Risk... #StopTheShot,6,38,"6,537",2023-01-28T22:11:38.000Z
1617614358099677184,@Spiro_Ghost,"People Are Suffering Severe Adverse Reactions From The Shots So Devastating, Some Choose To Take Their Own Life Canada Is Even Sanctioning Assisted Suicide of The Vax Injured While Govs & Big Pharma Turn Their Backs on Us Groups Like @React19org Want To Help. Please Share!",10,141,"8,582",2023-01-23T20:04:51.000Z
1617614893146071047,@Spiro_Ghost,See The Full Interview With @BrianneDressen & @JanJekielek Here:,2,31,"3,288",2023-01-23T20:06:59.000Z
1617597106444697606,@Spiro_Ghost,Did WEF Even Mention The Great Reset In Davos 2023? Just Because They Didn't Mention It Doesn't Mean Its Not Moving Forward... Looks Like Damage Control To Me...,19,55,"8,558",2023-01-23T18:56:18.000Z
1617586194698600453,@Spiro_Ghost,If Big Pharma Could Be Held Liable... There Would Be No Covid Shot...,8,65,10.9K,2023-01-23T18:12:56.000Z
1617576544859308050,@Spiro_Ghost,Do You Know Anyone Who Was Injured After Rolling Up Their Sleeve?,45,71,15.1K,2023-01-23T17:34:36.000Z
1617570254150053888,@Spiro_Ghost,What Ever Happened To ‘Trust The Science’ ? You Don’t Hear That Anymore...,71,118,19K,2023-01-23T17:09:36.000Z
1617552730805133314,@Spiro_Ghost,"Most People Probably Never Heard of Myocarditis Before The Covid Shot Came Out... Now, It's Trending on Twitter...",36,382,29.6K,2023-01-23T15:59:58.000Z
1617261587701850112,@Spiro_Ghost,NEW: Davos WEF 23 Vid About Transforming Medicine & Redefining What It Means To Be Human... They Want To Integrate Tech Into Our Bodies & Joke About 'Still Needing Humans' The Same One's That Tried To Mandate mRNA Injections... Do You See Where This Is Going? #TransHumanism,176,"1,072",156.8K,2023-01-22T20:43:04.000Z
1616850094623711234,@Spiro_Ghost,Big Pharma Signed Secret Contracts With Governments... Granting Them Immunity From Liability If Anything Went Wrong With The Covid Shots... Well... It Went Wrong... We Demand Accountability!,22,201,12K,2023-01-21T17:27:56.000Z
1616833045570650112,@Spiro_Ghost,Davos 2023 May Have Ended But Their Agenda Has Not... Now All The WEF Puppets Will Head Home To Implement What Was Discussed Behind Closed Doors...,26,191,17.3K,2023-01-21T16:20:12.000Z
1616824760436166659,@Spiro_Ghost,All This For A Virus That Has A 99+% Survival Rate... This Was Never About Your Health & Safety...,12,145,10.9K,2023-01-21T15:47:16.000Z
1616815255719645184,@Spiro_Ghost,Will The Corrupt Corporate Media Report on This?,13,54,10.2K,2023-01-21T15:09:30.000Z
1616813481357119488,@Spiro_Ghost,People Will Never Again Trust Their Gov or Big Pharma...,14,148,12.6K,2023-01-21T15:02:27.000Z
1616641608983658497,@Spiro_Ghost,Sudden Cardiac Arrest Is The Leading Cause of Death In Young Athletes... Covid Doesn't Do This... This Is Not Normal... What Has Changed?,54,215,31.9K,2023-01-21T03:39:29.000Z
1614328197948100608,@Spiro_Ghost,This Global Mass Vaccination Program Has Done More Damage To The Faith & Credibility of The Medical System More Than Anything... It May Never Recover...,457,"2,093",207.3K,2023-01-14T18:26:49.000Z
1614311155107004417,@Spiro_Ghost,Why Is The Director of The FBI Going To WEF Davos? Probably For The Same Reason He Goes To The CFR...,93,812,56.9K,2023-01-14T17:19:06.000Z
1614297372904783872,@Spiro_Ghost,Even The Big Pharma Sponsored Media Is Having To Admit It Now... It's That Bad! It's Time To Remove Big Pharma's Liability Exemption! @RepThomasMassie @RepAndyBiggsAZ @EliCraneAZ,5,93,"7,891",2023-01-14T16:24:20.000Z
1614292137239248897,@Spiro_Ghost,Another Doctor Calls For The Covid Jab To Be Suspended... This Time on BBC News!,7,67,"8,055",2023-01-14T16:03:32.000Z
1614115389172252674,@Spiro_Ghost,This Is Why You Do Long Term Studies... If They Cared About Your Health They Would Pull The Shot Immediately... This Is The Largest Experiment In Human History...,11,74,"8,793",2023-01-14T04:21:12.000Z
1614017417591783425,@Spiro_Ghost,BREAKING: The ATF & DOJ Just Dropped A New 'Rule' That Makes Millions of Law Abiding Gun Owners Criminals... https://justice.gov/opa/pr/justice-department-announces-new-rule-address-stabilizing-braces-accessories-used-convert…,54,185,40.1K,2023-01-13T21:51:54.000Z
1613966429656694784,@Spiro_Ghost,Even Though I Suspect @elonmusk Is Part of The NWO... Twitter Sure Is A Lot More Fun Since He Took Over... lol,111,116,36.8K,2023-01-13T18:29:17.000Z
1613961676054843392,@Spiro_Ghost,It's Past Time To End The Covid Emergency Declarations... Declaring An Emergency Activated Special Funding & Provided Big Pharma Exemptions From Liability While Rushing To Market A Experimental Gene Therapy Treatment It's Time To End Covid-1984... And Hold Those Accountable!,6,67,"6,281",2023-01-13T18:10:24.000Z
1613956384587907082,@Spiro_Ghost,If Fauci Is Science... I Guess I'm Anti Science...,50,54,"8,596",2023-01-13T17:49:22.000Z
1613947133383643148,@Spiro_Ghost,Climate Change... Not Experimental Shots...,20,90,"7,458",2023-01-13T17:12:36.000Z
1613924957821583363,@Spiro_Ghost,It's Not About Climate... It's About Control...,11,153,"7,728",2023-01-13T15:44:29.000Z
1613920209303109634,@Spiro_Ghost,They Already Modified Our Fruits & Vegetables... Now They Want To Modify The Meat We Eat...,17,122,"8,739",2023-01-13T15:25:37.000Z
1611598550625927169,@Spiro_Ghost,The New Speaker of The House Kevin McCarthy...,144,536,79.5K,2023-01-07T05:40:11.000Z
1611603222052872192,@Spiro_Ghost,World Economic Forum Founder Klaus Schwab Bragging... WEF Puppets Penetrate Governments Around The World...,39,287,22.3K,2023-01-07T05:58:44.000Z
1611587103694913537,@Spiro_Ghost,"They Should Be Holding Hearings on Pfizer, Moderna, The CDC, NIH & FDA Right Now...",37,148,16.4K,2023-01-07T04:54:42.000Z
1611563727148691456,@Spiro_Ghost,It's Time To Remove Big Pharma's Liability Exemption! People Need To Go To Prison...,17,210,19.4K,2023-01-07T03:21:48.000Z
1611074884657979395,@Spiro_Ghost,Look Who Is Back! @davidicke,159,850,121.4K,2023-01-05T18:59:19.000Z
1611056222563667985,@Spiro_Ghost,It Should Be @KariLake & @AbrahamHamadeh Being Sworn In To Office Today... Arizona Got Robbed IMO...,249,558,162.8K,2023-01-05T17:45:10.000Z
1611049111897231360,@Spiro_Ghost,What Could Go Wrong?,32,86,13.3K,2023-01-05T17:16:54.000Z
1610866093056212992,@Spiro_Ghost,Good To See @RepBoebert Stand Her Ground... Hannity Sucks Anyways...,18,24,"9,665",2023-01-05T05:09:39.000Z
1610757918365782023,@Spiro_Ghost,Did You Know @TulsiGabbard Is A World Economic Forum Young Global Leader?,101,145,37.4K,2023-01-04T21:59:48.000Z
1610795677516288000,@Spiro_Ghost,Recently @TulsiGabbard Publicly Denied Any Connection To The World Economic Forum...,13,34,"6,884",2023-01-05T00:29:51.000Z
1610778537878757377,@Spiro_Ghost,Hi @elonmusk Why Is @IceAgeFarmer Still Banned?,66,264,39.2K,2023-01-04T23:21:44.000Z
1610738294941155342,@Spiro_Ghost,Congresswoman @RepMTG Getting Ratio'd Hard For Supporting McCarthy!,25,68,12.1K,2023-01-04T20:41:50.000Z
1610714420849643520,@Spiro_Ghost,Congresswoman @laurenboebert Calls Out Trump & McCarthy on House Floor...,11,48,11.4K,2023-01-04T19:06:58.000Z
1610687785064697876,@Spiro_Ghost,If Big Pharma's Liability Exemption For Covid Shots Was Removed... I Bet They Would Pull The Product Immediately...,58,337,21.7K,2023-01-04T17:21:07.000Z
1607160075998855168,@Spiro_Ghost,Fun Fact: Elon's Grandfather Was A Leader of The Technocracy Movement In Canada... A Society Which Envisions A Ruling Class Consisting of A Scientific Elite... Elon Has Openly Promoted Building A Martian Technocracy... https://newsinteractives.cbc.ca/longform/technocracy-incorporated-elon-musk…,34,97,25.7K,2022-12-25T23:43:16.000Z
1607139513838571520,@Spiro_Ghost,To Be Fair... Elon Pushed Back & The WEF Was Quick To Respond...,163,662,243.5K,2022-12-25T22:21:33.000Z
1607133768837382145,@Spiro_Ghost,WEF 'Agenda Contributor' Page...,16,66,18.2K,2022-12-25T21:58:44.000Z
1607122958299926528,@Spiro_Ghost,Elon Musk Said He Declined To Join The WEF... Do You Believe Him?,233,164,74.4K,2022-12-25T21:15:46.000Z
1607110242235711494,@Spiro_Ghost,A #Covid1984 Public Service Announcement... Counterterrorism Units Are Monitoring Online 'Conspiracy Theories' To Keep You Safe... https://twitter.com/backtolife_2023/status/1606922706120736768…,17,104,18.8K,2022-12-25T20:25:15.000Z
None,user,text,0,0,0,0
1607084450671742978,@Spiro_Ghost,Just In: Fauci Has Been Let Go By Santa For Being A Naughty Elf... Merry Christmas!,9,18,"8,544",2022-12-25T18:42:45.000Z
1606738271312252933,@Spiro_Ghost,Thread: For Those Who Missed It... @elonmusk Answered My Question Regarding His Relationship With The World Economic Forum... Said He Was Invited & Declined... Great! But We Still Have Questions... My Follow Up Below...,18,69,17.7K,2022-12-24T19:47:10.000Z
1606544203752017920,@Spiro_Ghost,It Took 40+ Years For Them To Admit There Was A Problem... Are We Supposed To Trust Them Now? No Thanks...,15,133,19.7K,2022-12-24T06:56:00.000Z
1606503264379346945,@Spiro_Ghost,Is It Starting To Make Sense Yet? #Covid1984,15,182,20.5K,2022-12-24T04:13:20.000Z
1606502535828758530,@Spiro_Ghost,"Soon It Will Be Biometric... Covid-1984 Accelerated This... All Major Banks, Corporations & Govs Are on Board... Merry Christmas",54,237,35.1K,2022-12-24T04:10:26.000Z
1606151080135360512,@Spiro_Ghost,Remember That Time It Was Reported The US Stole The Gold Reserves From Ukraine In 2014? After The West / Soros Orchestrated A Coup Removing The Democratically Elected Government & Installed A Puppet Regime? https://globalresearch.ca/ukraines-gold-reserves-secretely-flown-out-and-confiscated-by-the-new-york-federal-reserve/5373446…,11,150,13.5K,2022-12-23T04:53:53.000Z
1603426986428452868,@Spiro_Ghost,Here Is The Trump's 'Major Announcement' Meanwhile DeSantis Announced He's Going After Big Pharma...,68,59,0,2022-12-15T16:29:18.000Z
1603482753911390208,@Spiro_Ghost,Now People Are Saying This Is The Real Trump Major Announcement... Posobiec Got The Vid 'Exclusively' To Let Everyone Know... Hmm... They Sure Messed That Up... Certainly Not Damage Control...,9,11,"7,669",2022-12-15T20:10:54.000Z
1602869483722661888,@Spiro_Ghost,Kari Lake Claims To Have The Strongest Election Lawsuit In US History... I Believe She Is Right! The World Is Watching...,25,233,0,2022-12-14T03:33:59.000Z
1602509037521747968,@Spiro_Ghost,Looks Like The Real Dr Malone Is Back...,23,45,0,2022-12-13T03:41:42.000Z
1602505398078013442,@Spiro_Ghost,Remember Way Back When This Was A 'Crazy Conspiracy Theory' ? Bill Gates Push For DIGITAL ID With $1.27 Billion Donation To UN Agenda 2030 ”Global Goals”,14,281,0,2022-12-13T03:27:14.000Z
1602076160388698118,@Spiro_Ghost,I Have Never Shared This Before... The Email Rosa Koire Sent Me A Few Days Before She Died... A LOT of People Asked About The Circumstances... This Is What She Told Me... I Redacted Personal Info & Part of The Picture... Nothing But Love & Respect For Rosa & Her Family,57,163,0,2022-12-11T23:01:36.000Z
1601980600445026304,@Spiro_Ghost,"For Those Who Missed It, Here Is The Audio... Elon Musk Says He Faces 'Quite Significant' Risk of Being Assassinated...",19,97,0,2022-12-11T16:41:53.000Z
1601965042173620226,@Spiro_Ghost,Covid-1984 Twitter Files Incoming...,31,93,0,2022-12-11T15:40:03.000Z
1601690762634465280,@Spiro_Ghost,What Are The Chances Katie Hobbs Will Push Vax & Mask Mandates?,60,50,0,2022-12-10T21:30:10.000Z
1601674790296690688,@Spiro_Ghost,Who Do You Go To When The System Is Corrupt? When Law Enforcement Agencies Are Complicit? When The Government Is Involved At The Highest Levels?,29,43,0,2022-12-10T20:26:42.000Z
1601659054593429504,@Spiro_Ghost,Elon Should Buy The FBI Next... lol,38,50,0,2022-12-10T19:24:10.000Z
1601360523299520513,@Spiro_Ghost,"Hi @elonmusk , Am I 'Allowed' To Say... I Don't Believe Katie Hobbs Beat Kari Lake...?",10.2K,11.9K,0,2022-12-09T23:37:55.000Z
1601305084180459542,@Spiro_Ghost,I Hate To Ruin Your Day But... Fauci Says He Is NOT Retiring In The Classic Sense... He Will Remain In The 'Public Health' Arena... I Wonder Which Pharma Company or University He Will Go To... #RevolvingDoor,48,72,0,2022-12-09T19:57:37.000Z
1597050880775245824,@Spiro_Ghost,Still Think This Is About Your Health & Safety?,20,268,0,2022-11-28T02:12:56.000Z
1597030241670959104,@Spiro_Ghost,Most People Just Want To Keep Their Heads Down & Mind Their Own Business... I Get It... But If We Do Not Resist... We Will Lose EVERYTHING Anyways! So Why Not Resist? We Have No Choice Other Than To Resist IMO...,18,219,0,2022-11-28T00:50:55.000Z
1596985946372988928,@Spiro_Ghost,They Have Told Us Their Plans All Along...,20,388,0,2022-11-27T21:54:54.000Z
1596974687913140224,@Spiro_Ghost,Fauci Says He Really Needs More Tax Payer Money... To Fund Advertising For Big Pharma... Fauci Admits Only 1/2 Got Their Boosters & Blames Anti-Science / Anti-Vax / Republicans...,92,161,0,2022-11-27T21:10:10.000Z
1596625144814141441,@Spiro_Ghost,Central Bankster Admits They Plan To Control Us With Central Bank Digital Currencies...,836,"5,144",0,2022-11-26T22:01:13.000Z
1596554602509660166,@Spiro_Ghost,How Many More Need To Speak Out Before Something Changes?,70,"1,103",0,2022-11-26T17:20:54.000Z
1596539232017084417,@Spiro_Ghost,The Most Important Clip From Last Nights Show IMO... #GreatReset #NWO #CBDC,23,359,0,2022-11-26T16:19:49.000Z
1596530260388253698,@Spiro_Ghost,What Could Go Wrong?,11,65,0,2022-11-26T15:44:10.000Z
1595817103277363200,@Spiro_Ghost,Happy Thanksgiving To Everyone Except These Two Criminals...,30,107,0,2022-11-24T16:30:20.000Z
1593989802206138370,@Spiro_Ghost,"I Guess The Fear, Bribery, Intimidation, Threats & Propaganda Is Not Enough...",15,164,0,2022-11-19T15:29:18.000Z
1593684785104314368,@Spiro_Ghost,About That Free Speech Thing... This Just Happened...,75,235,0,2022-11-18T19:17:16.000Z
1593642688955535365,@Spiro_Ghost,"The World Economic Forum Says They Need To Transform The Entire Financial System, Energy System & Food System... Because of Climate Change... Currently Governments, Private Companies & Central Banks Are Working Together To Achieve This & The People Have No Say...",64,424,0,2022-11-18T16:30:00.000Z
