tweet_id,user,text,num_comments,num_retweets,num_views,timestamp
1496750641003257856,@Spiro_Ghost,I'm Old Enough To Remember That Time The US Overthrew Ukraine... But Dont Worry... They Installed A Puppet Regime & Safely Airlifted All of The Gold From The Banks...,17,203,0,2022-02-24T07:35:35.000Z
1496739339916742657,@Spiro_Ghost,How Long Until The US Trucker Convoy Is Blamed on Putin?,16,40,0,2022-02-24T06:50:41.000Z
1496736717616947201,@Spiro_Ghost,Are We Supposed To Support Sending NATO Military Into Ukraine Now... ? Isn't That What Russia Wanted To Prevent?,21,31,0,2022-02-24T06:40:16.000Z
1496729617046061065,@Spiro_Ghost,As The Narrative Begins To Shift & Millions Around The World Stand In Defiance To #Covid1984... A War Breaks Out... What Are The Chances? Never Underestimate The Power That Shouldn't Be...,11,112,0,2022-02-24T06:12:03.000Z
1496717932658933765,@Spiro_Ghost,Raytheon Is Probably Creaming Their Shorts Right Now... Meanwhile Big Pharma Is Taking A Break In The Shadows...,8,69,0,2022-02-24T05:25:37.000Z
1496714567556247552,@Spiro_Ghost,We Are Witnessing The End of The Unipolar Era Transitioning Into A Multipolar Era... The West Will Fall Giving Rise To A New Order... By Design... Ready For A Great Reset Anyone?,73,298,0,2022-02-24T05:12:15.000Z
1496706979909283840,@Spiro_Ghost,They Are Just The Puppets... They Think We Are Only The Pawns...,8,44,0,2022-02-24T04:42:06.000Z
1496702003300425734,@Spiro_Ghost,Final Exchange Between Ukraine & Russia At UN Security Council Meeting...,20,99,0,2022-02-24T04:22:19.000Z
1496697979532726272,@Spiro_Ghost,NEW: United States Representative To The United Nations Statement On Russia / Ukraine Crisis...,19,25,0,2022-02-24T04:06:20.000Z
1496688108976418816,@Spiro_Ghost,Right on Time... As The C-19 Narrative Falls Apart... Watch For False Flags & Cyber Attacks...,17,228,0,2022-02-24T03:27:06.000Z
1496667339793776642,@Spiro_Ghost,Montagraph aka @0ctoberReignz Pokes Holes In The Give Send Go Hack Story... Looks Like The Source Code Was Compromised All Along... Hmm...,1,47,0,2022-02-24T02:04:35.000Z
1496599129144893448,@Spiro_Ghost,Is This Supposed To Be A Victory? When They 'Allow' Us To Have Our Rights Back? After They Have 'Taken' Them Away? The Damage Has Been Done... The Precedent Has Been Set...,47,177,0,2022-02-23T21:33:32.000Z
1496594859297284101,@Spiro_Ghost,Today: As The US Trucker Convoy Hits The Road For The Nations Capital... The Pentagon Approves Deployment Of National Guard Troops For DC Trucker Convoy Protest...,35,111,0,2022-02-23T21:16:34.000Z
1496576989389795328,@Spiro_Ghost,If The Manufacturers Could Be Sued... Would There Be Any Mandates? I Don't Think So...,36,169,0,2022-02-23T20:05:33.000Z
1496019384216834048,@Spiro_Ghost,If You Think Freezing Bank Accounts Is Bad... Just Wait Until Every Aspect of Your Life Is Connected To Your Digital ID aka Vax Passport...,138,"1,889",0,2022-02-22T07:09:50.000Z
1496008082563997697,@Spiro_Ghost,If You Wanted To Implement A World Gov... This Is How!,45,571,0,2022-02-22T06:24:56.000Z
1495982116273893376,@Spiro_Ghost,"\"Canadian Trucker Who Was Beaten By Police After Peacefully Surrendering Speaks Out... \"\"They Break My Body... But Not My Spirit\"\"\"",32,546,0,2022-02-22T04:41:45.000Z
1495970568797138944,@Spiro_Ghost,Interview With Shawn Jason From Druthers... His Bank Account Has Been Frozen By The Gov For Supporting The Truckers... Full Interview Below...,5,71,0,2022-02-22T03:55:52.000Z
1495802575911854084,@Spiro_Ghost,Professor Harari's Speech To The World Economic Forum In 2018 On The 4th Industrial Revolution... He Said We Are Likely One of The Last Generations of Homo-Sapian Because We Can Now Hack & Engineer Humans... Ready For Another Nasal Swab & Booster? lol,143,"1,379",0,2022-02-21T16:48:19.000Z
1495468742154899469,@Spiro_Ghost,This Is A Commercial Promoting Digital ID's In Canada By The Banksters In 2018...,98,817,0,2022-02-20T18:41:47.000Z
1495285696545923073,@Spiro_Ghost,From The Same One's That Brought You Event 201...,165,"1,281",0,2022-02-20T06:34:25.000Z
