tweet_id,user,text,num_comments,num_retweets,num_views,timestamp
1601271882539757569,@ShiraOvide,I haven't mentioned it for 5 minutes: Sign up to receive The Tech Friend in your inbox! It's free for all. And then I am your Tech Friend.,5,5,0,2022-12-09T17:45:41.000Z
1644419740985589760,@ShiraOvide,"At least once a week, something happens that makes me think of this tweet.",0,4,"3,467",2023-04-07T19:19:52.000Z
1644377515203391488,@ShiraOvide,"We focus a lot on futuristic tech. But take a moment to celebrate the simple or boring tech that makes your life better. Hooray to the QR code, better-sounding phone calls, Signal and more. Point your phone camera at this QR code from @miss_eleneous !",2,8,"3,176",2023-04-07T16:32:05.000Z
1644362388395655169,@ShiraOvide,Is this even true? Microsoft wasn't the first company to make a visual interface for a desktop computer. It won anyway. Facebook wasn't the first social network. The iPhone wasn't the first try at a smartphone. https://nytimes.com/2023/04/07/technology/ai-chatbots-google-microsoft.html…,24,26,123.7K,2023-04-07T15:31:58.000Z
1644072619417690114,@ShiraOvide,"""An ex-employee said there were so many support complaints in 2022 that they bogged down the internal hotline called “Oops,” which people in customer service use to prioritize issues for friends, acquaintances and family members.""",1,11,13.2K,2023-04-06T20:20:32.000Z
1639778225587908609,@ShiraOvide,"I find it unimaginable that the United States has not adopted poutine as our own. It has all our favorite food groups: fried, gravy, cheese and squeaky.",3,1,"7,410",2023-03-25T23:56:09.000Z
1639681000434171905,@ShiraOvide,Agreed: https://washingtonpost.com/technology/2023/03/24/tiktok-ban-congress/…,1,1,"2,853",2023-03-25T17:29:48.000Z
1639359772628750337,@drewharwell,"New: TikTok banned @EnesFreedom , former NBA player critical of China, for 12 days and unbanned him yesterday, when its CEO was in D.C. Company blames U.S. moderator error but won't give details of how it happened",7,51,27.9K,2023-03-24T20:13:22.000Z
1639303690170552320,@EmGusk,"There's no paywall on this story!! Share it with everyone, please and thank you!!",30,453,137.4K,2023-03-24T16:30:31.000Z
1639283493904547850,@ShiraOvide,"If the government is serious abut banning TikTok, it's time for an honest pitch to the American public. “If you’re going to take something from the American public, we need to tell them why,” Tim Wu told me.",7,36,25.3K,2023-03-24T15:10:16.000Z
1639289470234099722,@ShiraOvide,Sign up for The Tech Friend! It's free for all and lands in your email on Tuesdays and Fridays.,2,2,"2,414",2023-03-24T15:34:00.000Z
1639297572626989057,@ShiraOvide,"From The Washington Post Editorial Board: ""If TikTok can’t operate here, can any social media service originating in China? The implications of a 'no' here are vast.""",4,6,"5,048",2023-03-24T16:06:12.000Z
1639249686661042177,@ShiraOvide,It was striking that members of Congress barely mentioned the 1st Amendment yesterday. from @drewharwell & @megatobin1,1,0,"1,406",2023-03-24T12:55:55.000Z
1639238899825270786,@ShiraOvide,"All consumer technology companies eventually try enterprise sales, too. Even {checks notes} Snapchat. (Because businesses spent trillions of dollars a year on technology.)",1,1,"1,719",2023-03-24T12:13:03.000Z
1639230250767753221,@ShiraOvide,Generative AI ecosystem vs. Luma's 2010 chart of the display ad tech landscape. I don't know what it means but similar vibes.,2,0,"2,487",2023-03-24T11:38:41.000Z
1639228613433196544,@ShiraOvide,"""The people most responsible for failing to safeguard Americans’ data, arguably, are American lawmakers."" by @WillOremus",3,10,"3,229",2023-03-24T11:32:11.000Z
1639063635661148168,@ShiraOvide,"Fascinating. For years, YouTube has been the only major site that shared material amounts of its revenue with people who make the content.",1,2,"2,030",2023-03-24T00:36:37.000Z
1638271272667828230,@ShiraOvide,"""Hummus is the gateway pulse."" Lentils are climate-friendly, protein-packed, yummy, largely grown in North America and having a U.S. sales boom. (Dinner tonight is my leftover homemade dal makhani.) by @MJ_Coren",3,1,"2,048",2023-03-21T20:08:03.000Z
1638217418341228557,@ShiraOvide,"A New York City teacher can't pay for the subway with his phone. It took me weeks to figure out why. It's a tale of 3 complex systems: Transit, payments and workplace benefits. If you're struggling to use Apple Pay for transit, I think I can help.",3,15,11.2K,2023-03-21T16:34:03.000Z
1638220287564034050,@ShiraOvide,There are long Reddit threads of people confused why they can't add commuter benefits payment cards to Apple Pay or Google Pay. No one explains how any of this works. Tell your employer's benefit manager that you want to use your commuter benefits with digital payments.,2,0,"1,836",2023-03-21T16:45:27.000Z
1638222104809070593,@ShiraOvide,Sign up to have The Tech Friend arrive on the express track* to your inbox each Tuesday and Friday. http://wapo.st/thetechfriend I love to unravel your mysteries. *(I sincerely apologize for my terrible transit reference.),0,0,"1,189",2023-03-21T16:52:41.000Z
1638129086068342784,@katierosman,The instant rebuke of the WeNYC logo is just another reason why INY,3,12,"8,638",2023-03-21T10:43:03.000Z
1637983260495028224,@ShiraOvide,Cleaning out my audio files and found an audio recording I did about U.S warnings on the risks of TikTok. In 2019. Time is a flat circle.,4,5,"5,919",2023-03-21T01:03:36.000Z
1637784668656287745,@ShiraOvide,"""In each of the past five years, Indian officials have ordered internet shutdowns more frequently than any other government.""",4,15,"5,264",2023-03-20T11:54:28.000Z
1637505382678507521,@ShiraOvide,It's true. We Ohioans are everywhere. https://washingtonpost.com/travel/interactive/2023/types-of-tourists-vacation/…,3,1,"4,345",2023-03-19T17:24:41.000Z
1636775967006834688,@ShiraOvide,"In today's Tech Friend. Maybe TikTok could wind up being banned in the U.S. this time? What you need to know and do right now. (Mostly nothing, but take a moment to evaluate your privacy settings. Have a plan B if you have a large following.)",5,5,"4,154",2023-03-17T17:06:15.000Z
1636776620462845953,@ShiraOvide,It's not fair. 100 million people are the whims of geopolitical tug-of-war AND America's fundamental failure to pass any substantive national private laws.,2,0,"1,218",2023-03-17T17:08:50.000Z
1636777293682032655,@ShiraOvide,"A reminder that the U.S. forced Grindr's then-Chinese owner to sell, over fears the CCP might use the data to blackmail Americans. Grindr data *was* used against Americans. Not by China. By other Americans.",2,1,"1,030",2023-03-17T17:11:31.000Z
1635285226363711500,@ShiraOvide,"A pitch for humility about AI, @random_walker to @WillOremus : ""...be more comfortable with accepting that we simply don’t know for sure how a lot of these emerging developments are going to play out.""",1,15,11.7K,2023-03-13T14:22:34.000Z
1633916528583385094,@yunheekim22,Big congrats to @heatherkelly @rachelerman @chrisvelazco @chrisalcantara for a well-deserved @SABEW award for innovative tech reporting! https://washingtonpost.com/technology/interactive/2022/amazon-prime-value/…,1,5,"5,408",2023-03-09T19:43:51.000Z
1633488796875657217,@ShiraOvide,"Etiquette from @Tatum_Hunter_ on office technology: if you're a pro at the printer, don't be a jerk to people who aren't. If you're thinking, HOW DO I USE THIS MEETING SCHEDULING APP, it's cool. Office tech sucks whether you're a boomer or Gen Z.",4,6,"2,668",2023-03-08T15:24:12.000Z
1632810892290060289,@mhbergen,Recode was a good website.,3,4,10K,2023-03-06T18:30:27.000Z
1631803032592588800,@ShiraOvide,Love it when @michikokakutani writes about owls.,0,2,"1,905",2023-03-03T23:45:35.000Z
1631723675941748736,@geoffreyfowler,"Today's @washingtonpost Tech Friend newsletter is useful for pretty much everyone: 4 ways you’re making your home WiFi worse (and how to fix it) https://washingtonpost.com/technology/2023/03/03/internet-mistakes-fix-wifi-problems/… (If you don't already subscribe, it's free and brings @ShiraOvide to you 2x a week. She is your tech friend!)",3,12,63.9K,2023-03-03T18:30:14.000Z
1631716586540212225,@ShiraOvide,In today's Tech Friend: Internet service is [SCREAMS]. It's not your fault. But... These 4 mistakes might be making your internet worse. Hint: Don't shove your router in a corner. And you probably don't need the BLAZING FAST internet tier.,5,4,"4,042",2023-03-03T18:02:04.000Z
1631725773764665368,@ShiraOvide,"Sign up for The Tech Friend! It's free, and in your inbox 2x a week. I'll be your friend. For tech.",2,2,"1,116",2023-03-03T18:38:35.000Z
1631651283005308930,@ShiraOvide,"I wrote recently about how Zoom mostly tamed Zoom bombing but clearly...it's not completely fixed. (A pointless fact: Zoom calls it ""meeting disruptions,"" apparently not wanting to be the Kleenex of horrible things.) https://washingtonpost.com/technology/2023/01/24/zoom-bombing-prevention-tips/…",0,0,"1,801",2023-03-03T13:42:35.000Z
1631638677888565249,@ShiraOvide,Are you a transit nerd who loves open loop payments? (And can talk about them to normal humans like me?) I am looking for you. My DMs are open.,2,7,"3,821",2023-03-03T12:52:29.000Z
1631321050419187714,@lisabonos,. @linda_chong_ 's grown-up's guide to mastering TikTok just might get me onto TikTok,0,4,"2,257",2023-03-02T15:50:21.000Z
1631362261959729153,@ShiraOvide,"Ah, a new Teams feature will nudge people to delay messages to deliver later during a colleague's normal work hours. I AM HERE FOR THIS.",3,4,"2,440",2023-03-02T18:34:07.000Z
1631362513085366273,@ShiraOvide,"I'm looking at you, Apple Messages. Where is your delay send feature?",0,0,"1,003",2023-03-02T18:35:07.000Z
1631305739128930307,@ShiraOvide,"Every time I have to log back into Twitter, I cross my fingers that it works. Today it did. After some glitches.",1,2,"1,620",2023-03-02T14:49:31.000Z
1629155970013167616,@ShiraOvide,"Love this from @kevinmdraper on an elite athlete who got to the top and then wanted to have fun doing other, weirder things.",0,0,"1,049",2023-02-24T16:27:06.000Z
1629141633693323267,@ShiraOvide,"""If you did take a weed gummy before you arrived, tell your dentist.""",0,0,"1,081",2023-02-24T15:30:08.000Z
1629138296797384704,@taraparkerpope,"I'm going to try this whole ""treat your weekend like a vacation"" thing.",3,6,"3,592",2023-02-24T15:16:52.000Z
1628737645881745409,@ShiraOvide,"{clutches pearls} ""Sillin reveals a 'dirty secret' about weather app accuracy: 'They’re essentially all the same,' he said.""",0,0,"1,695",2023-02-23T12:44:49.000Z
1628734476233605120,@ShiraOvide,"Charging for ""extras"" like competent customer support or security from account hackers? Sounds like a mobster protection racket, @geoffreyfowler writes.",2,22,"6,685",2023-02-23T12:32:14.000Z
1628735998329856000,@ShiraOvide,Snapchat's subscription is actual extras like exclusive bitmojis and access to pre-release features. https://help.snapchat.com/hc/en-us/articles/7121577610900-What-is-Snapchat-… YouTube premium is mostly ad-free videos. Social media subscriptions don't have to charge for something that should be free.,2,1,"1,378",2023-02-23T12:38:17.000Z
1628476083078303746,@lmatsakis,"In the newsletter day, I spoke with the unmatched @evelyndouek about the Section 230 case currently before the supreme court https://semafor.com/newsletter/02/22/2023/chatgpt-shows-the-us-government-needs-to-step-up-on-ai…",1,5,"5,345",2023-02-22T19:25:28.000Z
1628412235230982145,@ShiraOvide,from @NaomiNixWrites,0,4,"2,114",2023-02-22T15:11:45.000Z
1628389628599275526,@ShiraOvide,I don't know the point of Meta Verified but this is good from @shiringhaffary : One pitch from Meta (and soon Twitter Blue) is pay for more reach of your posts. It's what Facebook did to businesses: You want to be seen; you gotta pay FB. https://vox.com/recode/2023/2/21/23609375/meta-verified-twitter-blue-checkmark-badge-instagram-facebook…,3,12,"4,840",2023-02-22T13:41:56.000Z
1628390688311181314,@ShiraOvide,And another good point: This is advertising without disclosure.,0,8,"2,923",2023-02-22T13:46:08.000Z
1628377049390804995,@ShiraOvide,"I can't blame anyone for glancing at instructions to set up two-step account logins and thinking, NOPE. It doesn't help that Twitter is turning off two-step authentication that people already set up. ( @heatherkelly has got you.) https://washingtonpost.com/technology/2023/02/22/twitter-2fa/…",1,3,"2,628",2023-02-22T12:51:57.000Z
1628372785327218690,@ShiraOvide,Good point by @AustinCarr : We imagine conversational AI will be like the Star Trek computer (or at least I do). But sometimes it's just a faster way to set a timer. And that's ok!,2,2,"2,069",2023-02-22T12:35:00.000Z
1626020639847993346,@ShiraOvide,I have watched this 40 times and Iove it.,1,1,"3,231",2023-02-16T00:48:25.000Z
1625998031463108609,@ShiraOvide,I went to a drugstore looking for discount Valentine's Day candy. None. But the Easter merch was out in full force. I don't know how holidays work anymore.,4,0,"4,396",2023-02-15T23:18:34.000Z
1625873215057719298,@ShiraOvide,"Clear eyed, insightful and focused on the voices of people damaged by school shootings and their aftermath. by @JohnWoodrowCox & @dataeditor",1,0,"1,173",2023-02-15T15:02:36.000Z
1625593185706598420,@ShiraOvide,"Idk, do these ""consumer education"" efforts about romance scams put a lot of responsibility on users and not as much on the dating app companies where scams are everywhere?",1,0,"3,045",2023-02-14T20:29:52.000Z
1625548338614485037,@ShiraOvide,"In today's Tech Friend: Did you catch the Super Bowl ad from Temu and think, who? If you don't know Temu & Shein, you should. Never before have so many Americans bought products from Chinese factories via Chinese apps.",1,12,"7,653",2023-02-14T17:31:39.000Z
1625550432465567745,@ShiraOvide,Sign up for The Tech Friend newsletter! It's free for all and it arrives in your inbox each Tuesday and Friday.,1,0,"1,238",2023-02-14T17:39:59.000Z
1625550974331850754,@ShiraOvide,And we're still not having an honest discussion in America about what we want to do about tech from China. https://washingtonpost.com/technology/2023/02/14/what-is-temu-super-bowl-commercial/…,1,0,"1,030",2023-02-14T17:42:08.000Z
1625538073114165260,@ShiraOvide,The patriarchy is ... higher tariffs on women's underwear????? https://washingtonpost.com/opinions/2023/02/09/women-underwear-tariffs-equality-valentines-day/… by @crampell,4,3,"7,180",2023-02-14T16:50:52.000Z
1625538428128399361,@ShiraOvide,"I mean, just clap: ""In a metaphor that’s almost too on the nose, even silver spoons get preferential tax treatment, when compared with their cheaper stainless steel counterparts.""",0,0,"1,123",2023-02-14T16:52:16.000Z
1625513975117975552,@jaredlholt,This is truly surreal stuff. Great story via @WillOremus on the stress-testing that folks are putting on ChatGPT and what its revealing about the system's tendencies https://washingtonpost.com/technology/2023/02/14/chatgpt-dan-jailbreak/…,1,20,28.6K,2023-02-14T15:15:06.000Z
1625523667932262407,@ShiraOvide,"Love this from @sheeraf on the history of visual representations of the heart, including 19th century telegraph hearts via Morse code.",0,0,"1,290",2023-02-14T15:53:37.000Z
1625519389968592897,@ShiraOvide,"I have been reading articles for years about why kids these days aren't getting driver's licenses. The reasons are nuanced and still a little mysterious, as @shannonosaka writes.",3,0,"1,392",2023-02-14T15:36:37.000Z
1625478328302944257,@ShiraOvide,"""leading Chinese voices on Twitter were muffled at a crucial political moment, even though Mr. Musk has championed free speech.""",0,9,"1,918",2023-02-14T12:53:28.000Z
1618266257618526209,@gerryshih,"The film had been banned, the social media censored. Now, the students huddled to watch what their government had deemed to be subversive foreign propaganda. China? No. They were in India, ostensibly the world’s largest democracy, and watching the BBC.",20,253,39.6K,2023-01-25T15:15:16.000Z
1618257293791096832,@ShiraOvide,"The decentralized internet ain't easy. ...""It is therefore with relief and regret that we announce the shutdown of http://Alphaville.club""",1,10,11.7K,2023-01-25T14:39:39.000Z
1618228442402807808,@ShiraOvide,"Some products we buy should not try to be ""smart"" and connected. https://washingtonpost.com/technology/2023/01/06/smart-home-dumb-alexa-matter/…",2,3,"2,755",2023-01-25T12:45:00.000Z
1618226482433912839,@ShiraOvide,The Zoom meeting could have been a phone call. That phone call could have been an email. That email could have been a Slack. Also you didn't need to send that Slack. @DanielleDigest on the perennial problem of meeting overload -- just with more tech.,1,3,"1,778",2023-01-25T12:37:13.000Z
1618017696452603905,@ShiraOvide,Today was a bad day for The Washington Post. Sending love to my colleagues including the people who were laid off. You deserved better.,0,1,"2,776",2023-01-24T22:47:34.000Z
1617908140384858112,@ShiraOvide,CAT FTW.,1,0,"2,063",2023-01-24T15:32:14.000Z
1617907450262474753,@ShiraOvide,"One of the great things about @mj_coren 's smart debut climate advice column: Reminders that regulatory change is powerful, and companies often resist. https://washingtonpost.com/climate-environment/2023/01/24/home-appliance-myths-energy-saving-tips/…",0,6,"2,284",2023-01-24T15:29:30.000Z
1617682436632248321,@ShiraOvide,"""Reptile"" talked about the ""land brain"" part of him that wants to go home, take a nap and forget about swimming in 50 degree water. What if all of my brain is ""land brain""? There is no other part.",2,0,"3,465",2023-01-24T00:35:22.000Z
1617680789482917889,@ShiraOvide,I was just thinking about how much I loved the Bill Knapp's chocolate cake. And I know some of you here know what I mean.,0,0,"1,780",2023-01-24T00:28:49.000Z
1617587526595665920,@ShiraOvide,"""Defensive"" domain registrations aren't uncommon. (I wrote in 2010 about BofA buying 400+ web domains to prevent angry people from creating sites like ""http://BankofAmericaSucks.com."") Not sure how common it is for government agencies, though.",0,0,"1,837",2023-01-23T18:18:14.000Z
1617167656133578754,@FlitterOnFraud,"Every moment in this @ronlieber piece on how ⁦ @jpmorgan ⁩ got duped into buying a fake student aid company is delicious, from the founder’s lawyer’s double-take response to Ron’s unanswered q to JPM: Did anyone on this deal ever have a student loan?",1,24,17.3K,2023-01-22T14:29:49.000Z
1616556089557897228,@ShiraOvide,Noon me: I don't need to take my laptop charger! I'm just going for a few hours! 5 pm me: I guess I'm done working. My laptop is dying.,1,0,"2,051",2023-01-20T21:59:40.000Z
1616530216486141970,@ShiraOvide,"This by @CadeMetz is incredibly thoughtful. (And with an amazing illustration!) ""We need a paradigm shift — where we no longer judge intelligence by comparing machines to human behavior.""",2,4,"2,176",2023-01-20T20:16:51.000Z
1616463274899275776,@marincogan,"Thinking about my first layoff, way back in 08. Media reporter framed it as ""just a few low level employees and interns!"" So unnecessarily shitty. Sending love and solidarity to all of my colleagues affected today. You are valued. This sucks.",8,83,190.1K,2023-01-20T15:50:51.000Z
1616509186678067203,@kateconger,Tweetbot shutting down after changes to Twitter's API,1,13,"8,410",2023-01-20T18:53:18.000Z
1613514117473603586,@ShiraOvide,"If a company does not explain WHY it's asking for a piece of personal information about your CHILD, welp... ""Generally, lie but with some caveats,"" @htsuka told @heatherkelly",0,9,"2,813",2023-01-12T12:31:57.000Z
1613291434546987008,@LiYuan6,NBC News is very very lucky to have @RBlumenstein a super journalist and a compassionate human being.,0,4,"8,305",2023-01-11T21:47:06.000Z
1613229459997609985,@vasujakkal,Had a wonderful time speaking with @ShiraOvide about the many benefits of going passwordless and some tips and tricks on how to get started!,1,5,"6,967",2023-01-11T17:40:50.000Z
1613160873148977158,@ShiraOvide,"In 1995 (!), @robertoharrow wrote about the scourge of people having to remember so many passwords. One guy had six -- SIX!?! -- computer passwords to memorize. https://washingtonpost.com/archive/politics/1995/09/03/password-stress-means-memory-overload/8f2953d0-5f07-4ac5-b78b-ffa1752f468c/… Wouldn't six passwords be nice?",1,3,"1,882",2023-01-11T13:08:17.000Z
1612871486423068673,@ShiraOvide,"In today's Tech Friend: Everyone can improve online security with these password tips. But the whole password system is dumb, insecure and sets us up to fail. Our long term mission: Kill passwords forever. It's possible!",10,30,30.9K,2023-01-10T17:58:22.000Z
1612871902800015361,@ShiraOvide,Look at Elena Lacey's beautiful Gif.,1,0,"1,482",2023-01-10T18:00:01.000Z
1612872273937014785,@ShiraOvide,And sign up for The Tech Friend! In your inbox each Tuesday and Friday.,1,2,"1,291",2023-01-10T18:01:30.000Z
1612791033506545666,@ShiraOvide,"Ah yes, ye olde ""trusted platform"" of the App Store:",0,3,"2,777",2023-01-10T12:38:41.000Z
1612430057519349762,@ShiraOvide,"Idk, maybe CES shouldn't exist? ""What is the real purpose of a $200 travel mug with location-sharing capabilities and an irreplaceable battery?"" -- @kwiens to @Tatum_Hunter_",7,14,17.6K,2023-01-09T12:44:17.000Z
1611429736768761858,@geoffreyfowler,"In today's Tech Friend newsletter, my pal @ShiraOvide says I live in a nerd paradise with pointless garbage gadgets. I call her a crusty old lady muttering about why anyone needs ice boxes. Come for fun, stay for advice on how to avoid a dumb smarthome:",5,13,22.2K,2023-01-06T18:29:22.000Z
1611050251820883968,@ShiraOvide,Government-imposed internet shutdowns and restrictions are a huge impediment to freedom of expression. This from WhatsApp sounds INTERESTING. (Although whether someone in Iran would/should trust Meta to keep them safe...I dunno.),0,3,"1,719",2023-01-05T17:21:26.000Z
1610991071730827267,@ShiraOvide,"Once again, @geoffreyfowler created an account pretending to be a U.S. Senator. (He had permission!) And once again, Twitter took his $8, asked zero questions and gave the fake account a blue check mark.",0,33,"5,665",2023-01-05T13:26:16.000Z
1604820489012408320,@ShiraOvide,"Great reporting into that confrontation near Los Angeles, which sounded terrifying but also there is no evidence to connect it to jet coordinates.",2,5,"3,832",2022-12-19T12:46:35.000Z
1604818448797896707,@ShiraOvide,Remember that two missions of this site include stopping bots and protecting freedom of expression. These bots went unchecked and drowned out freedom of expression.,0,3,"1,901",2022-12-19T12:38:28.000Z
1603592735973425152,@WashPostPR,Statement from @washingtonpost Executive Editor Sally Buzbee,435,"2,143",886.9K,2022-12-16T03:27:56.000Z
1603568651461861376,@WillOremus,"Twitter abruptly suspended the accounts of more than half a dozen journalists from CNN, the New York Times, The Washington Post and other outlets Thursday evening. Story by @farhip :",3,29,"6,894",2022-12-16T01:52:14.000Z
1603563932995592192,@ShiraOvide,There is no hope for Twitter if it overreacts to whatever the boss finds unwelcome. People and institutions that value free expression cannot stand for the unwarranted account suspensions of journalists.,8,37,"9,945",2022-12-16T01:33:29.000Z
1603048240336830464,@drewharwell,"Algorithmic social media's thirst-trap problem. @heatherkelly made a burner TikTok and said she wanted to see videos of the outdoors. Within a few minutes, it was mostly softcore porn. The AI responds to and perpetuates what it predicts we can't ignore",5,21,0,2022-12-14T15:24:18.000Z
1601554222654398467,@drewharwell,"New: Stumbling with their words, some people let AI do the talking. ChatGPT is saying all the things people wish they could say to their clients, landlords, girlfriends and kids. It's also a great cheating tool, secretly racist and often deceptively wrong",2,20,0,2022-12-10T12:27:36.000Z
1601284441480970241,@geoffreyfowler,"""Consent"" is the key in so many of the most important tech stories of this moment. There's so little real consent, yet so much theater around having us give it.",0,3,0,2022-12-09T18:35:35.000Z
1601277849444315137,@ShiraOvide,Thanks to @miss_eleneous for the rad collage! Plus @matdryhurst for his wisdom on consent in the AI age.,1,0,0,2022-12-09T18:09:24.000Z
1601270622520479744,@ShiraOvide,In The Tech Friend: Your words taught ChatGPT. Your face trained Clearview AI. Lensa portraits learned from artists' work. Bits of us are building AI systems. What are the rules of the road for THIS?,3,32,0,2022-12-09T17:40:41.000Z
1600941171504975872,@ShiraOvide,A big deal in the lands of tech and the law!!!!!!!!!!!,0,1,0,2022-12-08T19:51:33.000Z
1600894263088201731,@ShiraOvide,Everyone has TikTok envy.,1,2,0,2022-12-08T16:45:10.000Z
1600830658536177664,@ShiraOvide,"Ah, @erinkwoo says Twitter might charge $11 for Twitter check marks on iPhones and $7 on the web. https://theinformation.com/articles/twitter-to-change-blue-pricing-after-apple-spat?rc=5vfpth… Just going to say again: Buying stuff in apps in broken.",0,7,0,2022-12-08T12:32:25.000Z
1598783880642711552,@ShiraOvide,"“At UPS, they say ‘Don’t fall in love with the airplanes,'"" says one former air employee. “At Amazon Air, they seemed to have fallen into that trap.” Fascinating by @caitharr on the business, climate, labor and safety implications of Amazon Air.",1,3,0,2022-12-02T20:59:15.000Z
1598750462970253313,@ShiraOvide,"When I talked to recruiters this summer, they said it was unusual to rescind job offers except in periods of economic crisis like in 2008 and spring 2020. But Twitter, Coinbase & Redfin yanked job offers from people who already said yes. Amazon too:",0,6,0,2022-12-02T18:46:28.000Z
