tweet_id,user,text,num_comments,num_retweets,num_views,timestamp
1579482853360168960,@ShiraOvide,"Me: why would I want news about the Department of Motor Vehicles? Friends, this is for residents of D.C., Maryland and Virginia (the other DMV) Sign up for all your geographic DMV news! https://washingtonpost.com/newsletters/the-7-dmv/…",2,1,0,2022-10-10T14:43:52.000Z
1579457354680061952,@ShiraOvide,"Kudos to @axios for a dead simple newsletters sign up process. (Yup, re-signing up for a zillion newsletters for my new WaPo inbox.)",1,0,0,2022-10-10T13:02:32.000Z
1579447731713896448,@ShiraOvide,"When Meta tries to turn WhatsApp into a real business with, like, money and stuff: ""WhatsApp used to be so good. Now every 2nd message is from a random corporate account I never gave permission to spam my inbox."" by @NilChristopher",3,14,0,2022-10-10T12:24:18.000Z
1579448170601644032,@ShiraOvide,"otoh, it works.",0,0,0,2022-10-10T12:26:03.000Z
1579445971217707015,@ShiraOvide,This is cool! But also...why do car manufacturers have to collect data on everything we do with our own cars?,1,3,0,2022-10-10T12:17:18.000Z
1579445437412806657,@ShiraOvide,"Let's not lie: This tech fix-it guide for parents from @heatherkelly is handy for the rest of us, too. CTRL + F ""printer""...nope. Though I've done lots of (expletive deleted) parental printer IT.",0,3,0,2022-10-10T12:15:11.000Z
1579284911340785664,@ShiraOvide,Okayyyyy. https://nyti.ms/3VquwEi,4,9,0,2022-10-10T01:37:19.000Z
1576910777214464001,@ShiraOvide,"From my past and now future running buddy @geoffreyfowler , a journalism unicorn who is always pushing technology to serve us better: A new parent's investigation and plea to do better with social media that plays on our worst fears.",1,1,0,2022-10-03T12:23:21.000Z
1576910423945011202,@ShiraOvide,"Again, i's hard to single out just one Post piece on tech accountability but I'll just highlight this eye opener from @lizzadwoskin and @NaomiNixWrites",1,1,0,2022-10-03T12:21:57.000Z
1576910314834366464,@ShiraOvide,I haven't been able to forget this @GenePark personal story about the joys and pain of a cancer-themed video game.,1,2,0,2022-10-03T12:21:31.000Z
1576909961161895936,@ShiraOvide,"P.S., The Post's By the Way has quickly become my go-to site for useful travel information and also hella smart ideas and occasional weirdos. See also: barf bag collectors by ⁦ @hannahbsampson",2,2,0,2022-10-03T12:20:06.000Z
1576907270457217028,@ShiraOvide,"Today is my first day at The Washington Post. I'm thrilled! (Also, I might be running late for work already. Oops.) I've been re-reading a bunch of amazing technology-related journalism from my new colleagues. I'll tweet some today. In reverse chronological order:",27,18,0,2022-10-03T12:09:25.000Z
1576909757926940672,@ShiraOvide,"It's hard to pick just one from The Post's essential coverage on those blowing the whistle on technology abuses from the inside. I'll single out this one by @josephmenn , @lizzadwoskin & @Cat_Zakrzewski",1,1,0,2022-10-03T12:19:18.000Z
1576909862910722048,@ShiraOvide,Useful service from @NatBCo on the pros and cons of putting Bluetooth trackers in your checked bags (or carry ons!),1,0,0,2022-10-03T12:19:43.000Z
1576583132526313473,@Kantrowitz,The SNL BeReal sketch just absolutely nails it,48,"1,138",0,2022-10-02T14:41:24.000Z
1576703009794723840,@ShiraOvide,"I am back from a refreshing Twitter break. As Hayley said, no one tell me what I missed on here. (Except...ok, did someone figure out the origins of the creepy intercom sounds on American Airlines?)",0,0,0,2022-10-02T22:37:45.000Z
1573679642594213888,@ShiraOvide,An absolutely gutting pair of articles:,0,2,0,2022-09-24T14:23:59.000Z
1571632532801683460,@ShiraOvide,Such a thoughtful explanation of the quiet quitting not-trend. Amelia Nagoski to @mimbsy https://theatlantic.com/ideas/archive/2022/09/what-is-quiet-quitting-burnout-at-work/671413/…,1,3,0,2022-09-18T22:49:29.000Z
1571633375357591555,@ShiraOvide,Also @DKThomp https://theatlantic.com/newsletters/archive/2022/09/quiet-quitting-trend-employee-disengagement/671436/…,0,1,0,2022-09-18T22:52:50.000Z
1571579953229205504,@ShiraOvide,Genuinely curious if Meta has considered sharing revenue systematically with Reels creators. YouTube has been handing over big chunks of its revenue to video creators for 15 years. $$$ works. (Also not sure about ads in YouTube Shorts.),1,9,0,2022-09-18T19:20:34.000Z
1570033011059466243,@ShiraOvide,What percentage of humans know that Showtime and Paramount are parts of the same company? And why should any human need to know this to WATCH TV?,3,6,0,2022-09-14T12:53:34.000Z
1569772679997038599,@ShiraOvide,I looked at one tree in Central Park this weekend that was COVERED in spotted lantern flies and it felt like a horror movie. https://twitter.com/dodaistewart/status/1569748735269158912…,0,1,0,2022-09-13T19:39:06.000Z
None,user,text,0,0,0,0
1569755100436103168,@ShiraOvide,"Business journalist brain: I have been watching ""The Mary Tyler Moore Show,"" and keeping a browser tab open to the BLS inflation calculator. I need to know what an $85 weekly salary or an 18 cent stamp from 50 years ago is worth in 2022 dollars. cc @JordynJournals",6,3,0,2022-09-13T18:29:15.000Z
1569737338795823105,@ShiraOvide,Is this the origin of all human problems? We have neglected to whisper news to the bees.,1,3,0,2022-09-13T17:18:40.000Z
1569715540423221251,@ShiraOvide,"I bought it today! And you can, too!",0,1,0,2022-09-13T15:52:03.000Z
1569713357103448064,@ShiraOvide,I heart the Storystream very much! Blogging forever.,0,0,0,2022-09-13T15:43:22.000Z
1569707177983594498,@ShiraOvide,I love this from @bencasselman & @LaurenLeatherby : a vibes matrix about the economy. https://nytimes.com/interactive/2022/09/13/business/economy/us-economy.html…,0,1,0,2022-09-13T15:18:49.000Z
1569666899771785217,@Neil_Irwin,"Shelter prices up 0.7%, a new high for this cycle. Last reached that in 1991. The rent, it is imminently reasonable to say, is too damn high.",13,104,0,2022-09-13T12:38:46.000Z
1569679320867651584,@ShiraOvide,Buying audience sometimes works and sometimes doesn't. I'm not sure anyone can explain exactly why. Wish marketed the hell out of itself and it didn't last. Could Windows Phone have marketed its way to success? (Probably not.) https://platformer.news/p/is-instagram-reeling… from @CaseyNewton,1,2,0,2022-09-13T13:28:07.000Z
1569674249056538626,@ShiraOvide,I have watched this 20 times and will watch it 200 more times.,0,1,0,2022-09-13T13:07:58.000Z
1569308316278333444,@taraparkerpope,"The new Well+Being desk is live at the Washington Post (with a cool new name!) I'm incredibly proud of our team. Join us every day for the latest news and science-based advice on food, fitness, mental health and well-being.",9,43,0,2022-09-12T12:53:53.000Z
1569664293645463553,@ShiraOvide,I won't spoil the kicker but it is VERY GOOD.,0,0,0,2022-09-13T12:28:25.000Z
1569396904122880003,@ShiraOvide,"I am enormously thankful to NY Times for creating a job I loved and giving me the freedom and support to grow. Thanks to @ellenjpollock1 , @puiwingtam , @HannaIngber and my wonderful colleagues in Tech, BizDay and beyond. I've learned so much from you all.",4,1,0,2022-09-12T18:45:54.000Z
1569393096986693638,@ShiraOvide,Me getting to work with Geoff again.,3,0,0,2022-09-12T18:30:46.000Z
1567132354564554755,@ShiraOvide,"The sum function tells me that the past 6+ years of Apple events (and I might have missed some here?) add up to 2,010 minutes. What else could Apple event watchers (including me) have done with that time?",1,0,0,2022-09-06T12:47:23.000Z
1567130003971756036,@ShiraOvide,"(I deleted a tweet about Amazon's ""Lord of the Ring"" series because I made a silly math mistake. Now drinking more coffee.)",2,1,0,2022-09-06T12:38:03.000Z
1567114764790206466,@ShiraOvide,I will read every single article about Larry the Cat.,0,2,0,2022-09-06T11:37:30.000Z
1566873895927529472,@ShiraOvide,"Happy nearly two year anniversary to this @MauraJudkis feature and the diehards who spent like $3,000 on 12-foot skeletons. It brought me so much joy in a dark 2020. https://washingtonpost.com/lifestyle/style/giant-home-depot-skeleton-halloween/2020/10/27/5c6d60e6-1551-11eb-ba42-ec6a580836ed_story.html…",0,1,0,2022-09-05T19:40:22.000Z
1566858628329504769,@ShiraOvide,"""too much of our personal finance infrastructure becomes adversarial through its complexity."" A barn burner by @ronlieber",0,3,0,2022-09-05T18:39:42.000Z
1565801080738422785,@ShiraOvide,"Smart @broderick piece about Snapchat's past, present and future. I wonder if Snap's fundamental issue is money. It's not a big ad business, and (other than 2021) the company burns more cash than it generates. Controlling your destiny starts with $.",2,2,0,2022-09-02T20:37:23.000Z
1565683910582980609,@ShiraOvide,"""There is no technological miracle waiting around the corner that will solve problems caused by decades of neglectful policy decisions and rampant fraud.""",4,6,0,2022-09-02T12:51:47.000Z
1565438226042601479,@ShiraOvide,"The creators of ""Poopy Stupid Butt"" pulled in $10,000 in total income from kids being kids at Alexa. (tbf, it is a very catchy tune.)",1,3,0,2022-09-01T20:35:32.000Z
1565324801706807297,@ShiraOvide,This seems...entirely sensible? https://nytimes.com/2022/09/01/technology/twitter-edit-button.html…,3,17,0,2022-09-01T13:04:49.000Z
1565326270879203328,@ShiraOvide,Just to be humble about my product views about Twitter. This one hasn't aged well:,1,1,0,2022-09-01T13:10:39.000Z
1565326602891845632,@ShiraOvide,"Although a 10,000 character limit would have been something.",0,1,0,2022-09-01T13:11:59.000Z
1565301687111528448,@daiwaka,"When the new iPhone and Pixel come out, a big change will be where some of these phones are NOT being produced. Tariffs, geopolitical tensions, rising wages are all contributing to a slow shift away from Made in China w/ @trippmickle",13,25,0,2022-09-01T11:32:58.000Z
1564317863414054912,@ShiraOvide,"As I say every few months, I look forward to seeing if Meta can turn WhatsApp into a real business with, like, money and stuff.",2,3,0,2022-08-29T18:23:36.000Z
1564318761917751298,@ShiraOvide,"I wrote this in 2020, but it mostly holds:",1,1,0,2022-08-29T18:27:11.000Z
1564276538765344771,@ShiraOvide,"Oh no it's the peas thing all over again. tbf, hell yes to guac plus esquites",0,1,0,2022-08-29T15:39:24.000Z
1559924696505876485,@acsifferlin,"""Painting these communities with too broad strokes and then dousing them in shame and stigma did nothing to quell previous outbreaks. Officials should remember that as they tackle polio."" @JInterlandi",1,3,0,2022-08-17T15:26:44.000Z
1559880784747679747,@ShiraOvide,Construction masonry grinding noises competing this morning with leaf blower noises.,1,3,0,2022-08-17T12:32:14.000Z
1559864894912176130,@remytumin,Did you recently find yourself reaching out to parents inquiring about polio for the first time? Same.,0,5,0,2022-08-17T11:29:06.000Z
1559241076850020354,@jodikantor,Intriguing suggestion,0,14,0,2022-08-15T18:10:16.000Z
1559318167096262658,@Jan_Ransom,. @nytimes will be tracking every death of a person held on Rikers Island with a summary of what we know. Expect updates as we learn more:,1,74,0,2022-08-15T23:16:36.000Z
1559641435388973059,@JordynJournals,"What do shoppers really want? Walmart says more groceries and less discretionary stuff. Then there's Home Depot, where 12-foot-tall Halloween skeletons, sold out within hours “There aren’t many things more discretionary than a giant skeleton”",4,10,0,2022-08-16T20:41:09.000Z
1559607504857874438,@ShiraOvide,I'll also say that it's possible to ignore 98% of my email because Gmail has gotten very good (but not perfect) at notifying me about only the important messages.,3,1,0,2022-08-16T18:26:19.000Z
1559587663119876097,@ShiraOvide,"In today's On Tech: Data is increasingly informing decisions about our lives and world. On the appeal and drawbacks of Fitbits for human systems, including work and criminal justice. ""People are not machines,"" @merbroussard said.",1,11,0,2022-08-16T17:07:29.000Z
1559559015335530496,@KYWeise,"This @andrewrsorkin @mikiebarb conversation about the carried interest tax loophole was such a good, clear explainer of all the questions I've been wondering",1,8,0,2022-08-16T15:13:39.000Z
1559545176657362944,@ShiraOvide,Very curious to see how the market develops now that the government has created a category for hearing aids sold like drugstore eyeglasses. (Just a reminder that it took DECADES for the over-the-counter eyeglass market to get robust.),2,4,0,2022-08-16T14:18:39.000Z
1559544196708679682,@ShiraOvide,"If anyone is feeling bad about keeping up with their emails, I am closing in on 60,000 unread messages in my inbox and I DO NOT MIND. This is freedom.",12,5,0,2022-08-16T14:14:46.000Z
1559544412702646276,@ShiraOvide,As @TaylorLorenz memorably wrote:,1,1,0,2022-08-16T14:15:37.000Z
1559508362257104897,@richbarbieri,First @nytimes byline for @JordynJournals Welcome!,2,8,0,2022-08-16T11:52:22.000Z
1557010016682790912,@sheeraf,"New story up with ⁦ @stevenleemyers ⁩, looking at how Russia continues to spread misinformation about the war in Ukraine, especially in non-English languages.",1,9,0,2022-08-09T14:24:50.000Z
1556930329163751425,@satariano,"Russia is occupying not just physical territory in Ukraine, but also the internet. Connections that once linked to the global internet are now funneled through Russia's censored networks, choking off information and communication. (w/ @scottreinhard ) https://nytimes.com/interactive/2022/08/09/technology/ukraine-internet-russia-censorship.html…",8,154,0,2022-08-09T09:08:11.000Z
1556966347090829312,@ShiraOvide,No surprise that @ianmking is smart here: Intel is getting a bunch of taxpayer money to build and expand. Business reality also puts Intel under pressure to shrink.,1,2,0,2022-08-09T11:31:18.000Z
1556613345985323008,@ShiraOvide,The ad implies a connection between shortages of chips (caused partly by a pandemic shift of spending more on products vs. services) and a potential national interest in ensuring U.S. expertise in advanced chip design/manufacturing. BUT IS THERE THOUGH?,0,0,0,2022-08-08T12:08:36.000Z
1555582162237267974,@ShiraOvide,Upshot: We are going to be paying a lot more for streaming video subscription services.,1,0,0,2022-08-05T15:51:03.000Z
1555572282151542784,@ShiraOvide,"If Mosseri is right that the pandemic had little lasting change on people's adoption of digital commerce, digital entertainment and mobile activity... That screws up many, many, many investment theses. (He also has a self-interest to say this, given the struggles of Meta.)",2,5,0,2022-08-05T15:11:47.000Z
1555573028116996096,@ShiraOvide,"That's what Shopify said recently, too, that the pandemic didn't change the trajectory of e-commerce adoption.",1,0,0,2022-08-05T15:14:45.000Z
1555573174481424385,@ShiraOvide,Just a reminder that no one knows anything for sure right now. About anything.,0,0,0,2022-08-05T15:15:20.000Z
