,tweet_id,user,text,num_comments,num_retweets,num_views,timestamp
1002,1637653701018935297,SethDavisHoops,"""We're playing like a bunch of ... soft guys!"" Drew Timme at halftime, probably",12,9,389000,2023-03-20 03:14:03
1004,1637642681739247616,SethDavisHoops,ahhhh MIAMI is on a run. Sorry gang my brain is like oatmeal after being in this studio for six days. Indiana is still in deep doo doo.,10,5,556000,2023-03-20 02:30:15
1005,1637642415673573379,SethDavisHoops,The exception to the narrative,2,1,468000,2023-03-20 02:29:12
1006,1637280003472740352,SethDavisHoops,"Just talked to Gene Steratore, the backcourt call against Penn State was correct. It's a case of ""you are where you were."" Player was in the frontcourt when he went airborne. Basketball does not have to cross midcourt in that scenario, only on a dribble. Consider me corrected!",13,6,477000,2023-03-19 02:29:06
1007,1637278943479832579,SethDavisHoops,Northwestern and UCLA tied at 45 with 11:26 to play. Gonna be one of those nights?,3,0,232000,2023-03-19 02:24:53
1008,1637276784126226432,SethDavisHoops,Texas. Sharpie.,2,8,191000,2023-03-19 02:16:19
1009,1637276324346642434,SethDavisHoops,Oh Marcus,0,0,193000,2023-03-19 02:14:29
1010,1637274698097500160,SethDavisHoops,How is that backcourt???,28,14,815000,2023-03-19 02:08:01
1011,1637273986898722818,SethDavisHoops,The Dylan Disu game.,3,18,289000,2023-03-19 02:05:12
1012,1637271859807780870,SethDavisHoops,Ohhhh goodness! Penn State is now within one. Here we go.,4,2,222000,2023-03-19 01:56:45
1013,1637269698483048452,SethDavisHoops,Saturday 9:47 pm,4,4,268000,2023-03-19 01:48:09
1014,1637264784419594241,SethDavisHoops,Houston. Sharpie.,6,9,202000,2023-03-19 01:28:38
1015,1637262005064065025,SethDavisHoops,The Tramon Mark game.,4,3,25000,2023-03-19 01:17:35
1016,1637261774247395329,SethDavisHoops,Houston is playing championship level defense.,21,15,453000,2023-03-19 01:16:40
1017,1637260948208582657,SethDavisHoops,Auburn is now 15 of 31 from the foul line. That's not how you get Capone.,3,6,236000,2023-03-19 01:13:23
1018,1637260001591820288,SethDavisHoops,Potentially a life changing 20 minutes coming up here for Rodney Terry.,2,1,265000,2023-03-19 01:09:37
1019,1637258952147607553,SethDavisHoops,"Penn State is 2 of 13 on threes in the first half. The Nittany Lions have no Plan B. Either those shots go in, or they go home.",8,1,255000,2023-03-19 01:05:27
1020,1637255083728486400,SethDavisHoops,"Of course it's not an excuse. That's my point. Overcoming injuries is the difference between the second round and the Sweet Sixteen. Tennessee did it, Duke didn't -- and hasn't all season.",6,2,462000,2023-03-19 00:50:05
1021,1637231722965114882,SethDavisHoops,This is the point where not having Bill Self on the bench becomes very relevant.,26,22,589000,2023-03-18 23:17:15
1023,1637202219639472129,SethDavisHoops,"That I did! Very very wrong! Happy for Rick Barnes, he takes a lot of gump for not doing more in March. And he's got more to do.",49,24,1926000,2023-03-18 21:20:01
1024,1637201964269289473,SethDavisHoops,Duke this season was elite but fragile. Blue Devils were 19-1 with their full complement of players. They were 8-8 when at least one player was out. Didn't have Mark Mitchell today because he hurt himself at practice. Bad timing to say the least.,314,212,2201000,2023-03-18 21:19:00
1025,1637197165213646848,SethDavisHoops,Tennessee. Sharpie.,23,16,364000,2023-03-18 20:59:56
1026,1637189016096235520,SethDavisHoops,Lol I suck at math. Enhances my point!,1,0,398000,2023-03-18 20:27:33
1027,1637188810688667651,SethDavisHoops,No holding back now. Devils officially in trouble.,6,2,411000,2023-03-18 20:26:44
1028,1637179516404596736,SethDavisHoops,"Fantastic finish of the first half for the Vols. Ended on a 14-2 run, forced Roach into his third foul, and starting to make shots. Blue Devils need to regroup at halftime. They look like a young team right now.",20,4,358000,2023-03-18 19:49:48
1029,1637178912252755968,SethDavisHoops,Third on Roach. Huuuuuuge,4,1,215000,2023-03-18 19:47:24
1030,1637175584412368896,SethDavisHoops,Whitehead's emergence as a 3-point shooter has been a huge difference maker for Duke the last few weeks. Key the rest of the way is whether/when Plavsic or Nkamhoua picks up a third foul.,5,5,243000,2023-03-18 19:34:11
1031,1637173914731180032,SethDavisHoops,Tennessee has six fouls to Duke's two. Foul line could be huge for the Devils in this one.,30,16,626000,2023-03-18 19:27:33
1032,1637172243582136320,SethDavisHoops,RIP Freedom of Movement,11,8,327000,2023-03-18 19:20:54
1033,1637171827368775681,SethDavisHoops,I spy grown man defense.,18,13,355000,2023-03-18 19:19:15
1034,1637155588411883521,SethDavisHoops,San Diego State. Sharpie.,7,24,321000,2023-03-18 18:14:43
1035,1637151630800875521,TheAthleticNBA,"These days, Jaylen Brown calls himself Micah Shrewsberry’s biggest fan. Brown seems even more appreciative now of the way Shrewsberry guided him through discouraging stretches. ""I appreciate him greatly for that.""",0,13,417000,2023-03-18 17:59:00
1036,1637107858989883392,SethDavisHoops,"Bummed that Bill isn't coaching, but glad he's taking care of his health and his heart. That's way more important than a game.",7,9,484000,2023-03-18 15:05:04
1037,1637107744434995200,SethDavisHoops,"I've always loved Cooley's candor and respect for the media. He did not lie, he did not duck and dodge. Barring a last minute change of heart he appears to be headed for Georgetown.",11,8,61000,2023-03-18 15:04:36
1038,1637106716352430081,SethDavisHoops,Master class on deadline writing Kravitz: History repeats as Purdue’s promising season ends with embarrassing thud via @TheAthletic,2,2,179000,2023-03-18 15:00:31
1039,1637099489264832513,BrianHamilton,Saturday Madness @TheAthleticCBB ... @cj_teague + @Williams_Justin on Fairleigh Dickinson: http://theathletic.com/4322376 @bkravitz on Purdue: http://theathletic.com/4322158 @DanaONeilWriter on UConn: http://theathletic.com/4321858 @KyleTucker_ATH on Kentucky: http://theathletic.com/4322155,1,9,432000,2023-03-18 14:31:48
1040,1637104737618100224,SethDavisHoops,I second this!,4,0,369000,2023-03-18 14:52:40
1041,1637104343563264002,SethDavisHoops,Any theories?,85,8,206000,2023-03-18 14:51:06
1042,1637100768493727745,SethDavisHoops,"If you want to know what's going to happen today, here's your spoiler! My picks against the spread for all eight games for @TheAthleticCBB .",1,1,181000,2023-03-18 14:36:53
1043,1637100353979138051,SethDavisHoops,Of course last year Houston was the No. 5 seed in the South and got to play Villanova in the Elite Eight in San Antonio. These things tend to even out over time. The big Q is whether Marcus Sasser and Jamal Shead are healthy. They'll need to be against a team that loves to run.,6,3,266000,2023-03-18 14:35:14
1044,1637099783008444417,SethDavisHoops,"What if the committee sent Houston somewhere else to avoid having to play Auburn in Birmingham ... and then Illinois won the game? That would have been hilarious! Looking forward to an awesome slate of games today. Let's do this, America!",15,4,433000,2023-03-18 14:32:58
1045,1637099564216844289,SethDavisHoops,"Of the bazillion brackets that have been filled out, none got the 32 first-round results correctly. Yet some people are saying the NCAA selection committee should correctly predict all those games to avoid homecourt advantages for lower seeded teams in the second round. Got it!",28,17,805000,2023-03-18 14:32:06
1046,1637082215455784960,SethDavisHoops,"Seth Davis’ NCAA Tournament picks: Duke-Tennessee, Kansas-Arkansas and more via @TheAthletic",2,1,216000,2023-03-18 13:23:10
1048,1636901095439048709,CJMooreHoops,"In 2006, Bill Self was 0-3 in Elite Eights and had lost to Bucknell and Bradley in back-to-back years and there were some who questioned him. The NCAA Tournament is not the only way to judge a coach. And keep getting good teams there, eventually you're going to push through.",59,87,1555000,2023-03-18 01:23:27
1049,1636952447603097601,DavidWorlock,"Sunday schedule (times ET): Xavier-Pitt (12:10, CBS) Kentucky-Kansas St. (2:40, CBS) Marquette-Michigan St. (5:15, CBS) UConn-St. Mary's (6:10, TNT) Baylor-Creighton (7:10, TBS) FAU-FDU (7:45, truTV) Indiana-Miami (8:40, TNT) Gonzaga-TCU (9:40, TBS)",14,263,322000,2023-03-18 04:47:31
1050,1636956796324552705,SethDavisHoops,One. Done.,7,3,253000,2023-03-18 05:04:48
1051,1636848538234544128,SethDavisHoops,Pitt. Sharpie.,8,33,422000,2023-03-17 21:54:37
1052,1636831472085778432,SethDavisHoops,Marquette. Sharpie.,2,6,228000,2023-03-17 20:46:48
1053,1636827212828557319,SethDavisHoops,Because college basketball,2,3,286000,2023-03-17 20:29:52
1054,1636824323909402636,SethDavisHoops,Gaels looked good! Solid win.,2,1,29000,2023-03-17 20:18:24
1055,1636824208666705937,SethDavisHoops,Saint Mary's. Sharpie.,2,6,161000,2023-03-17 20:17:56
1056,1636822279198785564,SethDavisHoops,Iowa State is on pace to score 20 points.,6,2,186000,2023-03-17 20:10:16
1057,1636820986619150355,SethDavisHoops,Iowa State still does not have a field goal.,2,4,301000,2023-03-17 20:05:08
1058,1636818008214495233,SethDavisHoops,Pitt up 16-2 on Iowa State. That's good right?,19,8,294000,2023-03-17 19:53:18
1059,1636817014579707905,SethDavisHoops,Ace is back for VCU! Comes in and sticks a jumper. I spy an emotional lift!,1,0,136000,2023-03-17 19:49:21
1060,1636813763922804756,SethDavisHoops,Ace Baldwin limping into the locker room for VCU. ENOUGH WITH ALL THESE INJURIES,1,3,17000,2023-03-17 19:36:26
1061,1636809595866738690,SethDavisHoops,Baylor. Sharpie.,1,10,146000,2023-03-17 19:19:52
1062,1636803860437008391,SethDavisHoops,Xavier. Sharpie.,4,8,136000,2023-03-17 18:57:05
1063,1636802868362477598,SethDavisHoops,Nunge with the game saving block!,11,5,186000,2023-03-17 18:53:08
1064,1636802129271586818,SethDavisHoops,"Kennesaw State down one with the ball, coming out of a time out. Bet you're glad you called in sick!",4,9,191000,2023-03-17 18:50:12
1065,1636801903706112012,SethDavisHoops,Tough call on Youngblood but it was the right one.,10,2,246000,2023-03-17 18:49:18
1066,1636781523918635013,SethDavisHoops,Kennesaw State now up 41-34 on Xavier late first half. Here we go.,2,6,138000,2023-03-17 17:28:19
1067,1636781425478320169,SethDavisHoops,That's a big call on Hoggard for his third foul. They should have wiped that out upon review.,6,3,138000,2023-03-17 17:27:56
1068,1636781280552534049,SethDavisHoops,That was a clear flop by Drew Peterson.,3,8,146000,2023-03-17 17:27:21
1069,1636775231422627842,SethDavisHoops,the trick is to lick your palms!,5,0,293000,2023-03-17 17:03:19
1070,1636741962236583936,SethDavisHoops,"Less than two hours until the games start! Be sure to read my picks for @TheAthleticCBB before you, you know, watch. Let's do this, America.",2,1,137000,2023-03-17 14:51:07
1071,1636739481444155395,SethDavisHoops,"I can't remember a tournament where so many top teams have had major injury questions. Houston is prime example, but UCLA, Kansas and Alabama as well. Not to mention the absence of Bill Self yesterday for KU. Hope everyone gets well quick!",9,16,369000,2023-03-17 14:41:16
1072,1636739303475642370,SethDavisHoops,A No. 15 seed has won a first-round game in seven of the last 11 years. We have officially reached a point where this is more likely to happen for at least one No. 15 seed each tournament than not.,13,26,478000,2023-03-17 14:40:33
1073,1636737597882916866,SethDavisHoops,"Nothing like seeing those shots go in!!! These teams are so evenly matched, a few made (or missed) buckets here and there makes all the difference.",0,0,251000,2023-03-17 14:33:47
1074,1636723003882115073,BrianHamilton,Friday Madness @TheAthleticCBB ... @eamonnbrennan on Princeton: http://theathletic.com/4318496 @BrendanRMarks on Furman: http://theathletic.com/4317909 @BFQuinn on Maryland: http://theathletic.com/4317356 @SethDavisHoops Day 2 picks: http://theathletic.com/4315158,0,3,214000,2023-03-17 13:35:47
1075,1636720409381879810,SethDavisHoops,You say you don’t feel well? Hmmm your forehead feels a little warm. I think out of an abundance of caution you should take the day off from school/work today. I will sign a note.,12,34,508000,2023-03-17 13:25:29
1076,1636711412822048770,SethDavisHoops,Ready!,0,0,279000,2023-03-17 12:49:44
1077,1636709071284846594,PaulBiancardi,"Thomas Konchalski has been selected to receive the 2023 John W. Bunn Lifetime Achievement Award! Join colleagues, friends and coaches to celebrate!! Saturday, March 25, 2023 11:30 am to 2 pm Bryant Park Grill - Manhattan Details:",1,2,188000,2023-03-17 12:40:25
1078,1636708526658662400,SethDavisHoops,"Seth Davis’ NCAA Tournament picks: Michigan State-USC, Kentucky-Providence and more via @TheAthletic",0,1,158000,2023-03-17 12:38:15
1080,1636581903326236675,SethDavisHoops,Day is done,13,0,293000,2023-03-17 04:15:06
1081,1636490811054456844,SethDavisHoops,Tension convention in Sacramento!,1,3,14000,2023-03-16 22:13:08
1082,1636489489966063616,SethDavisHoops,Rut Roh time for Arizona!,3,3,18000,2023-03-16 22:07:53
1083,1636483293419048962,SethDavisHoops,Charleston shot 5 of 24 from three against the Aztecs. That will lose you some games in March.,21,8,239000,2023-03-16 21:43:16
1084,1636482422098231296,SethDavisHoops,Totally irrelevant whether San Diego State wins by four or six.,42,13,712000,2023-03-16 21:39:48
1086,1636481152348291078,SethDavisHoops,"my bad they called a foul, Bradley going to the line for SD St",12,1,198000,2023-03-16 21:34:45
1087,1636481035104931840,SethDavisHoops,Charleston down three with the ball and 25.1 seconds to play.,9,0,216000,2023-03-16 21:34:17
1088,1636478195154157568,SethDavisHoops,Btw what happened to Pelle Larsson? Arizona guards are no shows today.,2,0,179000,2023-03-16 21:23:00
1089,1636478127810420737,SethDavisHoops,Charleston is one of the deepest teams in the country and is used to winning the last four minutes. San Diego State is real deep too. Cougars are 5 of 22 from three. Need to drill some long ones.,8,2,206000,2023-03-16 21:22:44
1090,1636468043130740738,SethDavisHoops,Texas A&MCC back to within 13. Premature Sharpie?,9,1,192000,2023-03-16 20:42:40
1091,1636467682634506274,SethDavisHoops,This is the indoor setup btw. Watch everything while eating avocado toast!,8,1,222000,2023-03-16 20:41:14
1092,1636464034303057926,SethDavisHoops,very well said,1,2,319000,2023-03-16 20:26:44
1093,1636457407126867968,SethDavisHoops,Kansas. Sharpie.,1,12,17000,2023-03-16 20:00:24
1094,1636453774360207360,SethDavisHoops,I'm sure you're getting lots of work done,6,0,369000,2023-03-16 19:45:58
1095,1636453582978293763,SethDavisHoops,AaaaaaaaaaMEN! @notthefakeSVP,1,0,317000,2023-03-16 19:45:12
1096,1636439820162433024,SethDavisHoops,Furman. Sharpie.,5,19,188000,2023-03-16 18:50:31
1097,1636439720967192596,SethDavisHoops,I can't believe Clark threw that pass,16,13,268000,2023-03-16 18:50:07
1098,1636439471242526758,SethDavisHoops,Pegues for three!!!!!,1,4,123000,2023-03-16 18:49:08
1099,1636438388562640901,SethDavisHoops,Maryland. Sharpie.,4,13,134000,2023-03-16 18:44:50
1100,1636433931976228866,SethDavisHoops,ALL TIED UP!!!! Furman and Virginia coming down to the wire.,2,3,125000,2023-03-16 18:27:07
1101,1636420514175483905,SethDavisHoops,Furman scored its fewest points in a half all season and yet is only down by five. Virginia can put you away and keep you in the game at the same time. Great second half coming up!,3,3,164000,2023-03-16 17:33:48
1102,1636420020858241024,SethDavisHoops,Mike Bothwell just picked up his third foul for Furman. No bueno.,1,0,139000,2023-03-16 17:31:50
1103,1636413477332959247,SethDavisHoops,Furman is on pace to score 38 points.,19,3,244000,2023-03-16 17:05:50
1104,1636411882218176531,SethDavisHoops,Furman starts off 3 for 13 from the floor. It's almost like Tony Bennett is a good defensive coach.,20,10,379000,2023-03-16 16:59:30
1105,1636409464218857473,SethDavisHoops,Strong!,0,1,281000,2023-03-16 16:49:53
1106,1636397455355916289,SethDavisHoops,What's your man/woman cave screen setup looking like? Send me a picture and I'll tweet the best ones! NATIONAL HOLIDAY!,211,17,1948000,2023-03-16 16:02:10
1107,1636397321045921792,SethDavisHoops,Our @truTV starting NOW! Join me @TurnerSportsEJ @Candace_Parker and @CoachJayWright !,1,1,114000,2023-03-16 16:01:38
1108,1636390011884179460,SethDavisHoops,Ready?,18,13,476000,2023-03-16 15:32:36
1109,1636361831353548800,SethDavisHoops,I think he was saying he did NOT want Purdue to see this. (Narrator: They did.),7,0,50000,2023-03-16 13:40:37
1110,1636361029557862400,SethDavisHoops,This is your last chance to read through my bracket picks at @TheAthleticCBB . You'll thank me later.,6,1,164000,2023-03-16 13:37:26
1111,1635853236287545345,SethDavisHoops,"Two great games, one four-point game, one one-point game. If you ignore the First Four, you ignore fun.",7,6,277000,2023-03-15 03:59:38
1112,1635848435013234690,SethDavisHoops,What an incredible job Jeff Capel has done at Pitt this season. Panthers are still playing!,4,36,448000,2023-03-15 03:40:34
1113,1635847813429878787,SethDavisHoops,Pittsburgh. Sharpie.,8,40,725000,2023-03-15 03:38:05
1114,1635847346775834625,SethDavisHoops,21 lead changes!,0,1,18000,2023-03-15 03:36:14
1115,1635840200994705410,SethDavisHoops,Neither team has made a three-point shot this half. This game will be decided by free throws. Again.,2,3,251000,2023-03-15 03:07:51
1116,1635814401360945153,SethDavisHoops,66 to go,2,1,388000,2023-03-15 01:25:19
1117,1635808474771718146,SethDavisHoops,Texas A&M Corpus Christi. Sharpie.,7,9,289000,2023-03-15 01:01:46
1118,1635804801261764608,SethDavisHoops,All tied up in Dayton! Could we be headed for one of those finishes already? Get to @truTV,0,0,215000,2023-03-15 00:47:11
1119,1635799926150971394,SethDavisHoops,"Texas A&M CC is outscoring SEMO from the foul line, 17-2. That's how you get Capone.",2,1,234000,2023-03-15 00:27:48
1120,1635775351744872452,SethDavisHoops,Don't worry I will start lighting myself on fire starting on Thursday. So fun to be back!!,6,0,475000,2023-03-14 22:50:09
1121,1635750709223211016,SethDavisHoops,Games tipping off soon!,5,0,409000,2023-03-14 21:12:14
1122,1635714088658403338,SethDavisHoops,"NCAA Tournament First Four picks: Mississippi State-Pittsburgh, Nevada-ASU and more via @TheAthletic .",0,0,169000,2023-03-14 18:46:43
1123,1635714019230089230,SethDavisHoops,NCAA Tournament 2023 bracket picks from Seth Davis: Why Alabama will win it all. via @TheAthletic,3,1,174000,2023-03-14 18:46:26
1124,1635703589145329664,SethDavisHoops,The Ed Cooley to Georgetown chatter is getting chattier by the hour.,52,113,817000,2023-03-14 18:05:00
1125,1635665922592571393,SethDavisHoops,NCAA Tournament 2023 bracket picks from Seth Davis: Why Alabama will win it all via @TheAthletic,6,2,211000,2023-03-14 15:35:19
1126,1635062627243278336,SethDavisHoops,If they don’t blow that game at Minnesota they are probably in,9,2,704000,2023-03-12 23:38:02
1127,1635061745445384192,SethDavisHoops,Not mad. Just one man’s opinion. Great season for the Pack hope they keep winning!!!,22,5,1422000,2023-03-12 23:34:32
1128,1635055474348539906,CBSSportsCBB,"Let's hop over to Studio 43 to chat with Greg Gumbel, @ClarkKelloggCBS , @SethDavisHoops and @CoachJayWright about their thoughts on the bracket.",5,17,988000,2023-03-12 23:09:37
1129,1635057376373145601,SethDavisHoops,It worked!,1,0,488000,2023-03-12 23:17:11
1130,1635052849926402053,SethDavisHoops,I knew it was wrong as soon as I said it!!!!!!!,28,22,1704000,2023-03-12 22:59:11
1131,1635034229812895744,SethDavisHoops,LET'S DO THIS,26,12,414000,2023-03-12 21:45:12
1132,1635009694195679233,SethDavisHoops,"Keep everyone close to home as possible, easier for fans and family too",14,2,682000,2023-03-12 20:07:42
1133,1635009574041452544,SethDavisHoops,"Injuries are a factor, the date of the game is not",4,1,537000,2023-03-12 20:07:14
1134,1635008709406654465,SethDavisHoops,"I hope all this has helped educate folks on how this works. Again, I know there will be lots of disagreements, but I don't like it when there is misinformation--sometimes deliberate misinformation. Let's set aside conspiracy theories and personal attacks, and have a great debate",17,9,1305000,2023-03-12 20:03:47
1135,1635008388190048257,SethDavisHoops,"Also....36 pct of 12 seeds have won their first game, and 21 pct of 13 seeds. On the show today, I'll look to pick 1-2 No. 12 seed to win at least one game, and at least one No. 13 seed.",2,10,449000,2023-03-12 20:02:31
1136,1635008201161838594,SethDavisHoops,"Over the last 20 tourneys, 60 pct of Final Four teams have been 1 seeds. 32 pct have been 2s, and 18 pct have been seeded 5 or below. So safest strategy is pick two 1 seeds to go to the Final Four, one 2, and one sleeper 5 or lower.",27,40,1223000,2023-03-12 20:01:46
1137,1635007800815517698,SethDavisHoops,"As for picking games, lots to cover next few days, but here are some stats courtesy of CBS ace researcher Wayne Fidelman.",2,1,35000,2023-03-12 20:00:11
1138,1635007548297465856,SethDavisHoops,Again: Disagree with their decisions all you want. I'm sure I will. But it's not because the results didn't count. Capisce?,4,1,248000,2023-03-12 19:59:11
1139,1635007442915577856,SethDavisHoops,And btw it's not just the teams playing that are impacted. All those dominoes get tipped. So a team from the Mountain West that was set for New York might get switched to Vegas.,0,1,269000,2023-03-12 19:58:46
1140,1635007310614654976,SethDavisHoops,"For many years now (I'm not sure exactly how long), the committee has done a half dozen-plus contingency brackets to account for today's games. There are two games going on right now. They affect the seed ranking marginally, but it could be a big difference in bracketing.",1,1,246000,2023-03-12 19:58:14
1141,1635000804431249408,SethDavisHoops,"The NET replaced the RPI because the RPI was purely results based. The NET is results based but features predictive properties like those used on KenPom etc. The NET is designed to be correct on Selection Sunday, when all the data is in.",47,23,947000,2023-03-12 19:32:23
1142,1635000507680047108,SethDavisHoops,"Lots of misconceptions about the NET. It is an organizing tool. A team's overall rank is not all that important. It's reflective of what's important, but the rank itself means nothing.",32,33,1362000,2023-03-12 19:31:12
1143,1635000296194850816,SethDavisHoops,"First off, deciding the teams. Much of this is subjective. But most is not. The idea is to standardize the committe's decisions as much as possible. The final bracket will look very much like most of the mock brackets out there. Some differences, yes, but a lot more similarities",3,4,232000,2023-03-12 19:30:22
1144,1634999949711785985,SethDavisHoops,We're about two and a half hours from seeing the bracket. So let's talk about the bracket and how it's put together.,6,8,275000,2023-03-12 19:28:59
1145,1634976640869732352,SethDavisHoops,yes,5,1,495000,2023-03-12 17:56:22
1146,1634973930460176387,SethDavisHoops,I was just talking about this with @jppalmCBS,13,1,717000,2023-03-12 17:45:36
1147,1634969769744146433,SethDavisHoops,"Let's gooooooo Committee will assemble ""several"" brackets to accommodate all contingencies from today's games.",5,3,471000,2023-03-12 17:29:04
1148,1634939362478784512,SethDavisHoops,This was definitely a moment in time. You think Jay Wright is ready to bust a move?,8,4,551000,2023-03-12 15:28:14
1149,1634938455892393987,FOS,"The unofficial start to March Madness is a 43-year-old TV program. CBS gets the completed brackets 15-60 minutes in advance to prepare for analysis and create graphics. But once the full slate is released, chaos ensues. @MMcCarthyREV and @achristovichh on Selection Sunday »",2,25,783000,2023-03-12 15:24:38
1150,1634924204104773632,SethDavisHoops,Another common misconception: there is no S curve. It’s all based on geography.,11,3,621000,2023-03-12 14:28:00
1151,1634923889040998400,SethDavisHoops,This was amazing.,0,1,395000,2023-03-12 14:26:45
1152,1634918941100322816,SethDavisHoops,Not at all I'm gonna do a lot of process tweeting today. It is literally humanly impossible to arrange such match-ups.,0,0,408000,2023-03-12 14:07:05
1153,1634918780731281408,SethDavisHoops,I assure you the committee misses nothing. They just come to different conclusions than some of us. VCU has only one Q1 win (today is a Q2 game) and two Q4 losses. They're 58th in the NET. I would strongly advise them to win today.,19,9,1208000,2023-03-12 14:06:27
1154,1634918114151522304,SethDavisHoops,"FWIW (not much I'm sure) My last five in: Utah State, Pitt, Nevada, Rutgers, Arizona State My first five out: Ok State, NC State, Vanderbilt, Wisconsin, Clemson",38,7,748000,2023-03-12 14:03:48
1155,1634917394882732032,SethDavisHoops,"Houston is the exact same distance from New York to Vegas, so would make sense to send the Cougars West and give Purdue NYC, which is the closest to West Lafayette.",7,1,372000,2023-03-12 14:00:56
1156,1645147242939006978,SportsCenter,WHAT A PERFORMANCE FROM UDONIS IN HIS FINAL REGULAR SEASON GAME,321,4822,37000000,2023-04-09 19:30:42
1157,1645204104312942593,SportsCenter,"Rudy Gobert tweeted this after Draymond Green's altercation with Jordan Poole. Today, Draymond responded after Gobert's altercation",175,1468,2000000,2023-04-09 23:16:39
1159,1645159350854467585,SportsCenter,THE GOLDEN STATE WARRIORS PUT UP 55 POINTS IN THE FIRST QUARTER. THE MOST EVER IN A FIRST QUARTER IN NBA HISTORY,310,3090,26000000,2023-04-09 20:18:49
1160,1645155564027101186,SportsCenter,"Steph Curry, Klay Thompson, and Jordan Poole make NBA history! The most three-pointers made by a trio of teammates in a single season",135,2950,14000000,2023-04-09 20:03:46
1161,1645153800167079936,SportsCenter,Cam Thomas put up numbers 46 PTS 16-29 FG 6-8 3-PT FG,65,326,9349000,2023-04-09 19:56:46
