,tweet_id,user,text,num_comments,num_retweets,num_views,timestamp
0,1645185519108915201,OSportsU,Fuck Jordan Poole. Laughing at an injured player.,19,23,102000,2023-04-09 22:02:48
1,1644895583482658819,CombatSportUSA,President Donald Trump in attendance at UFC 287,357,1544,8182000,2023-04-09 02:50:42
2,1644940625027141633,ufc,Stylebender and Poatan exchange words after their latest battle There is no sport like Mixed Martial Arts. UFC287,709,8595,6000000,2023-04-09 05:49:41
3,1645121932902420481,SportsCenter,UDONIS STARTS THE BREAK AND THROWS IT DOWN,73,1256,12000000,2023-04-09 17:50:08
4,1644856399221108736,Figensport,The magic of physics...,110,1982,3003000,2023-04-09 00:15:00
5,1645226577708343296,FeitsBarstool,The 2022-23 Boston Bruins officially have a shot to be the best team in the history of the sport of hockey.,6,75,633000,2023-04-10 00:45:57
6,1645215013442031616,Figensport,Excellent free kick!,13,75,9268,2023-04-10 00:00:00
7,1645220702193156099,barstoolsports,Zach Ertz almost cost Jon Rahm a green jacket,21,239,3983000,2023-04-10 00:22:36
8,1644983371850760192,SportsDoctor2,"I said it one day here, when you find yourself outside Nigeria and you see a Nigerian, you’re happy, you’re elated, you don’t care if they’re Hausa or Yoruba or Igbo, you’re just happy you’ve seen a BROTHER!!! Kamaru Usman and David Njoku out there supporting Israel Adesanya",178,1612,4034000,2023-04-09 08:39:32
9,1645158756412452876,SportsTalk790,As animated as we’ve ever seen Kyle Tucker,19,98,97000,2023-04-09 20:16:27
10,1644850107739959296,Figensport,Incredible goalkeeper!,82,2149,4645000,2023-04-08 23:50:00
11,1645207534230175744,SportsDoctor2,Uber facts just posted about Bola Tinubu’s drug case. Agbado’s drug case going global,21,87,121000,2023-04-09 23:30:17
12,1645169019262214144,AnaheimSports1,Go Go Sho! Shohei Ohtani Home Run 108.6 MPH 23° 397 Feet Shohei Ohtani homers (3) on a fly ball to center field. Mike Trout scores. 89.3 MPH slider thrown by Yusei Kikuchi. Blue Jays 0 - Angels 5 Bottom 3rd Credit: Ballys 大谷翔平 Ohtani Angels GoHalos 菊池雄星,6,380,2667000,2023-04-09 20:57:14
13,1645229651524984834,barstoolsports,An employee leaked this audio of Kyle Anderson post Rudy Gobert scuffle “Fuck is wrong with y’all? Y’all got some decisions to make this summer.”,24,54,3326000,2023-04-10 00:58:10
14,1645118514318163968,SportsCenter,UDONIS FOR THREE,56,490,9079000,2023-04-09 17:36:33
15,1645117056109387780,SportsCenter,They brought out a rocking chair for Udonis Haslem (via @MiamiHEAT ),37,536,7116000,2023-04-09 17:30:45
16,1644920712786763776,SportsCenter,"“I don’t feel the same when I get in here anymore, it’s been 20 long years.” Jorge Masvidal calls it a career in his hometown. UFC287",179,956,15000000,2023-04-09 04:30:33
17,1643749001672679424,Figensport,She is amazing,104,1330,2924000,2023-04-05 22:54:36
18,1645227111777542144,ClayTravis,Minneapolis is the most cursed sports city in America and now their NBA team has players throwing punches at each other during timeouts.,66,40,779000,2023-04-10 00:48:04
19,1645207462398791682,Figensport,Fantastic,2,82,112000,2023-04-09 23:30:00
20,1645137897228468225,KopitePodcast,| Get Peter Drury on Sky Sports ASAP.,15,345,961000,2023-04-09 18:53:34
21,1644892177670045698,MySportsUpdate,Dolphins HC Mike McDaniel linking up with Rams star DT Aaron Donald at UFC287.,131,447,16000000,2023-04-09 02:37:10
22,1645220680391172098,60Minutes,"In response to questions about last year’s mass execution of 81 people in a single day and the use of sports to cover up human rights abuses, the Kingdom’s sports minister told 60 Minutes’ Jon Wertheim: “Let's look at the good side about this … We should get people together.”",42,37,247000,2023-04-10 00:22:31
23,1645120697755205634,MichaelOnSports,Sam Presti and Steven Adams caught up pregame,9,22,154000,2023-04-09 17:45:13
24,1644947978992361472,HelenYeeSports,Israel Adesanya says he doesn’t want to give this specific fighter clout but here’s the message UFC287,91,87,4106000,2023-04-09 06:18:54
25,1645046634047328258,hashtagDgreat,"C*ck fighting sport. Finally, my 8 inches will make me proud",79,192,37000,2023-04-09 12:50:55
26,1644895013489496064,SportsCenter,QUINNIPIAC WINS ITS FIRST NATIONAL TITLE JUST SECONDS INTO OVERTIME! MFrozenFour,124,1194,15000000,2023-04-09 02:48:26
27,1645123174797918208,TPLCSports,Never ever seen anything like this in a game of football,4,34,111000,2023-04-09 17:55:04
28,1645233421629919233,YahooSports,John Rahm blames Zach Ertz for why he opened with a four-putt,1,3,4848,2023-04-10 01:13:09
29,1644950222806630401,ComplexSports,Izzy Adesanya confirms he really pointed at Periera’s son after knocking him out,104,1663,1000000,2023-04-09 06:27:49
30,1645231479541190657,MrAndyNgo,No amount of makeup or advertising deals can hide that Dylan Mulvaney is lonely. I was interviewed on @NEWSMAX by @CarlHigbie about Dylan & the trans attack on women's sports campaigner @Riley_Gaines_ . The far-left says advocating for sex-segregated sports is committing genocide…,36,86,312000,2023-04-10 01:05:26
31,1644849458457264130,Figensport,Nailed it,23,270,882000,2023-04-08 23:47:25
32,1644858392077537280,OSportsU,Shaedon Sharpe is a SuperStar We are all so lucky to watch him develop,5,29,159000,2023-04-09 00:22:55
33,1644847955977949184,Figensport,He is shocked,47,361,768000,2023-04-08 23:41:27
34,1645103636681306112,SkySportsPL,"Did the assistant referee elbow Andy Robertson?!""",1461,2001,35000000,2023-04-09 16:37:26
35,1643833329525850115,KuruptSports,"Russell Westbrook yells ""D'Angelo Russell Over Me?!?"" while entering locker room after Clipper’s series victory over the Lakers.",319,731,23000000,2023-04-06 04:29:41
36,1643819440453058562,HistoryToLearn,Diving horses first emerged as a sport in the 1880s & became very popular in the 1920s.,21,101,2465000,2023-04-06 03:34:29
37,1645221979543199745,CBSSports,What happened on Jon Rahm's four-putt to open the Masters? A text from Zach Ertz.,2,17,31000,2023-04-10 00:27:41
38,1644731431795453953,SkySportsPL,OLLIE WATKINS IS ON FIRE!,85,376,26000000,2023-04-08 15:58:25
39,1645229563897843714,DevineGospel,Someone give Nelson Cruz’s optometrist a RAISE!,1,6,3198,2023-04-10 00:57:49
40,1645205971034165249,barstoolsports,Jon Rahm. GREEN JACKET HIM.,29,259,3437000,2023-04-09 23:24:04
41,1645163198595604482,barstoolsports,Most important game of the Timberwolves season and Rudy Gobert is throwing punches at Kyle Anderson,196,412,13000000,2023-04-09 20:34:06
42,1645162722785472513,DeRushaJ,Whoa: Bally Sports North just showed Rudy Gobert punch Kyle Anderson during the timeout. Inexcusable,50,175,1831000,2023-04-09 20:32:13
43,1644837531286904833,AJEnglish,"Afghan engineers have designed the country's first sports car, the “Helmet"", using scraps left behind by US and NATO forces after their withdrawal from the country",162,1184,3765000,2023-04-08 23:00:01
44,1644615372392353793,MJK10797588,Disgusting Letting This F—-Ing Coward Man Beat a Woman and call it Sport,0,3,273,2023-04-08 08:17:14
45,1645226429012115456,benedictsports,Rimmel-88 @exchgART The Best nftart Marketplace,0,4,16,2023-04-10 00:45:22
46,1645127670055985157,MLBONFOX,Nobody: Phillies fans at any given moment: (via @NBCSPhilly ),13,73,665000,2023-04-09 18:12:56
47,1645090344470728704,arindampaul,"A lot of people say a lot of things about IPL- too much cricket, money, more of entertainment than sport etc etc But stories like this and what Rinku Singh did today far outweighs all the cons IPL enables this",2,46,165000,2023-04-09 15:44:37
48,1645182574594080768,headhonchospor2,Kenneth Lofton Jr. dropped 42 and 14 on 25 shots todayThis guy has a strong lower body and the athletic ability to finish around the rim. Kinda reminds me of a more athletic Zach Randolph. All it takes is the right situation for him : @memgrizz,2,17,124000,2023-04-09 21:51:06
49,1644867710575050758,HelenYeeSports,Monster Energy logo in the octagon looks cool with the lights UFC287,41,107,332000,2023-04-09 00:59:57
50,1644926741209575429,ComplexSports,ISRAEL ADESANYA WITH THE KO! HE’S BACK!,72,2111,5551000,2023-04-09 04:54:31
51,1644894422675406849,barstoolsports,IT ONLY TOOK THEM 10 SECONDS! QUINNIPIAC!!!! FIRET TITLE IN SCHOOL HISTORY!!!!! THE ABSOLUTE SCENES.,153,1536,33000000,2023-04-09 02:46:05
52,1644727173138219008,btsportscore,"""That is a disgrace!"" Should Brighton have got a penalty for Højbjerg's tackle on Mitoma? Peter Walton explains... BTSportScore",216,596,5736000,2023-04-08 15:41:30
53,1645123019034054657,BasedmentSports,"Had to do some UConn trivia at the Championship parade, and definitely had to show love to UConn great and CT native @huskiesalltime1",4,12,3130,2023-04-09 17:54:27
54,1645114101893410816,TPLCSports,GOAL! Liverpool 2-2 Arsenal (Firmino) LIVARS,38,215,1926000,2023-04-09 17:19:01
55,1645116456495882240,TPLCSports,RAMSDALE WITH ONE OF THE SAVES OF THE SEASON! LIVARS,12,211,124000,2023-04-09 17:28:22
56,1644633129288704001,scbarbee,Wow!! It almost became a contact sport....,8,9,2527,2023-04-08 09:27:48
57,1645135625702572032,talkSPORT,“Any chance Arsenal had of winning the Premier League is officially over.” “It’s over. I turned off at 2-0. It’s two points lost. The chance to win it is over.” Michael the Arsenal fan is adamant their title challenge is OVER after tonight,246,113,3702000,2023-04-09 18:44:32
58,1645116148994719744,TPLCSports,FINGER TIP SAVE FROM RAMSDALE! LIVARS,4,155,1546000,2023-04-09 17:27:09
59,1644905226824982528,SportsCenter,"""See you soon, boy."" Kevin Holland with a message for Jorge Masvidal after his win at UFC287",47,302,12000000,2023-04-09 03:29:01
60,1645117872916529154,justalittleclem,Sport sport sport and sport again! With Tony Igy,2,0,41,2023-04-09 17:34:00
61,1645073995413291011,SkyCricket,"FIVE SIXES IN A ROW Rinku Singh, that is sensational!",47,364,3438000,2023-04-09 14:39:39
62,1645132125400715264,talkSPORT,"“If Man City were 2-0 up against this LFC team at Anfield, they win the game.” “I think Man City are more than capable of winning every game they’ve got left…” Alex Crook wouldn’t be surprised if MCFC win every game left this season",246,137,294000,2023-04-09 18:30:38
63,1644724872537317378,TPLCSports,DE ZERBI AND STELLINI GOING AT IT! TOTBHA,38,231,3243000,2023-04-08 15:32:21
64,1645172742407192577,PlaybookSN,UD with the well deserved game ball,0,21,1735,2023-04-09 21:12:02
65,1645121589577408519,SkySportsPL,"""I'm just cooling down now...it was one of the best games I've ever seen!"" Roy Keane, Micah Richards and Jamie Carragher react to a crazy afternoon at Anfield...",61,216,6358000,2023-04-09 17:48:46
66,1645167485828878337,WahabViki,"Thank you guys @shani_official @SaimAyub7 @iamharis63 and @ihsanullahpaki1 for coming over and supporting us in this initiative. With collective efforts, I’m sure we can take Pakistan sports to new heights IA specially our National game, Hockey HunAwegaMaza",18,64,274000,2023-04-09 20:51:09
67,1644801412633591809,jayykissi,"Thought twitter should see this one too, keep showing love and liking the tiktok. Hopefully more to come in the near future. trending sport football TikTok @SoccerAM",5,9,9215,2023-04-08 20:36:30
68,1645176484716486658,AZSports,"""Thank you for allowing me to tell the story of the Suns for 51 great years."" Al McCoy was honored during halftime of his final regular season game. Watch the full presentation: https://youtube.com/watch?v=MupFSd_-1TQ&ab_channel=ArizonaSports… @JGSports_6",6,37,6720,2023-04-09 21:26:54
69,1645114465891807232,SkySportsPL,LIVERPOOL ARE LEVEL!! Firmino heads home! WHAT A GAME!,169,401,27000000,2023-04-09 17:20:28
70,1644782965153570820,talkSPORT,"“That Brighton game was an utter disgrace. Even Spurs fans know it!” “We can joke about going to certain opticians, but it’s not funny.” @MarkGoldbridge slams VAR in the Premier League for what happened in Spurs 2-1 Brighton earlier today",204,566,17000000,2023-04-08 19:23:12
71,1644611100615512066,renzosays,Isama Mo Na Buong Kamag-Anak Mo: The role of family in the development of grassroots sports program in the Philippines,4,294,1773000,2023-04-08 08:00:16
72,1645215639403896833,ATZreactionvids,Wooyoung from Ateez sped up competitive sports run fast meme reaction video / “Roman holiday” by Nicki Minaj as bgm,0,2,296,2023-04-10 00:02:29
73,1644977066872283136,SportsDoctor2,"I had goosebumps listening to this promo!!!! Alex Pereira became like a wall for Israel, gave him his first, second and third defeats, took his title away from him. But Israel Adesanya came back and delivered a match ending KO!!!! THE CHAMP IS BACK INDEED!!!!",8,162,247000,2023-04-09 08:14:29
74,1645178931618750470,GlockfordFiles,Woke marxist democrats have destroyed women’s sports and are close to destroying our republic. The marxist democrat controlled media remains silent as it happens.,11,142,6057,2023-04-09 21:36:37
75,1644921424149196801,SportsCenter,IZZY IS LOCKED IN UFC287,51,348,6548000,2023-04-09 04:33:23
77,1645130012389982210,talkSPORT,"“Every time Arsenal have had a setback, they’ve reacted. They haven’t lost!” “It’s a point gained. If this was at the Emirates, they win the game.” Adebayo Akinfenwa believes Arsenal gained a point rather than drop two today",86,76,1622000,2023-04-09 18:22:14
78,1644927609803886593,ComplexSports,Izzy really did Pereira’s arrow celebration after knocking him out (via @BroBible ),47,1148,6094000,2023-04-09 04:57:58
79,1644988527128776705,SkySportsPL,"""We're proud of him"" Wholesome stuff from Harry Kane, Pierre-Emile Højbjerg and Eric Dier on Son Heung-min reaching 100 Premier League goals",50,450,286000,2023-04-09 09:00:01
80,1643803850355122176,SportsCenter,Peep Fox’s reaction to Luka,98,668,15000000,2023-04-06 02:32:32
81,1645014753696264197,GHMusicAwards,"PEOPLE OF HO! WE ARE COMING Performing live @stonebwoy 24thVGMA Xperience Concert Sat, 15th April 2023 Ho Sport Stadium Fee is absolutely Free,courtesy Vodafone. You can join us live at 9pm on TV3 and FB: Ghana Music Awards and YT: Charterhouselive",3,64,137000,2023-04-09 10:44:14
82,1645195795757674496,MLBONFOX,VIBES The Giants clubhouse transformed into a CLUB after the come-from-behind win! (via @SFGiants ),16,68,69000,2023-04-09 22:43:38
83,1644881419745861632,SipCowbellSport,"We won an SEC series ladies and gentlemen, cue the music. HailState",4,12,2400,2023-04-09 01:54:25
84,1645082804194013186,SwearingSport,Never mess with Jaap Stam when he’s angry. Fucking nutter!,4,13,812000,2023-04-09 15:14:39
85,1645185928825020420,OOSSports,What an insane sequence of events by ANT MAN!!! Wolves lead by five with less than a minute to go!!! NBA,0,8,2971,2023-04-09 22:04:26
86,1645223981186949120,DevineGospel,THE KOREAN KING is the biggest ATL star since Gucci Mane,2,12,3026,2023-04-10 00:35:38
87,1645172214130507776,KuruptSports,Kyle Anderson just told Rudy Gobert “You don’t deserve 5 first round picks. You goofy a** clown” Rudy Gobert caught feelings and proceeds to throw a punch,3,16,142000,2023-04-09 21:09:56
88,1643959238220193794,talkSPORT,𝗗𝗲𝗮𝗻𝗼: “My tip is Matt Kuchar! His coach said his game is at 100%. Great chipper!” 𝗔𝗹𝗮𝗻: “Is Sue Barker winning Wimbledon?!” Dean Saunders has backed a golfer to win themasters that ISN’T playing. This is an incredible few minutes,241,490,1000000,2023-04-06 12:50:00
89,1644345147935584256,SwearingSport,The fucking referee just turned into Antonio Rudiger,35,865,6267000,2023-04-07 14:23:28
90,1645088573819846656,talkSPORT,“I don’t think Steven Gerrard believed Watkins was good enough.” “They were thinking of getting to the next level by buying a ready made player.” Tony Cascarino criticises Steven Gerrard for not having enough belief in AVFC’s Ollie Watkins,47,30,1575000,2023-04-09 15:37:34
91,1645213510820069377,DevineGospel,Nelly Cruz got new eyes and might hit 40 HRs this year,6,11,7468,2023-04-09 23:54:02
92,1645199134901645315,BALLYSPORTSAZ,We'll say it again... BELIEVE IN THE @Dbacks !,9,59,174000,2023-04-09 22:56:54
93,1645206138680487938,SkySportsNews,BREAKING: Jon Rahm is the 2023 Masters Champion.,23,135,1674000,2023-04-09 23:24:44
94,1645055209293357056,LeeKnowFacts,"Lee Know, despite being clumsy in most sports, has lightning fast reflexes LeeKnow 리노 StrayKids",1,58,3968,2023-04-09 13:25:00
95,1644666533287960577,BrightIsLoml,Me if RubinaDilaik was a sport,3,19,696,2023-04-08 11:40:32
96,1645141734811402241,OSportsU,PAYTON PRITCHARD 30 POINT TRIPLE DOUBLEEEE,1,1,1173,2023-04-09 19:08:49
97,1644794743157661701,talkSPORT,"""Kompany could get sacked with Burnley in the Premier League"" ""Sometimes, you get opportunities that you can't turn down."" Toney Cascarino believes Kompany should consider leaving Burnley.",225,80,7663000,2023-04-08 20:10:00
98,1645208749571993601,SportsNetLA,“They guys just weren’t sharp to be quite honest.” Dave Roberts feels the Dodgers didn’t play to their level of play against the Dbacks.,22,18,128000,2023-04-09 23:35:07
99,1643627647841325058,TPLCSports,Big Boi FC vs Midget FC,2,42,108000,2023-04-05 14:52:23
100,1645123825435131905,NBCSportsSoccer,"“That’s about a guy that will never linesman in the Premier League again.” Rebecca Lowe, Tim Howard and @The2RobbiesNBC react to Andrew Robertson appearing to be elbowed in the face by a linesman. MyPLMorning",25,73,1115000,2023-04-09 17:57:39
101,1644188568892628993,cwilson1310,Here’s a video showing a few of the men competing in women’s sports and winning. This must stop. No men should be allowed to compete in the womens’s category!!! SaveWomensSports SexNotGender,44,280,293000,2023-04-07 04:01:17
102,1644912099208880129,rockytopology,VolNation the most electrifying atmosphere in all of sports Play the best of the best. In the best conference. In the one of the most historic places. National brand & lots of traditions. The most passionate fans. THIS IS WHY YOU COME TO TENNESSEE!,3,34,135000,2023-04-09 03:56:20
103,1644730376680792065,JWPSports,The execution on this onside kick by Arkansas. Those blocks are how it’s done. 27 took a body.,23,114,1662000,2023-04-08 15:54:14
104,1645114383025033216,lthomasnews,"There will be an attempt to memory hole this, but Israel Adesanya has faced unyielding dismissiveness about his upside, level or ability within the sport. Especially this week - but long before it, too - his tenure has been met with skepticism. Perhaps some of that dies now.",30,59,408000,2023-04-09 17:20:08
105,1644799080646733825,barstoolsports,"Masters paused again so here’s the longest televised putt ever, courtesy of Michael Phelps",34,368,12000000,2023-04-08 20:27:14
106,1643597230773788677,LavableLvie,TONIGHT 7PM EST “RoPets Teleport Sport!” Join/friend LuvieEvents Server to join this family fun game night!,5,9,1369,2023-04-05 12:51:31
107,1644976961125482497,SkySportsPL,STOP SCROLLING and watch Matheus Nunes' incredible strike from all angles,67,359,9881000,2023-04-09 08:14:04
108,1645089466858569728,SkySportsPL,MARTINELLI! What a start! Arsenal LEAD at Anfield!,126,368,7858000,2023-04-09 15:41:07
109,1645104909010837505,rebekkarnold,"They were talking on BT Sport about how the Mitrovic banning has given officials a sense of protection & superiority that they are the most important people in football, hmm. https://twitter.com/RayRayOfficial/status/1645103261186129923/video/1…",12,66,282000,2023-04-09 16:42:29
110,1645174458695417858,49ersSportsTalk,"This shows how insanely elite NBA players are. Udonis Haslem at age 42, never got any mins in the Heat rotation, but to salute him in his last reg szn home game, they gave him mins and shot opportunities and he dropped 24 points. @ThisIsUD",0,7,3320,2023-04-09 21:18:51
111,1645219780780085249,wegoticezo,Reminder that David Pastrnak is multi sport athlete,0,1,704,2023-04-10 00:18:57
112,1645180604525453312,OSportsU,Me on my way to Jordan Poole's hate club,0,1,810,2023-04-09 21:43:16
113,1643487426927812608,xaxuzhaojjang,"The difference between hao and kuanjui reaction on sport day, really shows which one likes sports and which one doesn't",2,313,31000,2023-04-05 05:35:11
114,1644021181756874770,GRMLIVE,What sport do you m0nkey$ watch man,14,82,1507000,2023-04-06 16:56:08
115,1644436474601828378,HelenYeeSports,Jorge Masvidal brings his kids to the weigh-ins UFC287,60,46,3125000,2023-04-07 20:26:22
116,1645100018116829189,SkySportsPL,Liverpool are NOT happy!,454,442,18000000,2023-04-09 16:23:03
117,1644790933555228673,chiefone,"Sogakope was Litt last night >> Upnext, HO sports stadium tonight. lawadarepubiq LionGroup",26,100,122000,2023-04-08 19:54:51
118,1643488326568251398,taeraeday,zhanghao is just like me on sports day,10,1450,1143000,2023-04-05 05:38:46
119,1644836454453895168,Realrclark25,"NIL has changed college sports forever, not only for men, but for women’s sports as well. That’s a major reason @Reese10Angel & @Flaujae said, “I’m Chilling!”. Flau even said she Tryna go to Grad School! Lol Yea @thepivot had some fun! https://youtu.be/VP8GZa1Hsi0",120,765,5486000,2023-04-08 22:55:44
120,1644188875659661314,hazardc,"Jerry Garcia Band The Night They Drove Old Dixie Down April 18 1993 Sports Arena, San Diego, CA jerrygarcia gratefuldead (Remaster) :) Really good for a 93 handheld -- this one is worth watching till the end, it just gets better and better <3",21,69,148000,2023-04-07 04:02:30
121,1645117856005120001,PlaybookSN,UD is a sniper,0,22,2734,2023-04-09 17:33:56
122,1644723293604270081,talkSPORT,“Why have we got the late Sunday game & the early Saturday game?” “It’s not right.” “Players can’t recover that quickly.” Erik ten Hag isn’t happy with the Premier League’s scheduling of MUFC’s games,304,148,6182000,2023-04-08 15:26:05
123,1645075723630067712,barstoolsports,Holding a grudge against a child for 6 years is all time petty from Adesanya @SpinninBackfist,90,166,11000000,2023-04-09 14:46:31
124,1645140413798400001,DScotteclipsethis2003,Riley Gaines attacked for women's sports speech.,0,7,1589,2023-04-09 19:03:34
125,1644799136380735488,khelshel,"Pakistan team players playing Pakistan's national sport, Hockey PAKvNZ | Cricket | Pakistan | HarisRauf | ShadabKhan | MohammadNawaz | Lahore",3,21,153000,2023-04-08 20:27:27
126,1644919030845698048,barstoolsports,Jorge Masvidal has retired. A great career for one of the biggest names in UFC history. UFC287,194,923,13000000,2023-04-09 04:23:52
127,1644968641060806658,SkySportsNews,Thomas Frank wants the Premier League to look into what he called the 'dark arts' of sporting behavior in football,608,370,24000000,2023-04-09 07:41:00
128,1644415369669640192,realJustATheory,A biological man (transgender) fractures a biological woman's skull in a @CFAFIGHTS event. Why is this allowed CFA? You must answer for this idiocy! Is the all mighty dollar more important than fighter safety? This is extremely dangerous in sports like this. CallItOut,19,40,1535,2023-04-07 19:02:30
129,1645222822279540736,HBCUSports1,XFL DC Defenders WR Chris Blair (Alcorn State University) 52 yard catch,0,2,1157,2023-04-10 00:31:02
130,1645152425899073536,travelSports,“And I haven’t had much success in Monte Carlo in the last 3 years; I haven’t played really good tennis here. So I’m hoping that this year I can start 2play season better than I did in the previous years and hopefully build my form as I’m coming closer to Paris.” @DjokerNole,5,2,1141,2023-04-09 19:51:18
131,1645178456177627137,BallySportsCLE,Silly Willy is now Chill Will. ForTheLand,5,32,397000,2023-04-09 21:34:44
132,1645205823491125248,BOSSportsGordo,One more for,0,3,1212,2023-04-09 23:23:29
133,1645097796276477957,SkySportsPL,SALAH PULLS ONE BACK! Can Liverpool turn this around?,42,99,5888000,2023-04-09 16:14:13
134,1644757366255108101,talkSPORT,“It was a disgrace today.” “What’s the point in watching football when this happens time & time again??” James the BHAFC fan questions why he should even watch the Premier League & football after today’s VAR issues…,218,162,8566000,2023-04-08 17:41:28
135,1644730277405548545,SkySportsNews,Erik ten Hag has criticised the Premier League's scheduling after Marcus Rashford suffered a suspected groin injury in Man Utd's 2-0 win over Everton,863,754,42000000,2023-04-08 15:53:50
136,1644910635438710784,SCVictory1899,"1 week left before we can kill the longing for our sanctuary. Experience the best weekly routine possible, alongside our friends, meeting more people, bringing new members and rooting for our club. I love you @ECVitoria",1,18,8332,2023-04-09 03:50:31
137,1644285135125356544,talkSPORT,“I got sacked from MCFC when the money came into the club.” “I was feeling sorry for myself.” “Pulis said to me ‘You’ve not managed until you’ve had three good sackings.” Stuart Pearce reveals how Tony Pulis helped him get over his first sacking!,176,168,8963000,2023-04-07 10:25:00
138,1645182009474424832,BallySportsCLE,"""For our team, I was thrilled. For [Will], I was really happy."" ForTheLand",0,15,103000,2023-04-09 21:48:51
139,1644129130282139650,GloryDaySports,"“with the 11th overall pick in the 2023 NFL Draft, The Tennessee Titans select Quentin Johnston, WR, Texas Christian University.”",38,38,1912000,2023-04-07 00:05:05
140,1644576846422351872,VPicopico,"Loena has been posting some SOI practice clips on Chique Sport's insta stories, here's a 4T, 3A and 4T3T from Shoma!",1,83,119000,2023-04-08 05:44:09
141,1644856574786019329,IUSSportsTalk,"IUS baseball split a doubleheader with Point Park today. Scores were 5-3 Point Park, and 5-2 IUS. This was a two run blast off the bat of Mason White in the first game of the day!",0,21,7265,2023-04-09 00:15:42
142,1645174547895705600,BallySportWI,Let's not ignore the fact that Jesse got Willy here.,5,55,30000,2023-04-09 21:19:12
