,tweet_id,user,text,num_comments,num_retweets,num_views,timestamp
1833,1612208403149107200,maxolson,Miami wins the battle for UCF transfer OL Matthew Lee. All-AAC center with 36 career starts and the best available OL in the portal: https://bit.ly/3QhFsSs,7,17,916000,2023-01-08 22:03:31
1834,1612149111381426176,BruceFeldmanCFB,Goosebumps for all of this.,2,7,617000,2023-01-08 18:07:55
1835,1612136560866250753,BruceFeldmanCFB,Kirby Smart said TCU has the most unique 3-3-5 defense he's ever seen. @MikekKuchar had a terrific breakdown of it here:,1,4,447000,2023-01-08 17:18:02
1836,1610759884303175704,maxolson,"Utah RB Micah Bernard has entered the portal as a grad transfer, @TheAthletic has learned. Bernard put up 1,621 yards and 9 TDs over the last 2 seasons. Also played CB!",20,100,2135000,2023-01-04 22:07:37
1837,1610670333442543617,mitchsherman,Nebraska and Matt Rhule are settling into Act 2 of this offseason. We’ve learned a lot about the new coach — but what remains to be seen about Rhule before he coaches a game for the Huskers?,1,2,49000,2023-01-04 16:11:46
1838,1610721645504901120,BruceFeldmanCFB,"SOURCE: Stephen Matos, a Senior Analyst with the Kansas offense, is expected to become the Offensive Coordinator at Wagner. He came to KU with Lance Leipold from Buffalo.",2,20,1569000,2023-01-04 19:35:40
1839,1610716526239268877,skhanjr,"Texas A&M coach Jimbo Fisher is expected to hire Bobby Petrino as its next offensive coordinator, a source confirms to @TheAthletic . The former Arkansas HC spent the last 3 seasons as Missouri State’s HC and took the OC job at UNLV last month. Petrino is expected to call plays.",32,115,2113000,2023-01-04 19:15:20
1840,1610697552302870528,BruceFeldmanCFB,SOURCE: Missouri is hiring Fresno State offensive coordinator Kirby Moore as Mizzou’s new OC. Moore had the No. 1 offense in the MWC this year. @Chris_Hummer first reported the move.,4,22,634000,2023-01-04 17:59:56
1841,1610430064151363584,BruceFeldmanCFB,"New Audible: On Jim Harbaugh's next move; Tulane's big win; Penn State's springboard to a bigger 2023 and what does USC do to take the next step? Plus, we answer your mailbag questions:",2,2,889000,2023-01-04 00:17:02
1842,1610676028229451782,audsnyder4,Is Penn State football on verge of ‘special’ run? Expectations are already soaring for 2023 via @TheAthletic,19,16,627000,2023-01-04 16:34:24
1843,1610622207872352258,jessetemple,"""It was a done deal. We entered the portal to commit to Wisconsin."" Quarterback Tanner Mordecai choosing Wisconsin instantly elevates the Badgers. How it came together so quickly and what it means for the program:",22,45,2141000,2023-01-04 13:00:32
1844,1610657725784154113,BruceFeldmanCFB,"Ball state RB Carson Steele who ran for 1566 yards and 14 TDs and also caught 29 passes this season, is transferring to UCLA. He was on our Freaks List this year:",5,38,1018000,2023-01-04 15:21:41
1845,1610479050593824769,BruceFeldmanCFB,"SOURCE: Former Iowa State OC Tom Manning is expected to become the new offensive coordinator at Cincinnati. The 39-year-old Youngstown, OH native, a Mount Union product, spent the past 4 YRs at ISU after coaching with the Colts for one season. @JohnDBrice1 first reported the move",7,77,1542000,2023-01-04 03:31:41
1846,1610429002442752002,byjoelanderson,"""People want to channel the emotion they feel into something ... support the players when they want to be taken care of."" Exactly, this.",16,97,3449000,2023-01-04 00:12:49
1847,1610395416897675264,BruceFeldmanCFB,"SOURCE: Nebraska senior offensive analyst Steve Cooper, who helped in game-planning when NU had a Top 20 offense in 2021, is expected to become the new OC at Maine. Prior to his time at Nebraska, he was the OC at Portland State, where the Vikings beat both WAZZU and North Texas.",6,35,1215000,2023-01-03 21:59:21
1848,1610377900108447744,BruceFeldmanCFB,Terrific addition for UDub and Michael Penix Jr. Big back who caught 113 passes the past two seasons and averaged 5.5 yards per carry.,0,16,1176000,2023-01-03 20:49:45
1849,1609973311437692928,BruceFeldmanCFB,"Glad to see this. Princeton star WR (pronounced “Yoshi-vas"") is a spectacular athlete. 6-3, 205 lbs finished fourth in the country in the heptathlon & ran the fastest 60 in NCAA heptathlon history (6.71). Benches 370, VJs 39, should clock in the 4.3s: https://theathletic.com/3488797/2022/08/10/college-football-freaks-list-2022/…",3,19,1293000,2023-01-02 18:02:03
1850,1609966094680489984,BruceFeldmanCFB,SOURCE: Former FAU RB coach Chris Perkins is expected to return to the Owls as the new RBs coach. He has strong ties in South Florida from years as a HS coach at Miami Northwestern and Miami Central and also has ties in LA area from his days at LB Poly and Golden West JC.,1,18,866000,2023-01-02 17:33:23
1851,1609963949369479168,BruceFeldmanCFB,"Clemson DL Bryan Bresee announces that he's entering the 2023 NFL draft. Elite athlete.. He was No. 14 on our Freaks List this year. At 6-5, 310, he has been clocked in the high 4.7s in the 40.",1,18,546000,2023-01-02 17:24:51
1852,1609954030171848704,BruceFeldmanCFB,Fun slate of bowl games today. I’m 2-over .500 against the spread for the season. Here are all my predictions for today’s games:,4,0,449000,2023-01-02 16:45:26
1853,1609946729109164034,BruceFeldmanCFB,"As expected, Alabama QB Bryce Young, the 2021 Heisman winner, announced he is entering the 2023 NFL Draft… Great talent. Extremely accurate with terrific vision, smarts and a wonderful ability to extend plays but size/frame will concern some scouts.",9,35,964000,2023-01-02 16:16:26
1854,1609947138590674945,BruceFeldmanCFB,"Alabama superstar edge defender Will Anderson Jr. and running back Jahmyr Gibbs, a terrific all-around back, have declared for the NFL 2023 Draft.",0,10,41000,2023-01-02 16:18:03
1855,1609943738792697862,BruceFeldmanCFB,Much of this USC staff are Leach protégés and owe so much to Mike. This has been a really rough stretch for many of those families who came together two decades ago in Lubbock at Tech.,0,22,841000,2023-01-02 16:04:33
1856,1609558674611277824,BruceFeldmanCFB,"New Audible: Finally, the CFP got two classic, riveting games. @slmandel and I dig into TCU’s amazing run to the national title game, and UGA surviving CJ Stroud and Ohio State’s valiant effort:",4,3,918000,2023-01-01 14:34:26
1857,1609934150987026434,BruceFeldmanCFB,"Love this.. well done, @HailStateFB .",1,30,845000,2023-01-02 15:26:27
1858,1609917644328824833,RhettHobart,SwingYourSword,2,17,823000,2023-01-02 14:20:51
1859,1609400885414608896,DaveEmerickUSC1,LastingLegacy,25,518,4685000,2023-01-01 04:07:26
1860,1609546238395047939,AriWasserman,Wasserman: TCU is playing for a national championship — and threatening the ‘Stars Matter’ mantra via @TheAthletic,19,22,968000,2023-01-01 13:45:01
1861,1608885603659288577,BruceFeldmanCFB,Chip Kelly honoring his old buddy Mike Leach today.,14,240,413000,2022-12-30 17:59:54
1862,1608479808933220352,BruceFeldmanCFB,The most memorable thing I saw at a game this year actually occurred during a timeout. Michigan’s Mikey Sainristil hopped up on the bench to deliver a speech unlike any I’d ever seen a player give in-game. What followed was even more amazing:,4,11,749000,2022-12-29 15:07:25
1863,1608632493120577537,BruceFeldmanCFB,"Wisconsin has emerged as a favorite to land SMU star QB Tanner Mordecai who has thrown for over 7100 yards with 72 TDs and just 22 INTs the past two seasons, per source.",51,331,7655000,2022-12-30 01:14:07
1864,1608521056855392256,BruceFeldmanCFB,Baylor makes it official announcing Oregon Co-DC Matt Powledge as the Bears new defensive coordinator. He spent two seasons on Dave Aranda's staff in Waco as Baylor's safeties coach and special teams coordinator.,2,16,854000,2022-12-29 17:51:19
1865,1608504025137434624,BruceFeldmanCFB,This is a terrific breakdown of how Tulane rebooted its offense in its turnaround from 2-10 to Cotton Bowl by @MikekKuchar . It also shines some light on why TE coach Slade Nagle is so well-regarded in coaching circles down there:,3,19,581000,2022-12-29 16:43:38
1866,1608154454213406720,BruceFeldmanCFB,Get this story and everything else on The Athletic for just $1/month for 12 months now: https://theathletic.com/4031737/2022/12/28/michigan-jim-harbaugh-cfp/…,1,2,1347000,2022-12-28 17:34:34
1867,1608309237662494720,BruceFeldmanCFB,Texas Tech all over Ole Miss. Up 26-7 at half. Joey McGuire assembled a terrific staff. OC Zach Kittley has an explosive O and Tim DeRuyter's D is giving the Rebels lots of problems tonight. Forced 3 turnovers and Lane Kiffin's offense is 1-6 on 3rd downs and 1-5 on 4th downs.,11,26,1243000,2022-12-29 03:49:37
1868,1608298176741515264,BruceFeldmanCFB,SOURCE: WKU OC Ben Arbuckle's deal has been finalized with Washington State to make him the Cougars new offensive coordinator.,18,78,2036000,2022-12-29 03:05:40
1869,1608289507568418817,BruceFeldmanCFB,"In the entire season the year before Lance Leipold was hired at KU, the Jayhawks didn't even score more than 23 points in a single game. He and his staff are working wonders over there at Kansas.",7,27,1121000,2022-12-29 02:31:13
1870,1608270435011133441,BruceFeldmanCFB,"Oregon Co-DC/safeties coach Matt Powledge has emerged as a target for the Baylor DC, per source. The 35-yr-old spent 2 seasons on Dave Aranda’s staff as Baylor’s safeties coach & special teams coordinator. Oregon is tied for No. 1 in the Pac-12 in fewest plays of 20+ yds allowed.",33,111,3372000,2022-12-29 01:15:26
1871,1608268354699300864,CFBONFOX,"""You'd always leave the conversation smiling, laughing, and somewhat bewildered."" @ItsMikeHill , @EmmanuelAcho , and Chris Petersen remember the legacy of Mike Leach",4,24,705000,2022-12-29 01:07:10
1872,1608263226298609664,BruceFeldmanCFB,LSU standout WR Kayshon Boutte announces that he will be declaring for the 2023 NFL Draft. He'd previously announced that he not play in Monday's bowl game against Purdue.,13,61,1749000,2022-12-29 00:46:47
1873,1608227818563063810,BruceFeldmanCFB,"Quite a debut season for Mike Elko, leading Duke to nine wins. The Blue Devils have only had one season in the past 100 years where they won more than that, and this is a place where multiple HOF guys have coached.",7,38,99000,2022-12-28 22:26:06
1874,1608114020103655425,byAustinMeek,"Mike Sainristil described culture as “coaches and players meeting at the same point.” That’s what happened at Michigan the past two seasons, as Jim Harbaugh adapted to his players and his players adapted to him. Story with @BruceFeldmanCFB",4,11,541000,2022-12-28 14:53:54
1875,1606712483154391041,BruceFeldmanCFB,"Agree with this 1000%. Miami doesn't win one national title without Howard, much less five, and it probably would've ceased existing if it wasn't for him. It's ridiculous he wasn't inducted before he passed away. https://theathletic.com/1802220/2020/05/13/howard-schnellenberger-college-football-hall-of-fame-miami-louisville-fau/…",3,36,1087000,2022-12-24 18:04:41
1876,1606681589538488320,BruceFeldmanCFB,Last-minute Christmas shopping? Gift subscriptions to get @TheAthletic are 50% off through the end of the year.,1,0,472000,2022-12-24 16:01:56
1877,1602702895593541632,BruceFeldmanCFB,The story on Mike Leach's interview process for staffing is phenomenal especially when Sonny Dykes told a veteran coach to 'Costanza' their way into a job at Texas Tech:,1,14,0,2022-12-13 16:32:01
1878,1606439222751232000,BruceFeldmanCFB,"SOURCE: USC GA Conner McQueen is expected to become the new OC at Incarnate Word. The 29-year-old former Texas A&M QB coached previously at OU & UCLA, working closely with Lincoln Riley and Chip Kelly, and helped in the development of Heisman winner Caleb Williams.",28,246,5217000,2022-12-23 23:58:51
1879,1606437875234770944,BruceFeldmanCFB,"Wake Forest's Slow Mesh wizard Sam Hartman throws his 108th career TD pass, setting the all-time ACC record, passing Clemson great Tajh Boyd.",5,16,831000,2022-12-23 23:53:30
1880,1606430464419729408,BruceFeldmanCFB,Hanging 70 in the Orange Bowl via the Stitt Sweep; partying with the Vulcan trophy; Mulleted diving kickoff tee-retriever named Hawk; Converting on a 1st and 30 in the last two minutes of a tied game. Dana Holgorsen at bowl time is always magical.,15,22,217000,2022-12-23 23:24:03
1881,1606427165008220160,TheAthleticCFB,EFFORT @TrainIsland | IndependenceBowl,7,54,1224000,2022-12-23 23:10:56
1882,1606358712766959616,JosephDuarte,"Houston coach Dana Holgorsen, offensive line coach/run game coordinator Brandon Jones and quarterbacks coach/passing game coordinator Shannon Dawson will wear black hoodie sweaters with “STATE” on front as a tribute to Mike Leach @HailStateFB",5,205,2476000,2022-12-23 18:38:56
1883,1606346925048856576,BruceFeldmanCFB,Boise State is hiring former Nebraska defensive coordinator Erik Chinander as the Broncos new DL coach and defensive run coordinator. Chinander had been an NFL D-line coach with the Eagles previously.,4,24,1027000,2022-12-23 17:52:06
1884,1606343685460832257,BruceFeldmanCFB,"Lots of good recruiting info in this @skhanjr Texas notebook on TCU's highest-ranked class ever; Texas Tech's ""fastest class in the nation,"" and much more:",1,4,472000,2022-12-23 17:39:13
1885,1606306722137509888,DaveMatter,Mizzou will honor Mike Leach with a pirate cow bell sticker on the back of their helmets in tonight‘s Gasparilla Bowl. Very cool.,17,217,2168000,2022-12-23 15:12:20
1886,1603398453811302400,BruceFeldmanCFB,"Mike Leach was the most accessible coach in the history of football. You could give his cell number to anyone, and if they texted him, they’d probably end up in a rambling yet profound conversation… My favorite Leach story has nothing to do with football: https://theathletic.com/3998015/2022/12/13/mike-leach-career-book-bruce-feldman/…",2,37,0,2022-12-15 14:35:55
1887,1603805311609245696,BruceFeldmanCFB,"“He did everything that I asked while he was here, except stay.” URI OT Ajani Cornelius shined vs Power 5 talent, sending his stock soaring, drawing a ton of big school interest but it’s a bittersweet situation for the program that found and developed him:",6,7,1013000,2022-12-16 17:32:38
1888,1606311003074965504,BruceFeldmanCFB,"“After the first couple days, I’m getting irritated, they’re cherry-picking my guy out of my room. It’s kind of a double-edged sword. You develop these players and then guys are sending them messages on social media. That Pro Football Focus thing comes out and then …”",0,2,421000,2022-12-23 15:29:21
1889,1605983695621328896,mitchsherman,"“This is how we’ll build, with big, physical, tough guys from this region. How much those guys loved Nebraska, how much it meant to them, to see that helmet, to come on these visits, it really struck me.” On Matt Rhule’s first signing day at Nebraska.",0,7,486000,2022-12-22 17:48:45
1890,1604866092689940480,ChadGraff,What's it like to be the No. 1 recruit in football? We asked five players about their experience. Their stories were wild. From long-held grudges to unretired jerseys. Today's A1 story at @TheAthletic :,1,15,962000,2022-12-19 15:47:48
1891,1604911063656697857,BruceFeldmanCFB,USC gets a commitment from Arizona WR Dorian Singer who led the PAC-12 in receiving this year. He torched USC for 7 catches for 141 yards and 3 TDs vs the Trojans in October.,18,59,1294000,2022-12-19 18:46:30
1892,1604865095124779008,maxolson,Our @TheAthletic ranks of the best available players in the transfer portal are here. Travis Hunter debuts in the No. 1 spot. We'll update this daily. Initial top 25:,3,4,494000,2022-12-19 15:43:50
1893,1604902421834174492,BruceFeldmanCFB,"New Audible: The Portal Authority @max_olson joins us to talk about the latest transfer moves, rumors and which schools are cleaning up. Plus we answer your mailbag questions:",1,4,403000,2022-12-19 18:12:09
1894,1604894365368963075,BruceFeldmanCFB,Talked to a recruiting coordinator last week who said anyone that tells you that they know what five-star QB Dante Moore is gonna do is lying to you. This morning the Oregon commit flipped to UCLA to play for Chip Kelly. Wow.,29,42,1786000,2022-12-19 17:40:08
1895,1604866398454697985,BruceFeldmanCFB,Interesting story by @Manny_Navarro & @gmraynor on the fallout for recruits caught in the middle of a big coaching change at CU.,8,4,1038000,2022-12-19 15:49:01
1896,1604849502707253248,BruceFeldmanCFB,Rhode Island OT Ajani Cornelius will announce his college choice WEDNESDAY. He took visits to Nebraska; Oregon; Tennessee & Ohio State. Meet the former 0-star recruit who has emerged as the hottest commodity in The Portal this year:,0,10,685000,2022-12-19 14:41:52
1897,1604542019300311040,BruceFeldmanCFB,"Sunday Read: Mike Leach was like no one we had ever seen before. Brilliant. Hillarious. Maddening. He didn’t just change college football. He changed FOOTBALL. He changed people’s lives. Mine, too. And I feel blessed to have gotten to know him:",6,35,1137000,2022-12-18 18:20:03
1898,1604683875673743364,BruceFeldmanCFB,SOURCE: Kent State is expected to hire former Dave Duggan as its new defensive coordinator. He & head coach Kenni Burns worked together at WMU. Kent State also is hiring Ark State’s Matt Limegrover as OL coach. He's been an OL coach at Penn State & Minnesota among other places.,9,14,806000,2022-12-19 03:43:44
1899,1604647781645156352,BruceFeldmanCFB,"Oregon's Justin Flowe, the former 5-star LB recruit who had 35 tackles this season, just committed to Arizona. Nice get for Jedd Fisch's program who have really upgraded their roster in the past year.",22,42,1321000,2022-12-19 01:20:18
1900,1604553629108604928,BruceFeldmanCFB,"URI OT Ajani Cornelius has gone from 0-star to the hottest commodity in The Portal this year. He’s already visited Neb. & Oregon. This weekend, he visited UT & Ohio State. My story on his mercurial rise to stardom that’s actually been years in the making: https://theathletic.com/4005749/2022/12/15/ajani-cornelius-transfer-portal-uri/…",0,5,1205000,2022-12-18 19:06:11
1901,1604611511099367425,BruceFeldmanCFB,"Michigan is cleaning up on the portal this weekend. Wolverines have added Coastal Carolina LB/DE Josaiah Stewart (26 TFLs, 16.5 sacks the past two yrs) & LB Ernest Hausmann (54 tackles as a TF); OLs Myles Hinton, LaDarius Henderson & just got Stanford’s starting C Drake Nugent.",6,36,1109000,2022-12-18 22:56:11
1902,1604588584773644288,BruceFeldmanCFB,UCF is promoting CBs coach Addison Williams to defensive coordinator to replace Travis Williams (heading to Arkansas) .. Addison Williams has been the DC at Tusculum and Furman.,3,6,848000,2022-12-18 21:25:05
1903,1603806856710799360,slmandel,"In October, Brett Yormark said definitively OU and Texas will remain in the Big 12 until 2025. Now, multiple officials within the conference tell @TheAthletic there will be an agreement for them to leave in 2024 ""in a matter of weeks, not months.""",31,57,1109000,2022-12-16 17:38:46
1904,1603427161649692672,TheAthletic,"Deion Sanders’ pitch to recruits at Jackson State was often two-fold: Come rebuild HBCUs and let my staff help get you to the NFL. ""He’s the GOAT."" But what’s it really like inside the walls of a program led by Coach Prime? @davidubben",3,15,557000,2022-12-15 16:30:00
1905,1602719464436350978,BruceFeldmanCFB,"This is my story about Mike Leach. He changed a lot of people's lives in football. Mine too, and I feel incredibly fortunate that I got to know him.",72,413,0,2022-12-13 17:37:52
1906,1603416269050503170,byAustinMeek,"What are the odds of a freshman from Gooding, Idaho (pop. 3,500) being a key contributor on a team in the College Football Playoff? ""It's never happened before, and it'll never happen again.""",2,16,0,2022-12-15 15:46:43
1907,1603473267360206853,maxolson,"Which QB makes the decision that sets off the domino effect for the transfer market? That big question leads off our portal notebook today. What we’re hearing about targets, trends and much more:",1,14,823000,2022-12-15 19:33:12
1908,1603523007775133696,BruceFeldmanCFB,"Miami now have three of the nation's Top 20 recruits committed for the 2023 class, including two five-star OTs Francis Mauigoa and Samson Okunlola and the No. 1 CB Cormani McClain. That's as many five-stars as the Canes had landed in the previous eight classes combined.",106,269,2143000,2022-12-15 22:50:51
1909,1603466853900201984,BruceFeldmanCFB,URI OT Ajani Cornelius has gone from 0-star recruit to the hottest commodity in The Portal. He’s visited Nebraska & Oregon. This weekend he visits Tennessee & Ohio State. My story on his mercurial rise to stardom that’s actually been years in the making:,7,62,2301000,2022-12-15 19:07:43
1910,1603461328290471936,BruceFeldmanCFB,This is a really good window into why Jim Mora deserves a lot of Coach of the Year consideration. Excellent stuff by @ChrisVannini .,2,11,796000,2022-12-15 18:45:46
1911,1602829348326854659,mitchsherman,Trev Alberts is offering praise for the style of defense that Tony White brings to Nebraska. Alberts recalls the confusion it created during his broadcasting days as he dissected a defense run by Rocky Long — who is White’s primary coaching influence.,1,5,0,2022-12-14 00:54:30
1912,1603162157054496768,BruceFeldmanCFB,Mizzou QB coach Bush Hamdan is Boise State's new OC back at his alma mater.,0,15,0,2022-12-14 22:56:58
1913,1602372688340832263,maxolson,"South Carolina RB MarShawn Lloyd has entered the portal, @TheAthletic has learned. Lloyd led the Gamecocks in rushing this season, had 749 total yards and 11 TDs. Former top-50 recruit.",22,100,0,2022-12-12 18:39:54
1914,1602367882985230336,BruceFeldmanCFB,"Utah All-American CB Clark Phillips III is skipping his remaining eligibility to enter the 2023 NFL Draft. Wrote about him earlier this year, he is a terrific player, super sharp, and just a really, really impressive kid:",6,31,0,2022-12-12 18:20:48
1915,1602362253646258176,BruceFeldmanCFB,SOURCE: Cal is set to hire North Texas OC Mike Bloesch as its new O-line coach. At UNT he had one of the top OLs in the country in terms of rushing offense and sacks allowed. He had been OL coach there and Tulsa. Tony Kransinski first reported the move.,13,40,0,2022-12-12 17:58:26
1916,1602354729430188032,BruceFeldmanCFB,"From UK to Tech to WAZZU to MSU, Dave's been by Mike's side as his trusty righthand man for abt 25 YRs. It has been a devastating year in the AirRaid family.. Earlier this year Dave Nichol who was beloved by everyone who knew him passed suddenly at just 45 and now this with Mike.",3,10,0,2022-12-12 17:28:32
1917,1602343787501690880,NewSlang,"THIS is Mike Leach and all his brilliance. If you still haven’t read @BruceFeldmanCFB ’s piece from a few years back on the Leach Coaching Tree, do so. https://theathletic.com/1194109/2019/09/11/a-crazy-cradle-of-coaches-mike-leachs-original-texas-tech-staff-and-team/?source=user_shared_article…",4,53,0,2022-12-12 16:45:03
1918,1602344560490856448,BruceFeldmanCFB,"Mike Leach update this morning. He remains in critical condition at the hospital in Mississippi, and that his family is with him, per MSU.",8,30,0,2022-12-12 16:48:08
1919,1602303570069446656,BruceFeldmanCFB,"Mike’s impact on football is mind-blowing, especially all the lives of the coaches he’s helped take flight. Three of the top 5 Heisman vote-getters and 4 of the top 10 are coached by Leach protégés: 1. Caleb/Lincoln; 2. Duggan/Dykes; 5. Hooker/Heupel; 10. Maye/Longo. for Mike",9,158,0,2022-12-12 14:05:15
1920,1602160855898021889,BruceFeldmanCFB,Praying for Mike.,5,32,0,2022-12-12 04:38:09
1921,1602145488689586178,CoachDKR,I reached out to Coach Mike Leach in 2006 with a crazy request: Let me shadow you for 3 days. 3 days turned into one week. I owe my journey in the football coaching profession to this man. Sending prayers up for him.,11,152,0,2022-12-12 03:37:05
1922,1602140964742696961,Holgorsendana,"My thoughts are with my mentor, my colleague and, more importantly, my friend, Mike Leach. While I am devastated by today’s news, I know Mike is a fighter with an incredible spirit and I know he will continue to battle. Prayers to Sharon and their extended family.",122,1393,0,2022-12-12 03:19:06
1923,1602087411776778240,BruceFeldmanCFB,"SOURCE: Former Baylor DC Ron Roberts is expected to become the new defensive coordinator at Auburn. His defense at Baylor led the Big 12 in run defense in 2021 and was No. 3 this year, BU led the conference in turnovers gained last year and was No. 4 this season.",63,323,0,2022-12-11 23:46:18
1924,1602092612294352896,BruceFeldmanCFB,This was a really big win for Auburn. Arkansas was also trying to land Ron Roberts to run its defense.,23,39,0,2022-12-12 00:06:58
1925,1602062271269650432,BruceFeldmanCFB,"SOURCE: Jackson State OC/QB coach Brett Bartolone whose offense ranked No. 8 in scoring in FCS, is expected to join the Colorado staff coaching wide receivers. The California native played WR in the Pac-12 at WAZZU and coached at Nevada before joining Deion Sanders’ staff.",12,123,0,2022-12-11 22:06:25
1926,1602047718842519552,BruceFeldmanCFB,"Miss State announces that Mike Leach ""had a personal health issue at his home earlier"" today and he was taken to the University of Mississippi Medical Center in Jackson by ambulance. DC Zach Arnett has been placed in charge of the MSU football team until Leach returns.",25,116,0,2022-12-11 21:08:35
1927,1601978872706179074,BruceFeldmanCFB,Audible: @slmandel & I delve into everything going on with the Transfer Portal; the coaching carousel; Jeff Brohm leaves Purdue to go home to Louisville & Deion takes over at CU:,1,4,0,2022-12-11 16:35:01
1928,1601067943739109377,BruceFeldmanCFB,BAKERRRRR!,2,5,0,2022-12-09 04:15:18
