tweet_id,user,text,num_comments,num_retweets,num_views,timestamp
1558449640797765634,@JeromeAdamsMD,"The study, published in The Lancet, found that of 76,422 participants, “21.4% experienced at least one new or severely increased symptom 3 to 5 months post-infection compared to before infection, compared to 8.7% of uninfected people surveyed.",21,59,0,2022-08-13T13:45:23.000Z
1558177508931108864,@JeromeAdamsMD,"What I would’ve said if issuing new guidelines: 1) fully vaccinated means getting your 3rd ( or 4th) shot 2) if you’re going to mask, wear an N 95 3) indoor establishments, up your ventilation game, NOW! 4) if Covid +, test to exit isolation. 5) have a plan for treatment if +",276,252,0,2022-08-12T19:44:02.000Z
1557958551766810624,@michaelmina_lab,Dear @CDCgov Wondering if ppl still INFECTIOUS at day 5 from Symptom start? Just look to @NIH & @US_FDA Their study shows @ Day 5 since Symptom (maps to ~4 since PCR Positive) ~94% of ppl Rapid Ag test Positive!! Likely at PEAK Virus load & exiting iso per your guidance,55,763,0,2022-08-12T05:13:58.000Z
1557809666415009792,@ddiamond,CDC’s guidance has been close to publication for days. It’s a fluke that it was released just as Merrick Garland took the stage. But if there was ever a moment in the news cycle to release controversial CDC guidelines and be overshadowed…,5,50,0,2022-08-11T19:22:21.000Z
1557813139877441539,@V2019N,"CDC loosens coronavirus guidance, signaling strategic shift",2,6,0,2022-08-11T19:36:09.000Z
1557779181135466497,@V2019N,"FDA advising people to perform repeat, or serial, testing following a negative result on any at-home COVID-19 antigen test, to reduce the risk an infection may be missed (false negative result) and to help prevent people from unknowingly spreading virus.",1,10,0,2022-08-11T17:21:13.000Z
1557779737249869824,@V2019N,"""Be aware that at-home antigen tests are less accurate than molecular tests. COVID-19 antigen tests may not detect virus early in an infection, meaning testing soon after you were exposed to someone with COVID-19 could lead to a false-negative result. Repeat testing is important.",1,2,0,2022-08-11T17:23:26.000Z
1557369455063306243,@TRyanGregory,"You really don't want COVID, mild or not, and certainly not several times.",23,450,0,2022-08-10T14:13:07.000Z
1556308882259120131,@PluribusNews,"DON’T FORGET: Sign up today to get the most comprehensive look at state-based news delivered every day straight to your inbox. Best of all, it’s free!",0,2,0,2022-08-07T15:58:47.000Z
1557455298943746049,@statesdj,The spike proteins of SARS-CoV-2 and human coronavirus NL63 are highly diverged and yet both are able to bind to human ACE2 well enough to mediate viral infection. SARS-CoV-2 it’s nowhere near exhausting the space of infectious spike variants,1,3,0,2022-08-10T19:54:14.000Z
1557441944653123588,@LizSzabo,"Covid is making us so paranoid. I have a mild sore/swollen glands -- totally mild -- but felt compelled to test. Negative, happy to say. But I'll test again before I get on a plane. How do you manage Omicron BA.5 symptoms, including a sore throat?",6,2,0,2022-08-10T19:01:10.000Z
1556798301240164352,@annatime94,9 of my staff have had COVID in the last 2 weeks. They are supplied with high grade PPE to wear on worksites and to wear in the workshop with most eating on site outside. Company rule is one employee to one vehicle. All 9 have children who have brought it home from school.,78,848,0,2022-08-09T00:23:33.000Z
1557355234946580480,@Alexander_Tin,"From Dr. Anthony Fauci re: timeline for bivalent BA.4/5 boosters for the fall: "" @pfizer will have it by first or second week in September and @moderna_tx will likely have it by the end of September, the beginning of October"" https://getrevue.co/profile/alexander_tin/issues/notes-for-08-10-2022-1305160…",26,114,0,2022-08-10T13:16:36.000Z
1551829928395608064,@kamleshkhunti,Acute #COVID19 associated with 81% diabetes diagnosis 6-fold in cardiovascular diagnoses 11-fold in pulmonary embolism 6-fold in atrial arrhythmias 5-fold in venous thromboses https://journals.plos.org/plosmedicine/article?id=10.1371/journal.pmed.1004052… @fascinatorfun,28,884,0,2022-07-26T07:21:01.000Z
1552070947980451840,@michaelzlin,"The median time to convert to negative culture was 5 days from PCR positivity, but it took 10 days for >90% of cases to become non-culturable. Culturability is an indication of live virus but how it correlates with transmissibility in a natural setting is unclear.",1,22,0,2022-07-26T23:18:44.000Z
1552106623761530881,@ImmunoFever,I vaccinated my own children as soon as they were eligible and so did every single immunologist I know. I don't know one who didn't. That's got to tell you something when doctors and immunologists are unanimously vaccinating their own children.,23,149,0,2022-07-27T01:40:30.000Z
1552095584550617090,Roby Bhattacharyya is also @roby@mstdn.science,"I started med school 24 years ago; doctors are a lot of my peer group. Every eligible (>6 mo) child of every doctor I know irl (whose vax status I know) is vaccinated against COVID, prior infection or not.",49,220,0,2022-07-27T00:56:38.000Z
1552017863619162112,@EricTopol,BA.5 in Australia New record of hospitalizations @covidbaseau Sharp rise in deaths @OurWorldInData,76,694,0,2022-07-26T19:47:48.000Z
1551728286509674496,@latimes,"COVID-19 outbreaks have hit Los Angeles International Airport with at least 400 confirmed cases among Transportation Security Administration staff and workers at American and Southwest airlines, according to county health officials. https://latimes.com/california/story/2022-07-25/covid-outbreaks-hit-tsa-american-airlines-southwest-airlines-at-lax…",470,"2,974",0,2022-07-26T00:37:07.000Z
1551627475230380043,@DrNeilStone,If Twitter has done one thing it has shone a very bright light on the tremendous power of human bias when it comes to medicine and science,3,12,0,2022-07-25T17:56:32.000Z
1550477745863417857,@ddiamond,"White House has vowed to go “above and beyond” CDC guidance to care for Biden. “The fact they are overriding CDC recommendations that are flawed, without any evidence to support them, is telling,” said @EricTopol . “For all of us, not just the president.” https://washingtonpost.com/health/2022/07/21/biden-covid-return-to-normal-strategy/…",32,373,0,2022-07-22T13:47:55.000Z
1551582955385933831,@V2019N,"Teenager just tested positive. He's a week into a three week language program in Europe. Vaccinated and boosted (5 mos ago) so far, mild.",4,0,0,2022-07-25T14:59:38.000Z
1551366716147478529,@V2019N,"This is what it sounds like when the science (many people still infectious 5 days after symptom onset, negative test may be an indicator you are no longer infectious) doesn't jibe with CDC guidance. California requires a negative test to release from isolation if before day 10.",1,5,0,2022-07-25T00:40:22.000Z
1551357731365347329,@SaadOmer3,@POTUS is doing the right thing by waiting to be (rapid) test negative before ending isolation. It would be wonderful if everyone is able to do the same.,7,14,0,2022-07-25T00:04:40.000Z
1551301902108860417,@WalkerBragman,"Just an incredible exchange. Reporter: The White House has pledged to go beyond CDC guidance in caring for President Biden...If the White House thinks that's the right approach for the president, shouldn't that be the right approach for all Americans? CDC Director:",651,"4,338",0,2022-07-24T20:22:49.000Z
1549453850087632896,@EricTopol,"For people age 50+, a 2nd booster has been shown in multiple reports to save lives and/or reduce severe disease In the US, % with 2nd shot by age age 50-64: 9% age 65+: 23% https://cdc.gov/vaccines/acip/meetings/downloads/slides-2022-07-19/05-COVID-Twentyman-508.pdf…",44,310,0,2022-07-19T17:59:19.000Z
1549433519146876928,@Bob_Wachter,"Trend: Covid cases sky-high; hospitals impacted but not overwhelmed. @UCSFHospitals , 50 pts w/ Covid (stable for 6 wks, ~1/3 of Jan peak; Fig L). 42 on floor, 8 ICU, 4 vents. ""For"" vs ""with"": ~50-50. Asymptomatic test positivity rate 5.6% (1-in-18; Fig R): high but also stable.",35,109,0,2022-07-19T16:38:32.000Z
1549420525247533057,@V2019N,"Absenteeism at school & work,staffing shortages because people are ill or taking care of ill loved ones. Stay home if sick. Test. Test again. Test after exposure. Test to release. Wear a mask. Get vaccinated & boosted. Avoid indoor events. Covid surging worldwide.",0,5,0,2022-07-19T15:46:54.000Z
1549407192150949892,@EricTopol,BA.2.75 is a scariant. It is not spreading anywhere besides a couple of provinces in India without BA.5 to compete with. There will be other new variants to be concerned about but it doesn't look like this is one of them.,31,165,0,2022-07-19T14:53:55.000Z
1549410274284736512,@V2019N,Current surge may top winter but we'll never know because there's no public health mechanism to pick up home positive tests. http://enewspaper.sandiegouniontribune.com/infinity/article_share.aspx?guid=97f1f303-7e64-4b5a-b24d-06622c37c595…,2,10,0,2022-07-19T15:06:10.000Z
1549409387650813952,@V2019N,CDC stops reporting cases on cruise ships http://enewspaper.sandiegouniontribune.com/infinity/article_share.aspx?guid=de71b10c-35a1-4aa1-b447-c5864382a267…,4,6,0,2022-07-19T15:02:39.000Z
1549401544470286336,@EricTopol,New @ScienceMagazine The original (ancestral strain) booster helps against BA.5 https://science.org/doi/10.1126/science.abq0203… @veeslerlab,43,525,0,2022-07-19T14:31:29.000Z
1549236938351161344,@Crof,"The pandemic and the boiling frog story, by @EricTopol",0,11,0,2022-07-19T03:37:24.000Z
1549228520445861888,@V2019N,"Getting this question too. When can I safely go back to work, without risking infecting my co-workers? When your test is negative or after day 10 in CA. Wear a mask through day 10 if returning early with negative test.",1,8,0,2022-07-19T03:03:57.000Z
1549114844996964353,@pafournier,"On 2020-01-22 there was only 10 official cases of COVID outside of China. 40 days later there was 12,000. On 2022-05-17 there was only 10 official cases of MPX outside of Africa. 60 days later there was 12,000. Case studies of underdiagnosis early in pandemics.",6,60,0,2022-07-18T19:32:14.000Z
1548434814809714691,@Cal_HHS,"Para ayudar a desacelerar la propagación, protegerte y proteger a los demás, mejora tu mascarilla. Usa una N95, KF94 o KN95 si puedes, especialmente en lugares públicos llenos de gente. Obtén más información: https://bit.ly/MaskingCDPH",1,5,0,2022-07-16T22:30:03.000Z
1549116209358159873,@Cal_HHS,"If you are experiencing mental distress and need help, you may now call or text 988 to quickly connect to the #988Lifeline. Trained counselors are available 24/7 to assist anyone experiencing a suicidal, mental health and/or substance use- related crisis. You are not alone.",2,59,0,2022-07-18T19:37:40.000Z
1546517714063204352,@VincentRK,"After >2 years of COVID, this is where we are. @FT",98,"1,739",0,2022-07-11T15:32:10.000Z
1546625478613766144,@ddiamond,"SCOOP: Biden officials developing plan to let all adults get 2nd covid boosters, if they want them. Surging virus + waning immunity has Fauci, Jha privately arguing for more access to shots. With @lauriemcginley2 @bylenasun .",113,514,0,2022-07-11T22:40:23.000Z
1546625603641790465,@ianlauerastro,HUBBLE vs JWST: Here's the difference. Welcome to a new era of astronomy.,"1,171",50.6K,0,2022-07-11T22:40:53.000Z
1546556302876446720,@JReinerMD,There is so much COVID in the US right now that if you spend time in crowded indoor spaces you will contract the virus. Mask up.,174,"1,532",0,2022-07-11T18:05:30.000Z
1546580788380057603,@edyong209,"I wrote about BA.5—the latest coronavirus variant to rise to dominance—and why it matters. This is an attempt to clearly lay out what we know about it, and to cut through the morass of misinformation that has already accumulated around it. 1/",194,"5,149",0,2022-07-11T19:42:48.000Z
1546619659037724673,@V2019N,My request was denied - said I had reached limit? Any info on when people in US can order this third round of tests ? @AshishKJha46 @ashishkjha @ASlavitt,13,1,0,2022-07-11T22:17:16.000Z
1546616795905216513,@V2019N,If you live in the US you can now order 8 MORE Covid home antigen tests at link below Please share this info with friends and family! https://special.usps.com/testkits,8,18,0,2022-07-11T22:05:53.000Z
1546273418768629760,@CrabbBrendan,"Wow, wow. This a must. If you're interested in knowing where you most need a mask (a P2/N95) this is a brilliant guide. Vaccines, testing and isolating if sick, and breathing clean air are the 3 key COVID-19 interventions. The last one is by far the most neglected.",71,"1,042",0,2022-07-10T23:21:26.000Z
1546109669860589573,@JReinerMD,"After intense criticism, CDC has quietly changed their website. For months CDC said the transmission map (the very red map) which shows the actual amount of virus in a community was for use by healthcare facilities only. The original is on the left. The new on the right.",83,433,0,2022-07-10T12:30:45.000Z
1546324415838711809,@EricTopol,There's a lot going on with the Omicron BA.5 variant. I wrote a new chapter to update its status,44,569,0,2022-07-11T02:44:04.000Z
1546326684911259650,@JeromeAdamsMD,This is a great video!,296,223,0,2022-07-11T02:53:05.000Z
1544187657772728320,@ScottGottliebMD,Elegant scientific work providing more support for view that chronic SARS-CoV-2 infection of immunocompromised individuals could lead to the emergence of genetically divergent lineages. Has implications for how we should identify and address chronic infection in such individuals.,5,50,0,2022-07-05T05:13:21.000Z
1544330864875618311,@Crof,"Ultra-contagious BA.4, BA.5 subvariants fuel coronavirus spread across much of California",4,48,0,2022-07-05T14:42:25.000Z
1544397261140115459,@MarkLevineNYC,"A highly transmissible covid variant is on the rise in NYC, but testing is falling. It's important to test if you have symptoms, were exposed, or before/after travel & gatherings. You can pick up free home test kits from libraries & cultural institutions. This week's locations:",60,362,0,2022-07-05T19:06:15.000Z
1544456950280101888,@EricTopol,"US CDC genomic surveillance update BA.5 growth marches on, now 54% BA.4/5 combined >70% https://covid.cdc.gov/covid-data-tracker/#variant-proportions…",21,298,0,2022-07-05T23:03:26.000Z
1544347488567435264,@DrNeilStone,Beware tips from people who haven't caught Covid (yet) with detailed explanation of how they avoided it - You can do all the right things and still catch it - It's not your fault if you do catch it,70,45,0,2022-07-05T15:48:28.000Z
1544336564653658113,@EricTopol,"For both 2020 and 2021, Covid was the 3rd leading cause for death in the United States, by @theNCI @JAMAInternalMed In 2021, it was the #1 cause of death in Americans age 45-54 https://jamanetwork.com/journals/jamainternalmedicine/fullarticle/2794043…",32,643,0,2022-07-05T15:05:04.000Z
1544319858304753675,@ericbkennedy,"I know it feels impossible to avoid COVID these days, but I just traveled for 4 weeks, took 10 flights, gave 4 in-person presentations, and attended 3 conferences without catching COVID... and you can too. Yes, COVID is highly transmissible, but it's not magic. A brief .",537,"4,107",0,2022-07-05T13:58:40.000Z
1544157868970033153,@V2019N,Endemic,3,9,0,2022-07-05T03:14:59.000Z
1544160937971552256,@V2019N,WATCH: Crowds flee after gunfire erupts during 4th of July fireworks in Philadelphia,0,3,0,2022-07-05T03:27:11.000Z
1543905542006919169,@michaelryan756,"“The big stumbling block with COVID is that history has already shown us we've had five separate variants with five separate surges, and the immunity to coronaviruses is very self-limited and fleeting.”",22,516,0,2022-07-04T10:32:20.000Z
1543958306817019905,@ChrisVannini,"Happy 10-year anniversary to the greatest fireworks show in history, when San Diego accidentally shot off 7,000 fireworks at once.","2,921",50.5K,0,2022-07-04T14:02:00.000Z
1543546810182017027,@EllingUlrich,BA.2.75 Maybe the new lineage to worry about? I don’t like the observed mutations. Before we are done with the BA.5 wave we might already have to prepare for the next. Let’s take a closer look. 1/,67,"1,061",0,2022-07-03T10:46:51.000Z
1541548685489647616,@trvrb,Viruses have been evolving to be higher fitness through both increases in intrinsic transmissibility (seen in BA.2 vs BA.1) as well as escape from existing population immunity (seen in Omicron vs Delta as well as BA.4/BA.5 vs BA.2). 3/10,2,37,0,2022-06-27T22:27:01.000Z
1541491628069646336,@V2019N,,0,4,0,2022-06-27T18:40:18.000Z
1541076066709647360,@EricTopol,"BA.5 has the most transmissibility and immune escape of any version of the virus since the pandemic began. Although its spike(S) sequence is nearly the same as BA.4, there are several mutations in other parts of the virus that may account for itsfitness http://outbreak.info",33,830,0,2022-06-26T15:09:00.000Z
1541085297152106497,@V2019N,"We celebrate #Pride2022 If you are in the US, please consider a donation to an LGBTQ+ organization. #GiveOUTDay",0,3,0,2022-06-26T15:45:41.000Z
1540799369577828353,@ScottGottliebMD,"For context, WHO didn’t declare COVID a PHEIC until January 30th, 2020; after the epidemic in Wuhan was already in decline and the virus had spread to Europe, the U.S. and beyond.",17,53,0,2022-06-25T20:49:31.000Z
1540733168919015424,@EricTopol,Good summary of BA.4/5 @Nature by @ewencallaway,11,177,0,2022-06-25T16:26:27.000Z
1540704984081174530,@EricTopol,Important to note that both Moderna and Pfizer/BioNTech Omicron (BA-1) booster shots had 3-fold lower neutralizing antibody response to BA.4/5 than to BA.1 [Pfizer data just put out this morning),113,"1,074",0,2022-06-25T14:34:27.000Z
1540056843782737921,@V2019N,"With no advanced notice or outreach NYC announced in the middle of the day that they’d vaccinate men who have sex with men against monkeypox. The appt website doesn’t work, but word is spreading online so people are coming to the Chelsea clinic. Maybe 150 here now & a 2 hour wait",0,2,0,2022-06-23T19:38:59.000Z
1539614221591142400,@InfectiousDz,Things got hectic for a lot of folks over the last few years. Not everyone whose kids weren't vaccinated meant to put that off. No time like the present to get any missed vaccines - anything from polio and measles to now chickenpox and COVID if available.,1,9,0,2022-06-22T14:20:09.000Z
analytics,user,text,0,0,0,0
1539348224552714241,@kakape,"And if you don’t know how to talk to MSM about monkeypox, start with this from @gregggonsalves : “We should say: It’s not about who you are. It’s about what you’re doing. And we’re not going to stigmatize it. But just know that you’re at greater risk if you fit this profile.”",8,29,0,2022-06-21T20:43:11.000Z
1539269040123674624,@EricTopol,"The BA.4/5 impact is just starting to take hold, with no region of the US at a dominant level yet. It is also on a path to dominance in multiple countries in Europe, and Australia, with some attributable increases in hospitalizations",7,77,0,2022-06-21T15:28:32.000Z
1536895081650716672,@boulware_dr,"To be clear, for high risk unvaccinated persons, #paxlovid is still the most effective anti-viral therapy when started within 5 days of symptom onset, but... If vaccinated (or prior infection), then benefit is likely minimal. Does not reduce symptom duration; no idea long covid.",19,80,0,2022-06-15T02:15:16.000Z
1536720842830356480,@InfectiousDz,Trudeau also tested positive in January.,0,6,0,2022-06-14T14:42:54.000Z
1536474120103272449,@statesdj,The evergreen tweet of virology and microbiology,2,19,0,2022-06-13T22:22:31.000Z
1536337996060020743,@InfectiousDz,A reminder of @domphillips work,0,3,0,2022-06-13T13:21:36.000Z
1536371282157064192,@HsiaoMarvin,"There was another pandemic that started like this and people thought ""nah, that doesn't affect me.."".",4,25,0,2022-06-13T15:33:52.000Z
1536402336511193093,@Bob_Wachter,"Many people ask how my wife @katiehafner fared after her Covid case – we truly appreciate the concern. The answer is: not great. Now 5 weeks post-infection, Katie has pretty bad fatigue, some brain fog, & periodic headaches. So, according to the most common definition of…(2/25)",167,603,0,2022-06-13T17:37:16.000Z
1536402341922246656,@ArielCohen37,"HHS @SecBecerra has tested positive for COVID-19 again, the agency just announced. Last time he tested positive was May 18, after attending the G-7 Summit.",87,429,0,2022-06-13T17:37:17.000Z
1536357066050355200,@LizSzabo,"Schools plan to spend $10 billion in pandemic relief funding to improve ventilation, which helps prevent spread of Covid and flu, improves asthma and allergy symptoms, cleans air of wildfire smoke.",3,39,0,2022-06-13T14:37:23.000Z
1536297799070924800,@jeffgilchrist,"Sato Lab has looked at BA.4, BA.5, and BA.2.12.1 which seem to have an effective reproduction number 1.2x higher than BA.2 so even more transmissible ( https://twitter.com/SystemsVirology/status/1529953265017757696… ). 3/",3,143,0,2022-06-13T10:41:52.000Z
1536184437964099584,"Jeffrey Duchin, MD @DocJD@mastodon.world","""A lot of the manifestations we're describing...are chronic conditions that will [affect] people for a lifetime...we're seeing chronic conditions that will require care for a long time. People, health systems, & governments need to be prepared for that.""",12,46,0,2022-06-13T03:11:25.000Z
1536127983961923584,@jonathanrockoff,"Breaking: FDA staff found the Pfizer-BioNTech shot was safe and effective at preventing symptomatic disease in kids 6 months through 4 years, @loftus reports https://wsj.com/articles/three-dose-pfizer-covid-vaccine-works-safely-in-young-children-review-says-11655076071?st=g05sqqnlju92vub… via @WSJ",3,43,0,2022-06-12T23:27:05.000Z
1536023820041084929,@ScottGottliebMD,"US was tragically behind in testing early in pandemic. VALID is critical step toward making us better prepared to stand up testing in future public health emergencies, and FDA is key to making sure tests for emerging pathogens are accurate and reliable",3,9,0,2022-06-12T16:33:11.000Z
1535683300525674497,@EricTopol,BA.4/5 is on the rise to become dominant in the US and UK. It hit South Africa and Portugal first. Note the difference in impact for those 2 countries in deaths,88,575,0,2022-06-11T18:00:05.000Z
1536003543139684359,@EricTopol,The mysterious acute hepatitis in children is being called Long Covid Liver,195,"2,563",0,2022-06-12T15:12:36.000Z
1533478326966161409,@EricTopol,"In case you were wondering if BA.4/5 will outcompete BA.2.12.1, and more....",29,291,0,2022-06-05T15:58:18.000Z
1533103873312825345,@EckerleIsabella,"My all-time favorite citation on emerging viruses is from Margret Chan (2013): “Any new disease that is emerging faster than our understanding is never under control"" It should be guidance for all public health actions whenever new viruses emerge #SARSCoV2 #COVID19 #monkeypox",77,"1,218",0,2022-06-04T15:10:21.000Z
1533577832042876929,@statesdj,In highly vaccinated Portugal BA.5 is overtaking BA.2,3,13,0,2022-06-05T22:33:42.000Z
1533563434519830528,@V2019N,Please ask your elderly loved ones to get second booster. It matters. https://twitter.com/CDCgov/status/1532829497388580871?s=20&t=ILWoMynenBzkxtoRKGj_CQ… #GetBoosted,4,38,0,2022-06-05T21:36:29.000Z
1533482360968298500,@JReinerMD,There are 2 reasons hosps are climbing in people over the age of 70. They are the highest risk for severe disease and fully 30% of the elderly have not gotten a single boost. The failure to protect this group of Americans is a shocking failure of our public health system.,37,159,0,2022-06-05T16:14:20.000Z
1533563004851105793,@V2019N,"Small trial (18 patients) but the cancer vanished in every single patient, undetectable by physical exam, endoscopy, PET scans or MRI scans. “... first time this has happened in history of cancer” -Dr. Diaz",0,11,0,2022-06-05T21:34:47.000Z
1533488023081566209,@JReinerMD,"The map on the left shows community transmission 1 month ago. On the right is current. 85% of the US has high or substantial levels of transmission. Wear a mask in crowded venues, get boosted. If you’re not vaccinated, it’s not too late.",40,600,0,2022-06-05T16:36:50.000Z
1533560866058014720,@V2019N,"Frequently, it's Covid. Initially, it looks like allergies or a cold (headache, nasal congestion, runny nose, sore throat). Stay home if ill, get a PCR test (antigen tests most reliable 3-4 days after symptom onset). Keep children with symptoms home.",3,13,0,2022-06-05T21:26:17.000Z
1533485528720416768,@EricTopol,"It's not over, by any means, but the chances of dying from Covid keep declining",196,624,0,2022-06-05T16:26:55.000Z
1533227736453369856,@Crof,Health Minister Jean-Yves Duclos tests positive for COVID-19,0,5,0,2022-06-04T23:22:33.000Z
1533111115193806850,@michaelzlin,"So if you're <65yo and have some immunity (which is nearly everyone now), the data reveal that there's no discernable benefit to getting Paxlovid, even if you have preexisting conditions. Don't expect Pfizer to trumpet these results as it removes the majority of the market.",10,36,0,2022-06-04T15:39:08.000Z
1531299117254660096,@genepedia,"A bit less than 24 hours after my first super faint positive test, when I was only positive if I included a throat swab and then only on one brand, it's now undeniable with a nasal only swab on multiple brands.",3,5,0,2022-05-30T15:38:54.000Z
1531316900390502403,@V2019N,"Highly unlikely CA will peak next week. (Expert cited is Monica Gandhi MD, MPH) Hard to see what is happening in CA, as everywhere else many home tests not reported to public health therefore case counts hugely underestimated",6,8,0,2022-05-30T16:49:34.000Z
