tweet_id,user,text,num_comments,num_retweets,num_views,timestamp
1642118978838605826,@clouddyys,"“how was the atmosphere of outing?” : it was fun. we had no outing for two years due to covid, but this time everyone is free. we had a lot of fun and the atmosphere was very full. there was a costume contest. it was fun, I enjoyed it. #winmetawin @winmetawin",1,115,"7,426",2023-04-01T10:57:28.000Z
1644233797456756737,@cafelockedout,Clear Critical Eye Opening Thoughts The Retired Crisis Karratha Accountant who nails the whole Covid BS pandemic from a numbers point of view. Big Pig (Big Pharma) Cafe Locked Out On The Road. @chrismartenson @thecoastguy @joerogan @TonyNikolic10 @rustyrockets …,1,24,"1,080",2023-04-07T07:01:00.000Z
1642542213002416129,@NerumWim,"French MP who got the Covid vax developed heart problems and required surgery to keep him alive He says: ""What I did NOT KNOW was that Mr Macron was not vaccinated. I did not know that most of the members of the government were not.""",1,25,"2,237",2023-04-02T14:59:15.000Z
1644245169854730241,@Ninawildflower,We're having a Covid-safe Eurovision party in a few weeks! Get in touch if you are interested. Voyager - Promise (Australia) #CovidAwarenessWeek #Eurovision2023 @Voyagerau,1,10,"1,037",2023-04-07T07:46:11.000Z
1643231646622294016,@tubatuprint,huening kai singing a Taiwanese song is even more special bcs of the fact that this is supposedly their 2nd tour in taiwan (act:ls) but got cancelled bcs of covid restrictions,1,132,"6,660",2023-04-04T12:38:48.000Z
1642537669099159553,@castleofudon,the fact that this was jo1's first (real) hi touch after covid-19 restrictions and this was done with children with down syndrome... it's so wholesome,1,95,"6,390",2023-04-02T14:41:11.000Z
1644047574062739456,@statsjamie,‘What you've got is that 88% of all the deaths linked to Covid have been among people over the age of 65 and this really hasn't changed much since March 2020’ Chat with @MarkSteynOnline on the age profile risk of Covid as the NHS ends universal Covid vaccines on June 30,7,91,19.2K,2023-04-06T18:41:01.000Z
1642208011828510725,@Johnincarlisle,"WHO covid vaccine revised roadmap https://youtu.be/vIG5zTLB3hw via @YouTube WHO, moves with the times?",40,101,17.2K,2023-04-01T16:51:15.000Z
1644433050531426319,@reaghhan,Long Covid this long Covid that. i need to see tye brain function of people who made videos like this during quarantine,2,1,"3,659",2023-04-07T20:12:45.000Z
1642615875600629765,@PatriotsControl,"https://t.me/SGTnewsNetwork/44371… ""Flu jabs are recommended for children aged from 6 months to 5 years"" 6 months! and while you're there they'll push the rat poison covid jabs too",4,6,244,2023-04-02T19:51:57.000Z
1644202766762659840,@HardeepSPuri,"सर्वे भवन्तु सुखिनः सर्वे सन्तु निरामयाः From the world’s largest Covid vaccination drive to affordable & accessible healthcare to all, India, through various initiatives under leadership of PM @narendramodi Ji, has set an example for the world to follow. #WorldHealthDay23",8,265,12.4K,2023-04-07T04:57:42.000Z
1642998797885136903,@Incrementallog1,"BREAKING Video SMOKING GUN EVIDENCE OF PREMEDITATED RELEASE OF COV|D-19 - U,S Dept of D€fense Job post 4 Cov|d-|9 Nov 12/19 3mo's b4 dubbed Covid by WHO & atleast a month b4 emergence date in Dec/Jan that's commonly reported.",3,35,"2,159",2023-04-03T21:13:33.000Z
1642792421682454528,@PatriotsControl,"https://t.me/davidavocadowolfe/92205… When the Covid plandemic hit 3 years ago, my friends and I began discussing and rereading Orwell’s book 1984. We decided back then that the insanity would continue all the way to the point where they forced people to believe 2+2=5.",3,15,373,2023-04-03T07:33:29.000Z
1644200409941278720,@_BTSMoments_,"Agust D about #People_Pt2 ""People told me that the song tells a story I wanted to share with others and that it also seems. I'm talking to myself, which is true This song was written when I couldn't do anything due to Covid-19 when I thought 'I lost everything, So it conveys ++",2,281,14K,2023-04-07T04:48:20.000Z
1642618289107918851,@PatriotsControl,"https://t.me/SGTnewsNetwork/44384… JUST IN: Alarming research suggests COVID VACCINE might suppress immune system — Consequences include heart problems, BLOOD CLOTS and reduced ability to combat future infections..",1,12,658,2023-04-02T20:01:33.000Z
1643808757397291008,@UngaTheGreat,"Stinchfield Calls Out Rachel Maddow’s Lies and Contradictions Grant Stinchfield criticizes Rachel Maddow for her perceived lies and contradictions on topics such as the Trump-Russia collusion, the Steele dossier, COVID-19 vaccines, and more. @stinchfield1776 @maddow",2,17,"1,113",2023-04-06T02:52:02.000Z
1642994594068455425,@ecJulie,Hang on! We knew about Covid WHEN??? A new report shows that the US was hiring Covid-19 researchers 3 months before the pandemic began ...,2,21,665,2023-04-03T20:56:51.000Z
1644148951787122688,@drDavidKeegan,"I'm late to the #CovidAwarenessWeek party, but here it is: my tiny video on long-COVID and what we can do to prevent it. (Spoiler: preventing covid infections is the best way to prevent long-covid, so masking, clean air, isolation/sick leave.)",16,91,18.2K,2023-04-07T01:23:51.000Z
1643916064772767748,@ABridgen,Dr John Campbell investigates the recent AstraZeneca Covid 19 vaccine ban in Australia with his normal thoroughness.,142,431,49K,2023-04-06T09:58:26.000Z
1644370153264807937,@crwequine,Long-COVID is Bad (a super quick summary) - YouTube,1,11,779,2023-04-07T16:02:50.000Z
1643419205486936065,@BigBadDenis,"Update on Omicron XBB.1.16 At the present time, we’re still in a public health emergency of international concern at a global level as well as still in a pandemic. The virus is circulating - Maria Van Kerkhove @mvankerkhove The technical lead for the COVID-19 response at the WHO",14,122,14.7K,2023-04-05T01:04:06.000Z
1641258753650757632,@PRAISETRIUNEGOD,".. Worth listening to . But ONLY if u WANT to know the Truth (many don't) ""COVID Vaccine Documentary: Safe and Effective? An Apolitical Documentary"" by @AmerConU on @Castbox_fm #podcasts #audiobooks #castbox",0,3,180,2023-03-30T01:59:14.000Z
1641819651129712643,@ST3V3P4R4DIS3,Remember when The #Government told everyone to take an experimental #Drug #COVID,0,3,183,2023-03-31T15:08:03.000Z
1643064370790903810,@denisrancourt,MUST WATCH The trans agenda is a much more virulent anti-human project of the pharma-medical-industrial complex than pandemic-covid ever was. Jennifer Bilek explains.,40,225,21.1K,2023-04-04T01:34:07.000Z
1643989619334340608,@Blue22Dave,"O' CANADA! Lulled into lacklustre demoralized mass of listlessness from Covid, Brutal Taxation & Our Own Complacency! IT MUST END NOW! We Can't sit back, lie down & allow Dictatorship Authoritarians to Rule & Destroy OUR Democracy!? WE MUST RISE-UP NOW! http://youtu.be/mFJooJbSntQ",2,16,417,2023-04-06T14:50:43.000Z
1642767925936553984,@USTWVTofficial,"Three years ago, a kid from Bataan wanted to see @eyalaureee in person. But covid happened. This year, this kid was able to fulfill one of his dreams. To watch the tigresses play live and win. After three years, #ItoNaKami kasama kayo. Dahil #WalangIwananUST #GoUSTe",2,104,136.9K,2023-04-03T05:56:09.000Z
