tweet_id,user,text,num_comments,num_retweets,num_views,timestamp
1531317107593400320,@V2019N,"SF folks: it's now a big-time surge. No longer just cases (~500/d reported, so true # >2K, or ~250/100K/d). Also major uptick in hospitalizations: 98 in SF (vs 18 six wks ago). @UCSFHospitals 41 pts in hospital, twice April #. If you're trying to stay well, time to up your game.",3,4,0,2022-05-30T16:50:23.000Z
1531315837264482304,@Bob_Wachter,"SF folks: it's now a big-time surge. No longer just cases (~500/d reported, so true # >2K, or ~250/100K/d). Also major uptick in hospitalizations: 98 in SF (vs 18 six wks ago). @UCSFHospitals 41 pts in hospital, twice April #. If you're trying to stay well, time to up your game.",320,"1,293",0,2022-05-30T16:45:20.000Z
1531307970310594560,@UBC,A province-by-province look at excess deaths in Canada during the pandemic https://bit.ly/3NCzclJ,0,7,0,2022-05-30T16:14:05.000Z
1531116263652544512,@V2019N,,0,5,0,2022-05-30T03:32:18.000Z
1530245366658093058,@goldiluxes,"The fact that we don’t even get breaks between waves any more to know which variant was contracted is a not helping. Anyone C19+ve today has no idea if it’s BA2 or BA2.121, and an unlucky yet growing few will have BA4/BA5 again - unknowingly. What a cluster",5,15,0,2022-05-27T17:51:40.000Z
1530686945386450945,@BillyCrystal,I tested positive today. Was taking every precaution possible. Don’t think it’s not going to happen to you. Stay safe!,"7,540","7,082",0,2022-05-28T23:06:21.000Z
1530965186269437952,@EricTopol,"Updating, one year later Original: https://cell.com/cell/issue?pii=S0092-8674(20)X0011-0… @CellCellPress by @K_G_Andersen and colleagues",6,70,0,2022-05-29T17:31:59.000Z
1530739208557559809,@ScottGottliebMD,"New analysis from @trvrb predicts BA4 and BA5 will continue to grow in U.S., perhaps creating a new wave (For the fall? Earlier?) Compared to B2, it’ll be driven to a greater degree by reinfection of people recovered from B1 infection given greater immune escape of BA4 and BA5",73,152,0,2022-05-29T02:34:01.000Z
1530612374138396673,@CDCgov,"Hosting a summer gathering? Outside is best! If inside, open doors and windows and/or run a portable HEPA air cleaner to help reduce #COVID19 in the air. Your HVAC can also help filter air when the fan is set to “on.” See more ways to improve ventilation: https://bit.ly/35wITyg.",121,308,0,2022-05-28T18:10:02.000Z
1530689714935709698,@VincentRK,Controlling COVID until the public is well vaccinated saves a huge number of lives. See the huge difference between cases and deaths depending on when COVID occurred.,191,538,0,2022-05-28T23:17:21.000Z
1530503799412072448,@InfectiousDz,"Every novel outbreak at its start gets ahead start as we pick up the pace on lab capacity. Even when we have testing, it may be too centralized causing too many delays. This isn't just monkeypox, it's COVID, it's Ebola, it's every emerging or re-emerging pathogen.",2,11,0,2022-05-28T10:58:35.000Z
1530586415955730433,@EricTopol,"The current BA.2/BA2.12.1 wave is the 2nd highest case burden for the US pandemic; we're likely only capturing 5-10% of the real number of cases From ""Why a Massive New Covid Wave Has Escaped the Data"" https://wsj.com/articles/why-covid-pandemics-daily-case-count-comes-up-short-in-the-u-s-11653643802?mod=Searchresults_pos1&page=1… by @JoshZumbrun",27,262,0,2022-05-28T16:26:53.000Z
1529477481127759872,@EricTopol,"Just out @NatureMedicine The natural history of post-vaccine breakthrough infections (BTI) in 33,000 people, >13 million controls https://nature.com/articles/s41591-022-01840-0… @zalaly @BCBowe @Biostayan @WUSTLmed —Vaccination protection from #LongCovid ~15%, much less than many other studies (~50%)",59,"1,188",0,2022-05-25T15:00:22.000Z
1529221673978929154,@InfectiousDz,"Spain reports 15 more confirmed cases, bringing the country's total to 51, with most (47) in Madrid, where government officials are requesting vaccines, @el_pais reports https://elpais.com/sociedad/2022-05-24/madrid-pide-a-sanidad-que-acelere-la-compra-de-vacunas-frente-a-la-viruela-ante-el-crecimiento-de-casos.html…",0,14,0,2022-05-24T22:03:53.000Z
1529182144622301184,@Bob_Wachter,"I was asked by a reporter today if I’d take Paxlovid if I had Covid. Last month, this would have been easy: as a 64-year-old person w/ asthma, the answer was an unequivocal YES. Today, it’s a closer call – in thisI’ll lay out the reasons why, and then give you my answer.(1/25)",38,209,0,2022-05-24T19:26:48.000Z
1529132047977037826,@CarlosdelRio7,Monkeypox Virus Infection in the United States and Other Non-endemic Countries—2022 @CDCgov has issued a Health Alert Network news. You can read it here: https://emergency.cdc.gov/han/2022/han00466.asp?ACSTrackingID=USCDCNPIN_162-DM82740… via @CDCgov,0,13,0,2022-05-24T16:07:44.000Z
1528876875325419522,@R_H_Ebright,And is ineffective in preventing hospiutalization: https://twitter.com/EricTopol/status/1528851003906445315…,4,9,0,2022-05-23T23:13:46.000Z
None,user,text,0,0,0,0
1528773349295390720,@m_scribe,"With a virus that spreads year-round, capable of reinfection, still evolving rapidly, and few public protections still in place, we could all get Covid several times a year — which could have massive effects on school, work, and health systems.",54,432,0,2022-05-23T16:22:24.000Z
1528754862380437504,@pbleic,"1/Paxlovid rebound: with 2/2 in my family with Paxlovid rebound, stories rife on Twitter, and 2 completely unscientific polls showing 46-47% rebound, I am thinking about Paxlovid efficacy in terms of relative risk, absolute risk, and Number Needed to Treat (NNT)",58,212,0,2022-05-23T15:08:56.000Z
1528713297217716226,@ASlavitt,BREAKING: Pfizer and BioNTech release data showing effectiveness of 3 dose vaccine for kids 6 months to 5 years of 80%.,191,764,0,2022-05-23T12:23:46.000Z
1527772028127698944,@V2019N,Have you had Covid-19?,9,10,0,2022-05-20T22:03:30.000Z
1528444649135693824,@gregggonsalves,"So a on #monkeypox. I am not an expert on the pathogen, BUT right now many of the cases are in gay men and I know something about infectious diseases among men who have sex with men. 1/",177,544,0,2022-05-22T18:36:16.000Z
1527724128215519232,@ASlavitt,Will a massive outbreak in China rapidly spawn many new variants? Will there be spillover to animal reservoirs? Will the supply of life saving items we need worldwide manufactured in China become more scarce? How will this spark new shortages? 10/,7,137,0,2022-05-20T18:53:10.000Z
1527724121794105344,@ASlavitt,"Millions of vulnerable, high risk people & a virus hard to contain as @KatherineJWu said on an upcoming @inthebubblepod that “the damn in China is about to break.” The lockdown policies are becoming unsustainable but as soon as they end, we could see millions die. 8/",14,112,0,2022-05-20T18:53:09.000Z
1528069685777838080,@V2019N,"During a surge, like the one happening now in the US with ~1,000,000 cases/day: -students & staff should wear a good mask indoors at school. -those eligible, including 5-11 & 50+ should get booster -mask mandate should return to public transit -avoid large indoor gatherings",4,32,0,2022-05-21T17:46:17.000Z
1528413080878579712,@EricTopol,"""As of April, scientists had logged 675 coronavirus outbreaks in animals, affecting 23 species in 36 countries, and other species have been shown to be vulnerable in lab experiments."" https://washingtonpost.com/health/2022/05/20/tracking-coronavirus-variants-animals/… @arianaeunjung",15,142,0,2022-05-22T16:30:49.000Z
1526773044902961152,@V2019N,"Interested to hear #Paxlovid experiences, positive and negative (rebound).",3,3,0,2022-05-18T03:53:54.000Z
1526758282806689793,@EricTopol,"In the United States, 136,000 new confirmed cases today brings the 7-day average >100,000. Real number is esitmated to be ~700,000. And >500 more people hospitalized. No reason for concern, right @CDCgov ? https://charts.medriva.com/us",74,867,0,2022-05-18T02:55:15.000Z
1526745216061001729,@PeterHotez,"Well thought Covid was over, finished a 5 d Paxlovid, felt well, X2 neg antigen tests. 5 d later up this AM lots of rinorrhea, sore throat, antigen test screaming +. So either this post-Paxlovid relapse is real, something unique to BA.2.12 (although can’t confirm)…or something","1,412","3,129",0,2022-05-18T02:03:19.000Z
1526713175797686272,@michaelzlin,"WHO is convincing me to be more enthusiastic about 4th doses. Today they reviewed studies showing dose 4 gives ≥60yo a 60% more protection from severe disease over dose 3, or an increase in absolute VE from 82% to 92%. That's a meaningful improvement.",72,437,0,2022-05-17T23:56:00.000Z
1526607779384832002,@V2019N,"No masks indoors + BA2.12.1 = transmission Home antigen tests useful, but most effective a few days after symptom onset. If antigens negative, consider PCR Test if you have symptoms and after exposure. #MaskUpIndoors #Test #Vaccinate #Booster",0,13,0,2022-05-17T16:57:12.000Z
1526565169463283716,@Sabrinafox8news,. @NewOrleans Health Dept. Director #JenniferAvegno says #COVID19 cases are rising calling it a summer surge. Urges returning to universal masking indoors. #Fox8nola,1,21,0,2022-05-17T14:07:53.000Z
1526583058085908482,@InfectiousDz,"BREAKING: NYC has just officially moved into HIGH covid alert status, due to rising hospitalizations. This reflects the growing wave caused by an extremely contagious subvariant. Learn about add'l precautions now advised by NYC Health Dept:",0,13,0,2022-05-17T15:18:58.000Z
1526579408487600133,@EricTopol,The BA.2.12.1 variant now accounting for 48% new cases in the United States,20,225,0,2022-05-17T15:04:28.000Z
1526577313642684416,@MarkLevineNYC,"BREAKING: NYC has just officially moved into HIGH covid alert status, due to rising hospitalizations. This reflects the growing wave caused by an extremely contagious subvariant. Learn about add'l precautions now advised by NYC Health Dept: http://nyc.gov/covidalert",229,"2,464",0,2022-05-17T14:56:08.000Z
1526569603496824836,@jenkatesdc,COVID-19 boosters just authorized for 5-11 year olds.,2,38,0,2022-05-17T14:25:30.000Z
1526234372424101890,@EricTopol,"This graph by @dr_kkjetelina gets it right. We're at about 750,000 new cases a day in the US now (the real number in our BA.2/BA2.12.1 wave, way beyond any prior wave except Omicron). Nothing to worry about From https://yourlocalepidemiologist.substack.com/p/state-of-affairs-may-16?utm_source=%2Fprofile%2F27227002-katelyn-jetelina&utm_medium=reader2&s=r…",23,208,0,2022-05-16T16:13:25.000Z
1526524812541444096,@DrJayVarma,This prolonged #NYC #COVID surge is now steadily increasing pressure on emergency departments. Particularly striking is illness in children 0-4 years old with ED visits (per 100K) similar to first half of January #Omicron wave. (Data from @nycHealthy https://github.com/nychealth/coronavirus-data/blob/master/trends/covid-like-illness.csv…),129,157,0,2022-05-17T11:27:31.000Z
1526318582174556162,@josh_wingrove,"The White House will hold its first Covid briefing in five weeks on Wednesday, per an advisory.",123,398,0,2022-05-16T21:48:02.000Z
1525517510203670528,@V2019N,Covid-19 deaths by vaccination status via @nytimes,10,28,0,2022-05-14T16:44:51.000Z
1525523325702660096,@V2019N,"Becky & her dad.. vaccines were something they couldn't agree on. “Please, kitten, don’t get the shot.” He told her vaccines were a government scheme. Her dad 72, got Covid & was unwilling to promise he would vaccinate if he recovered. ICU, ventilator, died in January.",0,5,0,2022-05-14T17:07:58.000Z
1525516628418408449,@V2019N,More Americans have died of Covid-19 than in two decades of car crashes or on battlefields in all of the country’s wars combined.,4,26,0,2022-05-14T16:41:21.000Z
1525516631899705346,@V2019N,"""...the result of many factors: elected officials who downplayed threat & resisted safety measures; overburdened health care struggles w/testing, tracing & treatment; lower vaccination and booster rates ... partly a result of resistance fanned by right-wing media & politicians",1,0,0,2022-05-14T16:41:22.000Z
1525516633271283712,@V2019N,"""...virus did not claim lives evenly ...some demographic groups, occupations & communities far more vulnerable than others... significant proportion of nation’s oldest residents died, making up ~3/4 of total deaths. Black & Hispanic people died at much higher rates than whites",0,0,0,2022-05-14T16:41:22.000Z
1525313728849248256,@carlzimmer,New Zealand Prime Minister Jacinda Ardern tests positive for COVID,7,24,0,2022-05-14T03:15:06.000Z
1525274544222654465,@BNOFeed,"Los Angeles County reports 4,025 new coronavirus cases, the biggest one-day increase since February",32,315,0,2022-05-14T00:39:24.000Z
1525093456879706117,@PeterHotez,With a population of 25 million I don’t think it would be too much of a stretch to fully immunize #NorthKorea with CORBEVAX if the international community and #DPRK leaders wished this to happen?,17,64,0,2022-05-13T12:39:49.000Z
1525261285599768576,@V2019N,Can't imagine how bad Covid must be there for Kim Jong Un to acknowledge it. Few resources to combat it.,4,15,0,2022-05-13T23:46:43.000Z
1525259403083010049,@BNOFeed,"BREAKING: Kim Jong Un says North Korea facing ""greatest turmoil"" since its founding as COVID-19 spreads nationwide - Yonhap",114,523,0,2022-05-13T23:39:14.000Z
1525252511115927553,@BhadeliaMD,Stopping spillovers of new infectious diseases from animals to humans and detecting spillovers early can stop new epidemics. Great article by @conservationdoc and colleagues.,1,9,0,2022-05-13T23:11:51.000Z
1525142348228923392,@BasilNSybil,Yet those <50 who are high-risk but not immunocompromised aren’t eligible for 4th doses - some got a 3rd dose 6-7 months ago,2,2,0,2022-05-13T15:54:06.000Z
1525139631439630336,@ASlavitt,Congress is no longer funding vaccines for every American who wants one. This is due to Republican unwillingness. This not only puts people at risk. But it elongates the pandemic and adds risk to everyone.,145,734,0,2022-05-13T15:43:18.000Z
1525137052009787392,@V2019N,White House COVID-19 coordinator @ashishkjha issued a dire warning that the U.S. will be increasingly vulnerable this fall and winter if Congress doesn't approve new funding for more vaccines and treatments. https://news.yahoo.com/ap-interview-us-vulnerable-covid-195842741.html?soc_src=social-sh&soc_trk=tw&tsrc=twtr… v,3,15,0,2022-05-13T15:33:03.000Z
1525137054119538689,@V2019N,"Jha said Americans' immune protection from the virus is waning, the virus is adapting to be more contagious and booster doses for most people will be necessary — with the potential for enhanced protection from a new generation of shots.",3,11,0,2022-05-13T15:33:04.000Z
1524102258291576834,@ScottGottliebMD,New from Nature Medicine: Model of Omicron transmission in China ‘Immunity induced by the March 2022 vaccination campaign would be insufficient to prevent an Omicron wave that would exceed critical care capacity… and cause about 1.55 million deaths’ https://nature.com/articles/s41591-022-01855-7…,18,13,0,2022-05-10T19:01:09.000Z
1524130751712747520,@florian_krammer,"A story about work we are doing at the Micro Department at Mount Sinai with intranasal COVID-19 vaccines. With Peter Palese, Adolfo García-Sastre, @WeinaSun4 and @kre8iv9",24,189,0,2022-05-10T20:54:22.000Z
1524187056687091712,@V2019N,Omicron is not going away anytime soon. Enjoy the lulls. Use precautions during surges. #GetVaccinated #GetBoosted #WearAMask indoors.,0,15,0,2022-05-11T00:38:06.000Z
1524139368952352770,@jonlevyBU,COVID climbing quickly in MA by any metric. Cases heading toward Delta peak with large underascertainment. Hospitalizations much lower than large peaks but tripled in past month and will keep climbing. Wastewater steady up. Indoor masking advised by CDC. Be careful out there.,17,207,0,2022-05-10T21:28:37.000Z
1524070973389127680,@DoctorNatasha,"So, here's the reminder from your friendly pediatrician who has been caring for these kids for [checks notes] over 2 years now.... SARS-COV-2 IS A HORRIBLE VIRUS. KIDS GET SICK FROM COVID AND SOME GET REALLY SICK. MANY ARE SICK FOR DAYS.",19,979,0,2022-05-10T16:56:50.000Z
1524030311117508608,@LaurenPelley,"NEW: @WHO says there are now 348 probable cases of acute hepatitis in children being investigated, with cases being reported in five different regions.",84,"1,431",0,2022-05-10T14:15:15.000Z
1524127451110064131,@ScottGottliebMD,"New analysis shows that the long term, neutralizing antibodies produced after recovery from a primary Omicron infection (in absence of vaccination) have a narrow specificity, suggesting they’re unlikely to provide robust protection against novel variants https://biorxiv.org/content/10.1101/2022.05.08.491108v1…",48,188,0,2022-05-10T20:41:15.000Z
1524046144459976704,@BNOFeed,CDC estimates that BA.2.12.1 accounts for 43% of daily coronavirus cases in the U.S. BA.2 has dropped to 56%,19,256,0,2022-05-10T15:18:10.000Z
1524025167336382466,@InfectiousDz,relevant re: vaccine misinformation and hesitancy,1,5,0,2022-05-10T13:54:49.000Z
1523814334727553025,@EricTopol,"Another Paxlovid relapse case, adding to our concerns about the 5-day blister pack length of treatment with a variant (BA.2/BA2.12.1) not assessed in the clinical trials (w/ very rare rebound). Given the importance of Paxlovid as a backstop Rx, this needs to be urgently addressed",87,591,0,2022-05-09T23:57:03.000Z
