tweet_id,user,text,num_comments,num_retweets,num_views,timestamp
1566913149294485511,@BBCBreaking,"Saskatchewan stabbing suspect Damien Sanderson has been found dead, police say, but his brother is still at large",56,264,0,2022-09-05T22:16:21.000Z
1566753987847667712,@BBCBreaking,Liz Truss will be the UK's new prime minister after beating Rishi Sunak in the race to lead the Conservative Party https://bbc.in/3TLRyEP,880,"3,694",0,2022-09-05T11:43:54.000Z
1566551647597330433,@BBCBreaking,At least 10 people killed and 15 injured in stabbing attacks across Canadian province of Saskatchewan,189,952,0,2022-09-04T22:19:52.000Z
1566423519822594049,@BBCBreaking,"Two men arrested over killing of nine-year-old Olivia Pratt-Korbel in Liverpool, UK, with one held on suspicion of murder",75,178,0,2022-09-04T13:50:44.000Z
1566341479043309569,@BBCBreaking,Tory leadership favourite Liz Truss tells BBC's Laura Kuenssberg she'll reveal action on energy bills within a week if she becomes UK PM - but refuses to give details https://bbc.in/3TFSkTC,343,266,0,2022-09-04T08:24:44.000Z
1566084638854074368,@BBCBreaking,Nasa aborts second attempt to launch giant Moon rocket after engineers fail to fix leak in hydrogen tank,231,418,0,2022-09-03T15:24:09.000Z
1566066961120993281,@BBCBreaking,"\"The impact of war is tough but as the UK \"\"counts pennies\"\"","Ukraine \"\"counts casualties\"\"","first lady Olena Zelenska tells BBC's Laura Kuenssberg\"",447,480
1562104285621526529,@BBCBreaking,"Student nurse Owami Davies, 24, found alive and well in Hampshire, more than six weeks after going missing in south London",342,"2,265",0,2022-08-23T15:47:38.000Z
1562044332718395392,@BBCBreaking,"Police give news conference after nine-year-old girl shot dead at a house in Liverpool, England Follow live updates https://bbc.in/3T3Mf3b",116,185,0,2022-08-23T11:49:24.000Z
1561744695591575553,@BBCBreaking,Lionesses' record scorer Ellen White announces retirement from football after winning Euro 2022 with England,86,132,0,2022-08-22T15:58:45.000Z
1561681851420385280,@BBCBreaking,Russia blames Ukraine security service for explosion that killed daughter of close ally to President Putin Follow live updates https://bbc.in/3pBiKIk,241,192,0,2022-08-22T11:49:02.000Z
1561628339189817345,@BBCBreaking,"Criminal barristers in England and Wales vote to go on all-out strike, delaying thousands of cases",248,508,0,2022-08-22T08:16:24.000Z
1561384901567455232,@BBCBreaking,"Boxer Tyson Fury makes emotional plea over knife crime, as police confirm his cousin Rico Burton stabbed to death in Greater Manchester",138,191,0,2022-08-21T16:09:04.000Z
1560658890844667904,@BBCBreaking,Ex-British jihadist El Shafee Elsheikh - one of the 'Isis Beatles' - sentenced to life in prison by US court,200,199,0,2022-08-19T16:04:09.000Z
1560628630862053376,@BBCBreaking,"Finland's Prime Minister Sanna Marin says she has taken drug test, after new footage emerged showing the leader partying",708,639,0,2022-08-19T14:03:55.000Z
1559794378708848640,@BBCBreaking,"Thames Water, which has 15 million customers across the south of England, says hosepipe ban will start on 24 August",311,337,0,2022-08-17T06:48:54.000Z
1559785144269029376,@BBCBreaking,"UK prices jumped by 10.1% in the 12 months to July, as the cost of living continued to rise at the highest rate for 40 years https://bbc.in/3pq1jKF",218,688,0,2022-08-17T06:12:12.000Z
1559572830794272768,@BBCBreaking,UK ministers were warned Rwandan government kills political opponents before attempting to send asylum seekers there,250,849,0,2022-08-16T16:08:32.000Z
1559565436219424773,@BBCBreaking,Pop idol and West End star Darius Danesh dies aged 41,380,"1,448",0,2022-08-16T15:39:09.000Z
1559504388766433280,@BBCBreaking,Jeremy Paxman to step down as host of BBC TV quiz University Challenge after 28 years,273,403,0,2022-08-16T11:36:35.000Z
1559426428067782656,@BBCBreaking,"UK wages fell at the fastest rate on record between April and June - dropping 3% after inflation, official figures show",302,760,0,2022-08-16T06:26:47.000Z
1559198084005085191,@BBCBreaking,"William Ruto declared winner of Kenya’s presidential election, as scuffles and claims of vote-rigging break out ahead of announcement",150,495,0,2022-08-15T15:19:26.000Z
1555215423548841991,@BBCBreaking,US basketball star Brittney Griner given nine-year jail term by Russian court on drug charges,351,841,0,2022-08-04T15:33:46.000Z
1555212407391264769,@BBCBreaking,"Four US police officers charged over death of Breonna Taylor, who was shot dead during raid on her home",176,"1,740",0,2022-08-04T15:21:47.000Z
1555200808484052992,@BBCBreaking,BBC launches inquiry into response to claims against DJ Tim Westwood,134,121,0,2022-08-04T14:35:41.000Z
1555147628731682818,@BBCBreaking,UK interest rates rise to 1.75% from 1.25% - the biggest increase in 27 years,268,595,0,2022-08-04T11:04:22.000Z
1554481245396033536,@BBCBreaking,"\"Top US politician Nancy Pelosi lands in Taiwan despite warnings from China that Washington will \"\"pay the price\"\" for the visit Follow live updates https://bbc.in/3JrwDBS\"",545,"1,394",0,2022-08-02T14:56:24.000Z
1554482882483261440,@BBCBreaking,US Democrat Nancy Pelosi leaves the plane at the airport in Taiwan The trip is the first by such a senior US official in decades https://bbc.in/3PUxNIN,284,"1,007",0,2022-08-02T15:02:54.000Z
1554475550575558658,@BBCBreaking,Man charged under Treason Act with intention to injure or alarm the Queen in Christmas Day incident at Windsor Castle,217,338,0,2022-08-02T14:33:46.000Z
1554360828203335680,@BBCBreaking,"BP reports huge profits of nearly £7bn ($8.45bn), the second highest in the company's history, after oil and gas prices soared",840,"2,239",0,2022-08-02T06:57:54.000Z
1554250794244907008,@BBCBreaking,"The US has killed the head of al-Qaeda, Ayman al-Zawahiri, in a drone strike in Afghanistan, President Joe Biden says",311,659,0,2022-08-01T23:40:40.000Z
1553997405976252417,@BBCBreaking,First ship carrying grain leaves Ukrainian port in deal with Russia aimed at easing a global food crisis,158,414,0,2022-08-01T06:53:48.000Z
1553811057990320128,@BBCBreaking,England are women's Euro 2022 champions after beating Germany 2-1 in nail-biting Wembley final following extra time https://bbc.in/3Bvlrm4,333,"1,612",0,2022-07-31T18:33:19.000Z
1553804419711619075,@BBCBreaking,"Deividas Skebas, 22, charged with murder of nine-year-old girl who was stabbed in a Lincolnshire street",157,203,0,2022-07-31T18:06:56.000Z
1553397619476553728,@BBCBreaking,"22-year-old man arrested on suspicion of murder after death of nine-year-old Lillia Valutyte in Lincolnshire, England",216,249,0,2022-07-30T15:10:27.000Z
1553043703668871175,@BBCBreaking,"Nine-year-old girl who died after being stabbed in Boston, England named as Lilia Valutyte",163,151,0,2022-07-29T15:44:07.000Z
1553039266464284674,@BBCBreaking,"More than 4,000 victims of contaminated blood scandal in the UK should each receive £100,000 in compensation without delay, says judge",92,174,0,2022-07-29T15:26:29.000Z
1552974191711997952,@BBCBreaking,"Rebekah Vardy loses libel case against Coleen Rooney, bringing “Wagatha Christie” trial to an end https://bbc.in/3JeSexq",409,694,0,2022-07-29T11:07:54.000Z
1552955165245902848,@BBCBreaking,Two people arrested after nine-year-old girl dies in suspected stabbing in UK town,121,187,0,2022-07-29T09:52:18.000Z
1552944196243361794,@BBCBreaking,"Former police officer Wayne Couzens, serving whole-life term for murder of Sarah Everard, loses appeal to reduce sentence",300,339,0,2022-07-29T09:08:43.000Z
