tweet_id,user,text,num_comments,num_retweets,num_views,timestamp
1640508507752472578,@BBCWorld,Ukraine war: Germany sends much-awaited Leopard tanks,106,127,295.7K,2023-03-28T00:18:02.000Z
1640496488298971138,@BBCWorld,What to make of Kim Jong Un and North Korea's barrage of weapon tests,58,48,202.6K,2023-03-27T23:30:16.000Z
1640488630966689792,@BBCWorld,Israeli Prime Minister Benjamin Netanyahu delays legal reforms after day of strikes,21,36,161.8K,2023-03-27T22:59:03.000Z
1640483185065639937,@BBCWorld,"Ex-British soldier Stuart Coburn unlawfully killed trying to defuse bomb in Iraq, inquest finds",17,38,180.3K,2023-03-27T22:37:24.000Z
1640475370766909441,@BBCWorld,"Osprey chick migrates 4,000 miles from Scotland to Barbados",38,108,212.8K,2023-03-27T22:06:21.000Z
1640474309142495232,@BBCWorld,Mississippi tornado survivors reckon with destruction,17,23,171.1K,2023-03-27T22:02:08.000Z
1640345658518298624,@BBCWorld,A ghost town in the world's most populated country,19,46,177.9K,2023-03-27T13:30:55.000Z
1640337922862772224,@BBCWorld,Alibaba founder Jack Ma back in China after three years,34,44,203.7K,2023-03-27T13:00:11.000Z
1640329993279397889,@BBCWorld,Twitter says parts of its source code have been leaked online,69,142,315.7K,2023-03-27T12:28:40.000Z
1640319210575282177,@BBCWorld,Japan demands China release Astellas Pharma employee accused of spying,43,77,259.5K,2023-03-27T11:45:50.000Z
1640312102278529028,@BBCWorld,What is the judicial reform crisis in Israel about?,32,77,202.7K,2023-03-27T11:17:35.000Z
1640306910128742406,@BBCWorld,Eurovision contenders compete to win over superfans in 'pre-party' stage,8,19,147.4K,2023-03-27T10:56:57.000Z
1639629878051106816,@bbcworldservice,"\"\"\"I want to be Salme.\"\" The Finnish 82-year-old with a black belt in taekwondo More on living well as we get older https://bbc.in/3yYc3ET\"",40,518,552.9K,2023-03-25T14:06:40.000Z
1640293658707517441,@BBCWorld,“The trailer flattened down flat… my uncle was inside” Residents in Mississippi tell of moment tornado tore through their town https://bbc.in/3TJjwkX,22,76,190K,2023-03-27T10:04:18.000Z
1640290399947202560,@BBCWorld,Tens of thousands of people took to streets across Israel overnight in protest after Prime Minister Benjamin Netanyahu fired his defence minister Read the latest here,88,210,348K,2023-03-27T09:51:21.000Z
1640285556864167936,@BBCWorld,"\"\"\"When I see the boys going to school","it hurts\"\" Afghan teenage girls \"\"broken\"\" after being barred from attending school under Taliban\"",413,778,605.1K
1640277733962833920,@BBCWorld,'My uncle's trailer was flattened by the tornado - he was inside',14,25,143.7K,2023-03-27T09:01:01.000Z
