tweet_id,user,text,num_comments,num_retweets,num_views,timestamp
1603777298456526849,@BBCBreaking,"\"Lady Susan Hussey has apologised in person to charity boss Ngozi Fulani for asking her where she was \"\"really from\"\"\"","1,517",393,1.7M,2022-12-16T15:41:19.000Z
1601982134494920705,@BBCBreaking,"Number of people in critical condition after being pulled from UK lake amid freezing temperatures, police say",203,360,0,2022-12-11T16:47:58.000Z
1601914551611555843,@BBCBreaking,"Libyan man accused of making bomb which destroyed Pan Am flight over Lockerbie 34 years ago is now in US custody, Scottish authorities say",218,609,0,2022-12-11T12:19:25.000Z
1601862717744324609,@BBCBreaking,A search for people missing after an explosion at a block of flats in Jersey that left three people dead has found no signs of life,60,127,0,2022-12-11T08:53:27.000Z
1601683801058742272,@BBCBreaking,England knocked out of the World Cup after being beaten by France https://bbc.in/3FDMKfv,870,694,0,2022-12-10T21:02:30.000Z
1601622881867206656,@BBCBreaking,Morocco become first ever African side to reach World Cup semi-finals with shock win over Portugal Live reaction: https://bbc.in/3FeFk0Z,328,"1,203",0,2022-12-10T17:00:26.000Z
1601620113052299264,@BBCBreaking,"At least three people are now known to have died after explosion at block of flats in St Helier, Jersey, in the Channel Islands https://bbc.in/3HlwgtP",57,117,0,2022-12-10T16:49:26.000Z
1601520213425627137,@BBCBreaking,"One dead and about 12 people missing after block of flats collapses in explosion on Jersey, in the Channel Islands",134,361,0,2022-12-10T10:12:28.000Z
1601167536535605251,@BBCBreaking,Basketball star Brittney Griner lands in US after being freed in a prisoner swap with Russia,624,233,0,2022-12-09T10:51:03.000Z
1601161044180836352,@BBCBreaking,Serving Metropolitan Police officer charged with two counts of rape in connection with alleged incidents in London and Surrey this year,191,576,0,2022-12-09T10:25:15.000Z
1600887030732431362,@BBCBreaking,"US citizen Anne Sacoolas given eight month suspended sentence for causing death of teenage motorcyclist Harry Dunn in Northamptonshire, UK",727,453,0,2022-12-08T16:16:25.000Z
1600840977559830528,@BBCBreaking,"\"US basketball star Brittney Griner freed by Russia in prisoner swap deal for \"\"Merchant of Death\"\" arms dealer Viktor Bout\"",753,820,0,2022-12-08T13:13:25.000Z
1600806573181489152,@BBCBreaking,"Staff in tears, ambulance queues and frustrated patients - we're reporting from UK A&E departments as figures show record waits in England Follow live https://bbc.in/3FzUyyL",244,255,0,2022-12-08T10:56:43.000Z
1600607367200182300,@BBCBreaking,"Peru's president tries to dissolve parliament, is impeached, and then replaced in a day of political drama",225,471,0,2022-12-07T21:45:08.000Z
1600557196294627328,@BBCBreaking,UK government approves first new coal mine in decades despite concerns among Conservative MPs and experts about climate impact,677,975,0,2022-12-07T18:25:47.000Z
1600509245547585537,@BBCBreaking,"UK Border Force staff to strike over Christmas at Heathrow, Gatwick and several other airports, PCS union says",448,742,0,2022-12-07T15:15:14.000Z
1596245320689909762,@BBCSport,"Nothing in it. But it does mean there's everything to play for in England v Wales on Tuesday, live on the BBC! #BBCFootball #BBCWorldCup",698,"1,109",0,2022-11-25T20:51:55.000Z
1596239339784409088,@BBCBreaking,"\"London Fire Brigade is \"\"institutionally misogynist and racist\"\"","says damning review into its culture\"",420,379,0
1596156830165929986,@BBCSport,"FT: 1-3 A big performance from Senegal gets them up and running in Group A. It's not looking good for the hosts, who could be eliminated later today. Reaction on @BBCiPlayer , on @BBCSounds & get more on the @BBCSport app #BBCFootball #BBCWorldCup",67,100,0,2022-11-25T15:00:18.000Z
1596120778424164353,@BBCBreaking,Former soldier is first veteran convicted of historical offence in Northern Ireland after being found guilty of manslaughter,206,250,0,2022-11-25T12:37:02.000Z
1596112359256457217,@BBCSport,"FT: Wales 0-2 Iran Late, late heartbreak for Rob Page's side Reaction on @BBCiPlayer and the @BBCSport app #BBCFootball #BBCWorldCup",483,393,0,2022-11-25T12:03:35.000Z
1595931914904403969,@BBCBreaking,"Nurses in England, Wales and Northern Ireland set for biggest walkout in NHS history as they announce strikes on 15 an",227,466,0,2022-11-25T00:06:34.000Z
1595839603679830018,@BBCBreaking,"Man charged with murdering a mother and her two daughters who died after a flat fire in Nottingham, UK",67,107,0,2022-11-24T17:59:45.000Z
1595781495113015298,@BBCBreaking,"Doctors who treated five-year-old Logan Mwangi months before his murder failed to raise concern over injuries with child protection, review finds",79,135,0,2022-11-24T14:08:51.000Z
1595433663071604736,@BBCBreaking,"\"\"\"Space is for everyone\"\"","says British Paralympian John McFall chosen as first disabled astronaut by European Space Agency https://bbc.in/3tVswHw\"",101,274,0
1595408034414874625,@BBCBreaking,Power cuts reported in Ukraine and neighbouring Moldova after Russia launches missile strikes across Ukraine,128,222,0,2022-11-23T13:24:51.000Z
1595356873875767298,@BBCBreaking,"The Scottish government cannot hold an independence referendum without UK government’s consent, Supreme Court rules https://bbc.in/3V2zOF8",490,"1,002",0,2022-11-23T10:01:33.000Z
1595301304796319744,@BBCBreaking,"Up to 10 people killed by gunman in a Walmart supermarket in US state of Virginia, police say",327,668,0,2022-11-23T06:20:44.000Z
1592699200982097921,@BBCBreaking,"Donald Trump files paperwork to run for US president again in 2024, and is expected to speak within minutes https://bbc.in/3tycdAd",476,"1,193",0,2022-11-16T02:00:55.000Z
1592514444235780096,@BBCBreaking,"Kyiv has been attacked by missiles, the city's mayor says, as world leaders condemn Russia's invasion of Ukraine",380,828,0,2022-11-15T13:46:45.000Z
1592425505554325506,@BBCBreaking,"UK wages rise at fastest rate in more than 20 years but still lag behind cost of living, official figures show",157,153,0,2022-11-15T07:53:21.000Z
1592414140521668609,@BBCBreaking,"UK PM Rishi Sunak condemns Russia’s “barbaric war” and warns China poses threat to economic security, as world leaders' summit begins https://bbc.in/3ADJDl5",178,188,0,2022-11-15T07:08:11.000Z
1592096851213586437,@BBCBreaking,"US President Biden shakes hands with Chinese President Xi Jinping in Bali, stressing the need to avoid conflict https://bbc.in/3GeiIQ4",153,234,0,2022-11-14T10:07:23.000Z
1592089642903474178,@BBCBreaking,"\"Ukraine's President Zelensky visits recently recaptured city Kherson, telling troops \"\"we are moving forward\"\"\"",293,533,0,2022-11-14T09:38:45.000Z
1591800404006010882,@BBCBreaking,Explosion hits busy shopping area in centre of Istanbul with several people reported injured,149,823,0,2022-11-13T14:29:25.000Z
1591861585190031366,@BBCBreaking,"Istanbul blast which killed six and injured 81 was act of terrorism, possibly carried out by a woman, Turkey's vice president says",85,333,0,2022-11-13T18:32:31.000Z
1591617649481551874,@BBCBreaking,Democrats retain majority control of US Senate after President Joe Biden’s party projected to win key race in Nevada https://bbc.in/3hCkGzM,185,710,0,2022-11-13T02:23:13.000Z
1591536640413126658,@BBCBreaking,"Keith Levene, a founding member of The Clash and guitarist for Public Image Ltd, has died aged 65, his friend says",89,874,0,2022-11-12T21:01:19.000Z
1591274106862931970,@BBCBreaking,"Democrats projected to win seat in Arizona, leaving the race for the US Senate neck and neck with two states to go",149,235,0,2022-11-12T03:38:06.000Z
1591074180212363267,@BBCBreaking,"\"Ukraine's army \"\"almost in full control\"\" of strategic city of Kherson after Russian withdrawal","Ukrainian defence spokesman tells BBC https://bbc.in/3fYM3mU\"",138,290,0
1591024834695380992,@BBCBreaking,Man arrested in Scottish hospital is ruled to be missing US fugitive who faked his own death,113,372,0,2022-11-11T11:07:35.000Z
1591015974110887936,@BBCBreaking,"All Russian troops have withdrawn from occupied Ukrainian city of Kherson and the surrounding area, Russia's defence ministry says https://bbc.in/3EkzsUx",206,406,0,2022-11-11T10:32:22.000Z
1590965713786867712,@BBCBreaking,UK economy shrank by 0.2% between July and September in what is widely expected to be start of recession,303,556,0,2022-11-11T07:12:39.000Z
1586382183706624001,@BBCBreaking,"Dozens of people in Halloween crowds treated for cardiac arrest in nightlife area of South Korean capital Seoul, officials say https://bbc.in/3Ni9802",214,"1,609",0,2022-10-29T15:39:20.000Z
1586372967260471297,@BBCBreaking,"\"Russia halts participation in Ukraine grain corridor deal citing \"\"massive drone attack\"\" on its Black Sea Fleet\"",235,501,0,2022-10-29T15:02:43.000Z
1586045117420412930,@BBCBreaking,"Jerry Lee Lewis, notorious singer behind Great Balls of Fire, dies aged 87",246,690,0,2022-10-28T17:19:57.000Z
1585937239623753728,@BBCBreaking,Woman who murdered and decapitated her friend given minimum 34-year jail term in sentencing broadcast live from UK court https://bbc.in/3zr6BLA,103,164,0,2022-10-28T10:11:17.000Z
1585940818266923011,@BBCBreaking,"\"\"\"You have shown absolutely no remorse and it appears that you are in complete denial as to what you did\"\" Judge Marks sentences Jemma Mitchell for killing of Mee Kuen Chong https://bbc.in/3fcXzL4\"",40,118,0,2022-10-28T10:25:31.000Z
1585801229074137090,@BBCBreaking,"Elon Musk completes his $44bn takeover of Twitter and fires several top executives, US media report",483,"2,187",0,2022-10-28T01:10:50.000Z
1585714265692016643,@BBCBreaking,"One dead and several injured, including on loan Arsenal footballer Pablo Marí, in mass stabbing in Italy, media report",136,916,0,2022-10-27T19:25:16.000Z
1585655388027981830,@BBCBreaking,"UK Prime Minister Rishi Sunak will not attend the COP27 climate conference in Egypt next month, No 10 says",628,861,0,2022-10-27T15:31:19.000Z
1584862619642503169,@BBCBreaking,"\"Prime Minister Rishi Sunak says he will fix mistakes made by Liz Truss as he warns of \"\"profound economic crisis\"\" facing UK https://bbc.in/3SzdJwb\"",330,277,0,2022-10-25T11:01:08.000Z
1584857155605336070,@BBCBreaking,See the moment Rishi Sunak meets King Charles at Buckingham Palace as he becomes the UK's third prime minister in a year Follow live https://bbc.in/3SNPDhn,160,212,0,2022-10-25T10:39:25.000Z
1584838786197987328,@BBCBreaking,"\"\"\"I know brighter days lie ahead\"\" UK's shortest-serving PM Liz Truss leaves Downing Street with family\"",196,190,0,2022-10-25T09:26:26.000Z
1584600252509786124,@BBCBreaking,Rishi Sunak to take over as UK prime minister on Tuesday morning after meeting King Charles https://bbc.in/3SreMOp,422,805,0,2022-10-24T17:38:35.000Z
1584563215362654208,@BBCBreaking,Rishi Sunak speaks publicly for the first time since being named UK's next prime minister https://bbc.in/3f0Ji4e,238,382,0,2022-10-24T15:11:24.000Z
1584565235125477379,@BBCBreaking,"\"\"\"I pledge that I will serve you with integrity and humility\"\" Rishi Sunak promises to \"\"work day in day out to deliver for the British people\"\" in first public speech since being named next UK PM https://bbc.in/3TzoEXS\"",788,"1,759",0,2022-10-24T15:19:26.000Z
1584530924506595328,@BBCBreaking,"Rishi Sunak set to become the UK's first British Asian prime minister, as Penny Mordaunt withdraws from Conservative Party leadership race https://bbc.in/3TNJoe3",960,"5,215",0,2022-10-24T13:03:06.000Z
1581877654185078785,@BBCBreaking,New UK Chancellor Jeremy Hunt to set out plans for tax and spending in a statement later today - two weeks earlier than expected,175,243,0,2022-10-17T05:19:57.000Z
1581868406747250688,@BBCBreaking,"Kyiv has been attacked by kamikaze drones, Ukraine says, one week after widespread Russian strikes on the country",198,774,0,2022-10-17T04:43:12.000Z
1581309651022671873,@BBCBreaking,"Manchester United footballer Mason Greenwood charged with attempted rape, engaging in controlling behaviour and assault, CPS says https://bbc.in/3CybCmh",429,"1,106",0,2022-10-15T15:42:54.000Z
1581183771822690305,@BBCBreaking,"\"UK Chancellor Jeremy Hunt tells BBC that some taxes will have to go up and he will ask all areas of government to find \"\"difficult\"\" savings https://bbc.in/3S3HswS\"",372,318,0,2022-10-15T07:22:42.000Z
1581195035760287745,@BBCBreaking,"\"\"\"We are not going to be able to cut taxes as quickly as we wanted to and some taxes will have to go up\"\" Chancellor says keeping the rises in interest rates as low as possible means \"\"we have to give certainty to markets\"\" over funding plans https://bbc.in/3D03pbT\"",259,180,0,2022-10-15T08:07:28.000Z
1580965102391504904,@BBCBreaking,"Actor Robbie Coltrane, who played Hagrid in the Harry Potter films, has died at 72","1,851",18.8K,0,2022-10-14T16:53:47.000Z
1580973594498453504,@BBCBreaking,"Robbie Coltrane obituary: Actor who could be funny or serious, but always compelling",109,454,0,2022-10-14T17:27:32.000Z
1580916533181952004,@BBCBreaking,UK Prime Minister Liz Truss to keep increase in corporation tax in reversal of plan in mini-budget https://bbc.in/3rWf0T1,128,171,0,2022-10-14T13:40:48.000Z
1580917509381050369,@BBCBreaking,"\"\"\"The way we are delivering our mission right now has to change\"\" UK Prime Minister Liz Truss announces U-turn on corporation tax - she will keep the planned increase in order to \"\"reassure the markets of our fiscal discipline\"\" https://bbc.in/3S1knLh\"",220,187,0,2022-10-14T13:44:40.000Z
1580913964971659265,@BBCBreaking,"UK Prime Minister Liz Truss about to hold press conference after sacking her chancellor, with another U-turn expected on the government's mini-budget",310,230,0,2022-10-14T13:30:35.000Z
1580906026257481728,@BBCBreaking,"Jeremy Hunt appointed new UK chancellor, after Kwasi Kwarteng sacked by PM Liz Truss https://bbc.in/3rTgwp5",432,728,0,2022-10-14T12:59:03.000Z
1580882677636349953,@BBCBreaking,Kwasi Kwarteng out as UK chancellor after mini-budget sparked financial turmoil and revolt from Conservative MPs https://bbc.in/3CrmYIs,"1,080","4,067",0,2022-10-14T11:26:16.000Z
1580893919097024512,@BBCBreaking,Kwasi Kwarteng confirms he was sacked as chancellor by UK Prime Minister Liz Truss https://bbc.in/3ewa0kR,123,368,0,2022-10-14T12:10:56.000Z
1580864045749452800,@BBCBreaking,UK Prime Minister Liz Truss to hold news conference later today amid reports of U-turn over mini-budget tax measures Latest https://bbc.in/3TnQFRS,200,298,0,2022-10-14T10:12:14.000Z
1580810162658385920,@BBCBreaking,"Royal Mail says it plans to make up to 6,000 people redundant by next August, blaming ongoing strikes and financial losses",531,792,0,2022-10-14T06:38:07.000Z
1578311874726268929,@BBCBreaking,"Nobel Peace Prize awarded to Belarusian campaigner Ales Bialiatski, as well as a Russian and a Ukrainian human rights group https://bbc.in/3CFo199",107,352,0,2022-10-07T09:10:49.000Z
1578315051974402048,@BBCBreaking,"Norwegian Nobel Committee Chair Berit Reiss-Andersen says the award honours “three outstanding champions of human rights, democracy and peaceful co-existence” in Russia, Ukraine and Belarus https://bbc.in/3CFo199",61,192,0,2022-10-07T09:23:26.000Z
1578082305658191878,@BBCBreaking,Ex-Met Police officer arrested after a BBC investigation revealed he had been posting racist content on WhatsApp,167,244,0,2022-10-06T17:58:35.000Z
1578007893235867650,@BBCBreaking,"Homes in the UK face three-hour power cuts this winter in the worst case scenario if gas supplies run low, National Grid says",608,"1,161",0,2022-10-06T13:02:54.000Z
1577931304036868098,@BBCBreaking,Children are among at least 28 people killed in a gun and knife attack at a pre-school in Thailand,496,"7,729",0,2022-10-06T07:58:34.000Z
1577929666182127617,@BBCBreaking,Three more loud explosions hit Ukrainian city Zaporizhzhia hours after missiles struck apartment building in centre of town https://bbc.in/3V0vPtn,91,162,0,2022-10-06T07:52:03.000Z
1577671248036904963,@BBCBreaking,"Alec Baldwin reaches settlement over death of Halyna Hutchins, shot on set of film Rust last year",196,187,0,2022-10-05T14:45:11.000Z
1577601042660966400,@BBCBreaking,Liz Truss to give first speech as UK prime minister to Conservative Party conference after bruising few days https://bbc.in/3yh2dOH,166,108,0,2022-10-05T10:06:13.000Z
1577607904894615552,@BBCBreaking,Greenpeace protesters interrupt Liz Truss' first Conservative Party conference speech as UK prime minister and are removed by security https://bbc.in/3SU2iQ4,393,752,0,2022-10-05T10:33:29.000Z
1577380885766279187,@BBCBreaking,"Elon Musk's multi-billion dollar deal to buy Twitter is back on, according to documents filed with US authorities",302,539,0,2022-10-04T19:31:24.000Z
1577187780509171712,@BBCBreaking,"\"UK Prime Minister Liz Truss refuses to commit to Boris Johnson's pledge to raise benefits in line with inflation but tells BBC she will \"\"support the most vulnerable\"\" https://bbc.in/3CvD8lB\"",425,324,0,2022-10-04T06:44:04.000Z
1576878732186361857,@BBCBreaking,"Discovery of the genetic code of Neanderthals, a task previously thought impossible, wins Swedish scientist Svante Paabo a Nobel prize",416,737,0,2022-10-03T10:16:01.000Z
1576823293432176640,@BBCBreaking,"\"\"\"We get it","and we have listened\"\" Abolition of the 45p tax rate will not go ahead","confirms UK Chancellor Kwasi Kwarteng https://bbc.in/3e03jHv\"",624,761
1576733799630921728,@BBCBreaking,Lula ahead of Jair Bolsonaro after first round of Brazil’s presidential election - they face 30 October run-off vote https://bbc.in/3SUgHMl,451,248,0,2022-10-03T00:40:06.000Z
1576465694409068544,@BBCBreaking,At least 174 people have died in stampede at Indonesian football match sparked after police tear-gassed fans invading the pitch,567,"2,789",0,2022-10-02T06:54:45.000Z
1574109811641311239,@BBCBreaking,"Two boys, aged 15 and 16, charged with the murder of Khayri McLean, who was stabbed outside a school in Huddersfield",132,148,0,2022-09-25T18:53:19.000Z
1573258113708445698,@BBCBreaking,"Dame Hilary Mantel, author of the best-selling Wolf Hall trilogy, has died aged 70, her publisher says",438,"1,185",0,2022-09-23T10:28:58.000Z
1573233982250143744,@BBCBreaking,"The cap on UK bankers' bonuses is to be scrapped, Chancellor Kwasi Kwarteng confirms https://bbc.in/3S8FCvy",314,436,0,2022-09-23T08:53:05.000Z
1573234752248741889,@BBCBreaking,"\"\"\"We need global banks to create jobs here... and pay taxes here in London",not in Paris,"not in Frankfurt and not in New York\"\" Chancellor Kwasi Kwarteng announces UK cap on bankers' bonuses is to be scrapped https://bbc.in/3BHdRmz\"",264,225
1572957521882779650,@BBCBreaking,"\"UK rail workers to strike on 8 October \"\"effectively shutting down the railway network\"\"","RMT union says\"",417,742,0
1572948637856206850,@BBCBreaking,"National Insurance rise will be reversed from 6 November, UK chancellor confirms ahead of Friday's mini-budget",182,364,0,2022-09-22T13:59:13.000Z
1572905054096576515,@BBCBreaking,"UK interest rates rise to 2.25%, the highest level in 14 years, as Bank of England battles soaring prices",244,592,0,2022-09-22T11:06:02.000Z
1572890402457522177,@BBCBreaking,Five British nationals captured by Russian-backed forces in Ukraine have returned to UK,154,213,0,2022-09-22T10:07:49.000Z
1572871711741067266,@BBCBreaking,"Boy, 16, arrested on suspicion of murder after 15-year-old boy stabbed outside school in Huddersfield, UK",120,145,0,2022-09-22T08:53:33.000Z
1572635892107587584,@BBCBreaking,"Five British nationals held by Russian-backed forces in eastern Ukraine have been released, says UK PM Liz Truss https://bbc.in/3LyqDIO",135,204,0,2022-09-21T17:16:29.000Z
1572640061216145408,@BBCBreaking,"British man Aiden Aslin is among those who have been released in a prisoner swap between Ukraine and Russia, UK health minister says https://bbc.in/3UtYBC7",65,122,0,2022-09-21T17:33:03.000Z
1572606286365134854,@BBCBreaking,"\"US President Joe Biden attacks Russian President Vladimir Putin for \"\"shamelessly violating\"\" UN charter with Ukraine invasion https://bbc.in/3DHZ7qs\"",214,473,0,2022-09-21T15:18:50.000Z
1572620536169271296,@BBCBreaking,"\"US President Joe Biden says his nation wants Russia's war in Ukraine \"\"to end on just terms\"\" https://bbc.in/3UFwuAn\"",218,275,0,2022-09-21T16:15:28.000Z
1572615828859658245,@BBCBreaking,Donald Trump and three of his children hit by fraud lawsuit after New York investigation into family business,379,967,0,2022-09-21T15:56:46.000Z
1572612430240284673,@BBCBreaking,"\"\"\"This war is about extinguishing Ukraine's right to exist as a state - plain and simple\"\" US President Joe Biden says Russia's invasion of Ukraine should make people's \"\"blood run cold\"\" https://bbc.in/3R1r7YY\"",190,373,0,2022-09-21T15:43:15.000Z
1569399173212000257,@BBCBreaking,"Queen Elizabeth II's children - King Charles III, Princess Anne and Princes Andrew and Edward - stand vigil by her coffin in Edinburgh https://bbc.in/3TYzpDT",214,272,0,2022-09-12T18:54:55.000Z
1569320194790621185,@BBCBreaking,"The Queen's children, led by King Charles III, walk behind their mother's coffin in procession through Edinburgh https://bbc.in/3BAJsb6",179,255,0,2022-09-12T13:41:05.000Z
1569323928614572032,@BBCBreaking,"King Charles III, Princess Anne and Princes Andrew and Edward walk behind the Queen’s coffin along Edinburgh’s Royal Mile to St Giles’ Cathedral https://bbc.in/3Bwg1qm",166,702,0,2022-09-12T13:55:55.000Z
1569297891339997191,@BBCBreaking,King Charles III arrives at Palace of Holyroodhouse in Edinburgh as thousands line streets to see the Queen's coffin in procession https://bbc.in/3QwCtUx,60,160,0,2022-09-12T12:12:28.000Z
1569285238878048259,@BBCBreaking,One-minute silence to be held across UK on Sunday - the night before Queen Elizabeth II's funeral https://bbc.in/3BuUHSe,368,"2,501",0,2022-09-12T11:22:11.000Z
1569253495630430208,@BBCBreaking,Watch as King Charles III is due to arrive at Westminster to address MPs and peers before leading a procession behind the Queen's coffin in Scotland later https://bbc.in/3RX8lCS,77,140,0,2022-09-12T09:16:03.000Z
1569242172087582720,@BBCBreaking,"\"\"\"We smile knowing you and grandpa are reunited now","and both together in peace\"\" - Prince Harry's tribute to the Queen https://bbc.in/3S0jUJP\"",125,316,0
1568985653257408512,@BBCBreaking,Queen Elizabeth II's coffin arrives at Palace of Holyrood in Edinburgh where it will remain overnight https://bbc.in/3B7tmUT,150,374,0,2022-09-11T15:31:44.000Z
1568988697260969984,@BBCBreaking,Queen's coffin greeted with guard of honour before being carried into Holyroodhouse https://bbc.in/3B95eRw,193,778,0,2022-09-11T15:43:50.000Z
1568978949165797376,@BBCBreaking,Queen’s funeral cortege is arriving in Edinburgh where thousands of people are lining the streets https://bbc.in/3B7qDe7,88,245,0,2022-09-11T15:05:06.000Z
1568887329560961028,@BBCBreaking,First stage of Queen Elizabeth II's final journey about to begin as her coffin is driven from Balmoral to Edinburgh https://bbc.in/3d6u6l6,212,405,0,2022-09-11T09:01:02.000Z
1568637084868526080,@BBCBreaking,"Princes William and Harry, joined by Catherine and Meghan, view floral tributes to Queen at Windsor https://bbc.in/3TSlJtQ",195,341,0,2022-09-10T16:26:39.000Z
1568643723939962881,@BBCBreaking,"Prince William and Catherine, along with Prince Harry and Meghan, view tributes in their first public appearance together since the passing of the Queen http://bbc.in/3TSlJtQ",348,"1,587",0,2022-09-10T16:53:02.000Z
1568631657174892546,@BBCBreaking,Queen Elizabeth II's funeral will be held on Monday 19 September at Westminster Abbey after she lies in state for four days https://bbc.in/3BvHqJ7,280,"1,623",0,2022-09-10T16:05:05.000Z
1568627406239408129,@BBCBreaking,"\"Prince William says the Queen was \"\"by my side at my happiest moments. And she was by my side during the saddest days of my life\"\" https://bbc.in/3RUWCVq\"",140,571,0,2022-09-10T15:48:11.000Z
1567848519586775040,@BBCBreaking,Prince Charles and Camilla have arrived at Balmoral and Prince William is travelling there https://bbc.in/3qm8xjt,339,"4,843",0,2022-09-08T12:13:10.000Z
1567826845596254209,@BBCBreaking,"Energy bills for typical household in England, Scotland and Wales to be capped at £2,500 a year for next two years https://bbc.in/3x7nNoa",224,559,0,2022-09-08T10:47:03.000Z
1567635059217235968,@BBCBreaking,"Myles Sanderson, the Canadian mass stabbing suspect, has been arrested - ending manhunt that took in three provinces",79,338,0,2022-09-07T22:04:58.000Z
1567217102548877312,@BBCBreaking,"Suella Braverman, who stood against Liz Truss to become Tory leader, is made home secretary - follow live updates https://bbc.in/3cRpU8E",172,220,0,2022-09-06T18:24:09.000Z
1567215845251637248,@BBCBreaking,James Cleverly promoted to foreign secretary - follow latest updates on Liz Truss's new cabinet https://bbc.in/3BiIsYQ,85,103,0,2022-09-06T18:19:09.000Z
1567148094621376512,@BBCBreaking,First Minister Nicola Sturgeon announces rent freeze for public and private rented properties in Scotland to help people with rising bills,353,"1,268",0,2022-09-06T13:49:56.000Z
1567118496424775683,@BBCBreaking,Liz Truss is now UK prime minister after meeting the Queen at Balmoral Castle https://bbc.in/3BqUkbv,248,484,0,2022-09-06T11:52:19.000Z
1567043300682604544,@BBCBreaking,"\"Outgoing PM Boris Johnson delivers final speech outside Downing Street, blaming UK's \"\"energy crisis\"\" on \"\"Putin's vicious war\"\" and urging Conservatives to get behind his successor Liz Truss https://bbc.in/3cQTN9a\"",207,227,0,2022-09-06T06:53:31.000Z
