tweet_id,user,text,num_comments,num_retweets,num_views,timestamp
1542899471679471619,@espn,"Simone Biles and Megan Rapinoe will be presented with the nation's highest civilian honor, the Presidential Medal of Freedom, by Joe Biden in a ceremony next week, the White House announced Friday","1,406","1,169",0,2022-07-01T15:54:34.000Z
1539353565680082953,@AaronBenRose,A man of the people: Pascal Siakam,5,30,0,2022-06-21T21:04:24.000Z
1539240485692243969,@jadande,"Magic throws a true ""He-HEEEE"" pass at the :54 mark",1,3,0,2022-06-21T13:35:04.000Z
1538965722801524738,@jadande,"3 rings, the Russell, the Magic and the Kobe. Steph didn't just bring the receipts, he brought the jewelry and the hardware.",9,37,0,2022-06-20T19:23:15.000Z
1538955516109500418,@annkillion,The Giants did that the first time. They're too low to the ground for everyone to see.,2,1,0,2022-06-20T18:42:42.000Z
1538955264413487104,@jadande,The Warriors should be on cable cars for the parade,2,3,0,2022-06-20T18:41:42.000Z
1538947971966021633,@jadande,"Stephen Curry thanks the fans for ""giving us the platform to go do amazing things that haven't been done in history."" Keep in mind that's always his motivation: what can we do that no one else in the game has ever done?",0,3,0,2022-06-20T18:12:43.000Z
1538935436323610624,@TheWarriorsTalk,Someone brought a goat in a Curry jersey to the parade,195,"3,988",0,2022-06-20T17:22:54.000Z
1538729760318074880,@OhThatsAT,"There's a special place in my heart for home videos of black house parties of the 80's and 90's. I love seeing our moms & dads, aunties & uncles, grandmas & grandpas, and big cousins & family friends ""getting down"" and dancing face-to-face in our living rooms and backyards",13,151,0,2022-06-20T03:45:37.000Z
1538655844635754496,@jadande,#GoCats,1,2,0,2022-06-19T22:51:54.000Z
1538612493383356416,@BlackPxPFund,"We will continue to push the play-by-play broadcast industry to be its best, which only will be achieved when all voices- especially black voices- are placed in positions to succeed. On Juneteenth we acknowledge these efforts are small, but emblematic of the work and... 1/3",1,3,0,2022-06-19T19:59:39.000Z
1538309364506841088,@jadande,When you go from 4 shots off the lead to 3 shots off the lead while in the clubhouse,1,3,0,2022-06-18T23:55:07.000Z
1537854089706541058,@sana_merch,": Hi Twitter fam! Several of our @NFL Clubs are hiring for social roles. Please help us spread the word! If you know someone who’d be a good fit for any of the roles, please have them apply via the links! #smsports #sportsbiz #openings",11,146,0,2022-06-17T17:46:01.000Z
1538271886928404480,@jadande,28,20,0,0,2022-06-18T21:26:12.000Z
1536437936887017472,@TalkinBaseball_,The Royals did an NBA themed road trip,247,"1,375",0,2022-06-13T19:58:44.000Z
1536370544979099650,@KelseyVolkmann,"“We are all in this together. It’s time we start acting like it,” @isabelwilkerson tells @northwesternu class of 2022. @ Northwestern Wildcats Stadium",0,1,0,2022-06-13T15:30:56.000Z
1536460768975142916,@ByLarryGraham,JOB ALERT http://Syracuse.com is searching for its next sports editor. You'll lead a very talented and diverse staff in charge of the newsroom's college sports coverage. Apply https://bit.ly/3MOfUsD #TakeTheDiversityPledge #journalismjobs,1,11,0,2022-06-13T21:29:28.000Z
1536385485211422720,@NorthwesternU,"Now it's official: Congratulations, Class of #NU2022!",0,27,0,2022-06-13T16:30:18.000Z
1536192510774624256,@jadande,I love how EGOT has turned into a verb,4,5,0,2022-06-13T03:43:30.000Z
1535959790731636737,@jadande,All the technology that goes into an #F1 car and the solution was to put some duct tape on it?,13,5,0,2022-06-12T12:18:45.000Z
1535951997240848387,@jadande,How They Shot “The Last Shot”,0,11,0,2022-06-12T11:47:47.000Z
1535480727499902977,@jadande,The stats are virtually identical for the series and yet the final score of each game has been a 10+ point differential,2,18,0,2022-06-11T04:35:07.000Z
1535351388980625409,@jadande,How ‘All the President’s Men’ went from buddy flick to masterpiece,2,2,0,2022-06-10T20:01:11.000Z
1534627566140932096,@jadande,Father’s Day is coming up (just saying),1,1,0,2022-06-08T20:04:58.000Z
1534348368322912256,@nyliberty,. @sabrina_i20 is going off today tonight!,9,71,0,2022-06-08T01:35:32.000Z
1534347336188674048,@TomlinDoesIt,Harold's Chcken is about as CHICAGO as it gets...its always the first stop whenever i get back from being away from the crib... @curlyfro captures the ESSENCE! and to see my ppl @ArionneNettles @larryislegend @MajaLeeg and @Jason1Goff featured too??...yall snapped!,2,7,0,2022-06-08T01:31:26.000Z
1534171242756214784,@HoyaHoopClub,"Happy Birthday Allen Iverson (1994-96)! @alleniverson was BIG EAST Rookie of the Year, twice BIG EAST Defensive Player of the Year, first team All-American, leader in career scoring average (22.9 pts/game), 1st overall NBA draft pick, Hall of Famer, among so much more.",2,37,0,2022-06-07T13:51:42.000Z
1534333847520923651,@NABJ,"#TestimonyTuesday: lt’s like Wakanda! …A place where there’s Black people who are driven, purpose-filled & willing to help others.” @kennabjvpbcast reflects on the fellowship @NABJ provides. (Part of the #NABJStriveFor5 Membership Drive). Join/renew today http://bit.ly/NABJStriveFor5",1,31,0,2022-06-08T00:37:50.000Z
1528105000181841920,@meanbarb,Amazing what you find when you decide to delete a bunch of old photos.,8,66,0,2022-05-21T20:06:37.000Z
1533491030468702208,@BA_Turner,"Really enjoyed this piece by talented ⁦ @latimessports ⁩ intern ⁦ @t_myah ⁩ on: Black surfers find moments of reflection, rejuvenation at ‘A Great Day in the Stoke’",0,8,0,2022-06-05T16:48:47.000Z
1533091979135004673,@jj_redick,"Episode 118 with NBA 75 and HOFer Gary Payton is live on all platforms. He gives candid insight on his career, trash talk, partying, 90s NBA, and challenges of today’s league. Plus a catch up with @mikal_bridges on WTF happened to the Suns.",13,12,0,2022-06-04T14:23:05.000Z
1532836233591652352,@jadande,"Making my long-awaited (by me, at least) return to @PTI today with my man Tony Kornheiser, coming up next on @ESPN",13,3,0,2022-06-03T21:26:51.000Z
1532496911340654593,@colinbphoto,"MISSING CAT: My cat ran away while I was at work today. He's very skittish but loves bread + the sound of a shaking food bag. Responds to ""Bean"" + a clicking sound. He is chipped, but does not wear a collar. If you see/find him, please DM me. Near Montrose/Sacramento, Albany Park",24,170,0,2022-06-02T22:58:30.000Z
1532433565325135872,@Ourand_SBJ,"With Mark Jones, Mark Jackson and Lisa Salters, tonight will be the first time an NBA Finals telecast will have all Black announcers.",16,298,0,2022-06-02T18:46:47.000Z
1532411597246894081,@apbenven,"Peace End gun violence Coco After advancing to the French Open final, Coco Gauff wrote this message on the camera.",5,281,0,2022-06-02T17:19:30.000Z
